ID,Nom,Email,Rôle,Téléphone,Pays,Ville,Date de naissance,Centres d'intérêt
22620,Ghada Mabrouk,ghada.mabrouk966@hotmail.com,apprenant,+21623224870,Tunisie,Sousse,1993-04-27,"Technologie, Blockchain, E-commerce, Veille technologique"
22621,Hajer Layouni,hajer.layouni298@topnet.tn,apprenant,+21657396175,Tunisie,Bizerte,1988-05-12,"Veille technologique, DevOps"
22622,Farouk Marzouki,farouk.marzouki914@yahoo.fr,apprenant,+21622874810,Tunisie,Jendouba,1999-04-25,"Ressources humaines, Analyse de données"
22623,Yosra Sellami,yosra.sellami154@topnet.tn,apprenant,+21656760843,Tunisie,Sousse,1986-10-26,"Management, Cloud computing"
22624,Cyrine Labidi,cyrine.labidi463@hotmail.com,apprenant,+21629692471,Tunisie,Le Kef,1998-08-08,"Innovation, Blockchain, Qualité, Technologie"
22625,Rim Gasmi,rim.gasmi385@live.com,apprenant,+21656345308,Tunisie,Sfax,1996-03-04,"Informatique, Machine learning, Développement web, Management, Entrepreneuriat"
22626,Makram Ouali,makram.ouali233@outlook.com,apprenant,+21656820547,Tunisie,Sidi Bouzid,1987-07-14,"Blockchain, Agile, Ressources humaines, Communication"
22627,Fatma Mansouri,fatma.mansouri567@orange.tn,apprenant,+21653229016,Tunisie,Gafsa,1995-05-07,"Communication, Machine learning, DevOps, Veille technologique, Lean management, Développement web"
22628,Ghazi Mejri,ghazi.mejri420@gmail.com,apprenant,+21628242647,Tunisie,Mahdia,1988-12-18,"Audit, Gestion de projet, Digital transformation, Blockchain"
22629,Zied Karoui,zied.karoui951@topnet.tn,apprenant,+21692940327,Tunisie,Monastir,2005-03-08,"Leadership, Audit"
22630,Aymen Nabli,aymen.nabli229@yahoo.fr,apprenant,+21658835760,Tunisie,Sidi Bouzid,1988-02-14,"Leadership, Informatique, ITIL, Certification"
22631,Dorsaf Karoui,dorsaf.karoui843@outlook.com,apprenant,+21658030959,Tunisie,Nabeul,1992-11-27,"Agile, Marketing digital, Digital transformation, Technologie"
22632,Jihene Chebbi,jihene.chebbi497@hotmail.com,apprenant,+21697803649,Tunisie,Bizerte,2002-06-15,"Audit, Agile"
22633,Taoufik Khlif,taoufik.khlif932@laposte.net,apprenant,+21691374924,Tunisie,Tunis,1994-01-26,"Stratégie d'entreprise, Technologie"
22634,Intissar Karoui,intissar.karoui688@live.com,apprenant,+21626956181,Tunisie,Kébili,2001-12-01,"Business intelligence, Développement web, Audit, Finance"
22635,Emad Chebbi,emad.chebbi440@orange.tn,apprenant,+21620484089,Tunisie,Mahdia,1990-04-26,"Entrepreneuriat, Communication, Finance, Coaching, Audit, Machine learning"
22636,Ines Marzouki,ines.marzouki754@hotmail.com,apprenant,+21693510289,Tunisie,Kébili,2003-01-31,"Entrepreneuriat, Formation professionnelle, Certification, Gestion de projet, DevOps, Développement web"
22637,Myriam Mestiri,myriam.mestiri501@hotmail.com,apprenant,+21629675669,Tunisie,Médenine,2004-09-22,"Qualité, Business intelligence, Finance"
22638,Sofiane Mansouri,sofiane.mansouri763@hotmail.com,apprenant,+21691948768,Tunisie,Béja,1992-03-09,"Mentoring, DevOps, Coaching, Conseil, Agile, Veille technologique"
22639,Zeineb Bouslama,zeineb.bouslama394@hotmail.com,apprenant,+21628338861,Tunisie,Mahdia,1990-08-06,"Développement web, Mentoring, Formation professionnelle, Intelligence artificielle, Digital transformation, Entrepreneuriat"
22640,Ikram Marzouki,ikram.marzouki147@gmail.com,apprenant,+21692315708,Tunisie,Mahdia,2003-06-19,"DevOps, Leadership, Qualité, Intelligence artificielle, Management, Certification"
22641,Bochra Bouaziz,bochra.bouaziz28@topnet.tn,apprenant,+21627458277,Tunisie,Ben Arous,1985-10-03,"Digital transformation, Conseil, Agile, Intelligence artificielle"
22642,Cyrine Landolsi,cyrine.landolsi287@topnet.tn,apprenant,+21654487461,Tunisie,Gabès,1993-04-12,"Finance, Technologie, Cybersécurité, Informatique, Innovation"
22643,Ali Limam,ali.limam321@gmail.com,apprenant,+21622051663,Tunisie,Gafsa,2004-02-13,"Développement web, Formation professionnelle, Lean management, Gestion de projet, Leadership"
22644,Youssef Rekik,youssef.rekik337@gmail.com,apprenant,+21655795479,Tunisie,Tozeur,1985-10-15,"Lean management, Ressources humaines"
22645,Bilel Omrani,bilel.omrani592@live.com,apprenant,+21654766924,Tunisie,Zaghouan,2006-05-02,"Veille technologique, Formation professionnelle, Lean management"
22646,Ali Jelassi,ali.jelassi368@hotmail.com,apprenant,+21656957245,Tunisie,Monastir,1988-10-19,"Leadership, Développement web, Cybersécurité, Management"
22647,Moncef Meddeb,moncef.meddeb486@live.com,apprenant,+21625153404,Tunisie,Béja,2003-05-07,"Entrepreneuriat, Coaching, Informatique, Audit, Agile"
22648,Nader Derbali,nader.derbali101@outlook.com,apprenant,+21625810597,Tunisie,Kasserine,1987-10-15,"Agile, Cybersécurité"
22649,Fatma Fatnassi,fatma.fatnassi680@hotmail.com,apprenant,+21694800305,Tunisie,Tunis,1997-03-20,"Agile, Entrepreneuriat, Stratégie d'entreprise, Business intelligence"
22650,Ghazi Nabli,ghazi.nabli101@hotmail.com,apprenant,+21657887658,Tunisie,Tataouine,1991-11-04,"Management, Marketing digital, Certification, ITIL, Conseil, DevOps"
22651,Dali Mrad,dali.mrad88@laposte.net,apprenant,+21691789032,Tunisie,Gafsa,2002-10-21,"Communication, Cybersécurité"
22652,Dorsaf Gharbi,dorsaf.gharbi124@laposte.net,apprenant,+21621695924,Tunisie,Kébili,1990-01-02,"Formation professionnelle, ITIL, Management"
22653,Kenza Dhouib,kenza.dhouib288@outlook.com,apprenant,+21696226093,Tunisie,Gafsa,1986-02-01,"Business intelligence, Audit"
22654,Dorra Bouaziz,dorra.bouaziz78@orange.tn,apprenant,+21659729553,Tunisie,Tozeur,1998-01-22,"Blockchain, Coaching"
22655,Yosra Jouini,yosra.jouini174@orange.tn,apprenant,+21695923709,Tunisie,Médenine,1985-07-23,"Digital transformation, Entrepreneuriat, Analyse de données, Marketing digital, Business intelligence"
22656,Ghazi Mahjoub,ghazi.mahjoub666@yahoo.fr,apprenant,+21698229279,Tunisie,Kébili,2003-05-20,"Analyse de données, Leadership, Entrepreneuriat, Agile"
22657,Intissar Chaieb,intissar.chaieb210@topnet.tn,apprenant,+21624948635,Tunisie,Tataouine,2001-07-15,"Digital transformation, Machine learning"
22658,Lobna Fatnassi,lobna.fatnassi532@laposte.net,apprenant,+21620008036,Tunisie,Manouba,1999-04-21,"Qualité, Audit, Leadership, Innovation, Intelligence artificielle, Finance"
22659,Noureddine Gasmi,noureddine.gasmi62@gmail.com,apprenant,+21653005048,Tunisie,Gabès,1991-11-20,"Digital transformation, Conseil, Management, Business intelligence, IoT"
22660,Intissar Hamdi,intissar.hamdi446@orange.tn,apprenant,+21624458871,Tunisie,Manouba,1998-03-03,"Développement web, Communication, Management, Technologie, Formation professionnelle, Entrepreneuriat"
22661,Omar Ben Ali,omar.ben.ali921@live.com,apprenant,+21653711408,Tunisie,Médenine,1999-03-31,"Informatique, Innovation, Finance, Certification, Gestion de projet"
22662,Wafa Jouini,wafa.jouini844@outlook.com,apprenant,+21657827696,Tunisie,Gabès,1993-04-27,"Mentoring, Innovation"
22663,Hiba Bouzid,hiba.bouzid278@gmail.com,apprenant,+21651817636,Tunisie,Le Kef,1986-03-26,"Formation professionnelle, Digital transformation, Entrepreneuriat, Marketing digital, Intelligence artificielle, Machine learning"
22664,Samia Ktari,samia.ktari52@outlook.com,apprenant,+21621782804,Tunisie,Tunis,2000-07-06,"Coaching, Technologie, IoT, Analyse de données, Finance, E-commerce"
22665,Ridha Khlif,ridha.khlif218@gmail.com,apprenant,+21629785397,Tunisie,Tunis,2000-07-07,"Communication, Leadership, Certification, Marketing digital, Coaching"
22666,Sofiane Jazi,sofiane.jazi938@outlook.com,apprenant,+21699918586,Tunisie,Sidi Bouzid,1991-06-16,"Stratégie d'entreprise, Intelligence artificielle, Agile"
22667,Rami Fourati,rami.fourati945@hotmail.com,apprenant,+21629586669,Tunisie,Sidi Bouzid,2003-04-17,"Communication, Ressources humaines, Analyse de données, Entrepreneuriat"
22668,Dalila Ouali,dalila.ouali522@gmail.com,apprenant,+21692048331,Tunisie,Béja,1988-04-16,"Technologie, Machine learning"
22669,Ahlem Miled,ahlem.miled668@topnet.tn,apprenant,+21623889654,Tunisie,Mahdia,2004-12-27,"Analyse de données, Agile, Gestion de projet, Conseil, Certification"
22670,Fethi Jazi,fethi.jazi884@orange.tn,apprenant,+21691279453,Tunisie,Manouba,1999-01-21,"Agile, Certification, Formation professionnelle, Blockchain, Stratégie d'entreprise"
22671,Aymen Louati,aymen.louati779@outlook.com,apprenant,+21690603422,Tunisie,Béja,1999-03-09,"Marketing digital, Gestion de projet, Conseil, DevOps"
22672,Aymen Feriani,aymen.feriani497@laposte.net,apprenant,+21657523393,Tunisie,Ariana,2001-04-12,"Conseil, Analyse de données, IoT, Blockchain, Mentoring, Machine learning"
22673,Besma Meddeb,besma.meddeb373@outlook.com,apprenant,+21658854990,Tunisie,Manouba,2004-07-10,"Mentoring, Développement web, Cybersécurité, Stratégie d'entreprise, Intelligence artificielle"
22674,Salma Fatnassi,salma.fatnassi47@gmail.com,apprenant,+21692200547,Tunisie,Manouba,2002-12-25,"ITIL, Cloud computing"
22675,Farah Chaabane,farah.chaabane642@orange.tn,apprenant,+21651653291,Tunisie,Kairouan,2003-04-11,"Agile, Audit, Coaching, Ressources humaines, Leadership, Intelligence artificielle"
22676,Zohra Karray,zohra.karray247@laposte.net,apprenant,+21626272932,Tunisie,Sousse,1997-08-25,"Conseil, Entrepreneuriat, Machine learning, Mentoring, Digital transformation, Agile"
22677,Jamel Jazi,jamel.jazi566@yahoo.fr,apprenant,+21695826856,Tunisie,Tataouine,1992-03-02,"Innovation, Management, Développement web, Stratégie d'entreprise, Machine learning"
22678,Mohamed Limam,mohamed.limam408@topnet.tn,apprenant,+21620668987,Tunisie,Tozeur,2005-10-19,"Entrepreneuriat, Agile, Mentoring, ITIL, Coaching, Lean management"
22679,Moncef Ezzine,moncef.ezzine397@yahoo.fr,apprenant,+21655533713,Tunisie,Ariana,1989-01-10,"Certification, Coaching, Finance, Conseil, ITIL, Cloud computing"
22680,Amel Bouhamed,amel.bouhamed936@outlook.com,apprenant,+21658526015,Tunisie,Monastir,1992-03-11,"E-commerce, Management, Lean management"
22681,Taoufik Ghanmi,taoufik.ghanmi83@outlook.com,apprenant,+21625012589,Tunisie,Gabès,1998-04-16,"Mentoring, Conseil, DevOps, Agile"
22682,Emna Gharbi,emna.gharbi63@orange.tn,apprenant,+21690584860,Tunisie,Gafsa,2006-06-15,"Communication, Ressources humaines"
22683,Rania Hadj,rania.hadj393@live.com,apprenant,+21694559162,Tunisie,Ben Arous,2001-09-21,"Ressources humaines, Veille technologique, Certification"
22684,Ahmed Ghali,ahmed.ghali296@gmail.com,apprenant,+21658344051,Tunisie,Bizerte,1987-02-24,"Business intelligence, Blockchain, ITIL, Qualité"
22685,Wided Ghorbel,wided.ghorbel354@hotmail.com,apprenant,+21622057849,Tunisie,Médenine,1997-09-01,"Cybersécurité, Business intelligence, IoT, ITIL, Innovation"
22686,Fatma Ghanmi,fatma.ghanmi892@orange.tn,apprenant,+21621792997,Tunisie,Ben Arous,2001-11-03,"Formation professionnelle, Mentoring"
22687,Besma Bouslama,besma.bouslama394@hotmail.com,apprenant,+21622282548,Tunisie,Tozeur,1987-09-13,"Lean management, Veille technologique, E-commerce, Stratégie d'entreprise, Gestion de projet"
22688,Rim Hmida,rim.hmida369@hotmail.com,apprenant,+21621257139,Tunisie,Jendouba,2001-04-11,"Cloud computing, Informatique, Coaching, Entrepreneuriat, Conseil"
22689,Bassem Mrad,bassem.mrad790@orange.tn,apprenant,+21623911731,Tunisie,Kairouan,1995-03-12,"Intelligence artificielle, Marketing digital, Communication"
22690,Maroua Hamdi,maroua.hamdi725@laposte.net,apprenant,+21624791797,Tunisie,Siliana,1992-09-22,"Technologie, Analyse de données"
22691,Yassine Omrani,yassine.omrani76@hotmail.com,apprenant,+21658410092,Tunisie,Gabès,2002-10-20,"Analyse de données, Agile"
22692,Ikram Fourati,ikram.fourati865@outlook.com,apprenant,+21624685986,Tunisie,Sidi Bouzid,1997-09-18,"Coaching, DevOps"
22693,Mohamed Omrani,mohamed.omrani583@topnet.tn,apprenant,+21626844647,Tunisie,Gafsa,1998-08-19,"Innovation, Communication, Certification, Conseil"
22694,Maroua Chedly,maroua.chedly625@hotmail.com,apprenant,+21628040768,Tunisie,Tataouine,2001-11-30,"Finance, Intelligence artificielle, Qualité"
22695,Slim Daoud,slim.daoud768@yahoo.fr,apprenant,+21628768351,Tunisie,Gafsa,1991-04-03,"Communication, Leadership, Développement web, Intelligence artificielle, Stratégie d'entreprise, Entrepreneuriat"
22696,Ines Mrad,ines.mrad927@yahoo.fr,apprenant,+21627337808,Tunisie,Tozeur,2007-10-11,"Qualité, Veille technologique, Intelligence artificielle, Marketing digital"
22697,Rania Landolsi,rania.landolsi178@topnet.tn,apprenant,+21652640211,Tunisie,Kasserine,1999-05-20,"Management, Communication"
22698,Ahmed Nasri,ahmed.nasri242@hotmail.com,apprenant,+21620018882,Tunisie,Béja,1986-09-24,"Business intelligence, Veille technologique, IoT, Intelligence artificielle, Finance"
22699,Walid Ouali,walid.ouali210@yahoo.fr,apprenant,+21656810878,Tunisie,Siliana,2003-03-02,"Lean management, Certification, ITIL, Ressources humaines"
22700,Wael Hassen,wael.hassen682@laposte.net,apprenant,+21623646329,Tunisie,Siliana,1985-01-04,"Communication, Veille technologique, Gestion de projet, Conseil, Coaching"
22701,Amine Jebali,amine.jebali297@gmail.com,apprenant,+21697662034,Tunisie,Bizerte,2005-11-17,"Marketing digital, Certification, Informatique"
22702,Hatem Mabrouk,hatem.mabrouk797@live.com,apprenant,+21626322437,Tunisie,Tataouine,1993-12-22,"Qualité, Certification, ITIL, Technologie, Management"
22703,Walid Mahjoub,walid.mahjoub80@hotmail.com,apprenant,+21699477162,Tunisie,Bizerte,1989-06-09,"Développement web, Veille technologique, Stratégie d'entreprise, Innovation"
22704,Wael Maaloul,wael.maaloul480@live.com,apprenant,+21627422488,Tunisie,Tunis,2003-05-27,"Agile, Informatique, Certification"
22705,Lobna Meddeb,lobna.meddeb87@live.com,apprenant,+21695379451,Tunisie,Tozeur,1991-04-20,"Technologie, Stratégie d'entreprise, Leadership, Développement web"
22706,Dorra Limam,dorra.limam999@laposte.net,apprenant,+21629899747,Tunisie,Gafsa,2002-07-20,"Innovation, Digital transformation, Informatique, Analyse de données"
22707,Bochra Ghanmi,bochra.ghanmi745@yahoo.fr,apprenant,+21625438425,Tunisie,Kébili,2001-01-21,"Finance, Formation professionnelle"
22708,Wassim Ben Salah,wassim.ben.salah614@gmail.com,apprenant,+21621992882,Tunisie,Kasserine,2002-03-24,"E-commerce, Formation professionnelle, Développement web"
22709,Amel Jemli,amel.jemli368@gmail.com,apprenant,+21623921458,Tunisie,Kasserine,1995-06-05,"Développement web, Entrepreneuriat, Marketing digital, Lean management, Formation professionnelle, Technologie"
22710,Salma Jazi,salma.jazi153@laposte.net,apprenant,+21620767066,Tunisie,Zaghouan,1989-08-22,"Audit, Entrepreneuriat, E-commerce, Agile, Lean management"
22711,Marwan Gabsi,marwan.gabsi589@live.com,apprenant,+21658445607,Tunisie,Le Kef,2005-07-12,"Technologie, Marketing digital, Cybersécurité, Certification, Digital transformation"
22712,Zouheir Dhouib,zouheir.dhouib852@laposte.net,apprenant,+21624484428,Tunisie,Sidi Bouzid,1993-11-02,"Certification, Management, Business intelligence, Marketing digital, Développement web"
22713,Nabil Ben Salah,nabil.ben.salah169@laposte.net,apprenant,+21624237751,Tunisie,Gafsa,1985-02-02,"Communication, Conseil, Technologie, Lean management, Digital transformation"
22714,Rania Bouaziz,rania.bouaziz909@hotmail.com,apprenant,+21650036396,Tunisie,Béja,1993-11-30,"Management, Coaching, Stratégie d'entreprise, ITIL, Gestion de projet, E-commerce"
22715,Ines Guizani,ines.guizani352@hotmail.com,apprenant,+21651365815,Tunisie,Médenine,2005-12-31,"Digital transformation, Gestion de projet, Agile"
22716,Noureddine Jazi,noureddine.jazi163@outlook.com,apprenant,+21622018853,Tunisie,Le Kef,2001-04-03,"Analyse de données, Agile, Informatique, Formation professionnelle, Management"
22717,Farouk Hachicha,farouk.hachicha465@gmail.com,apprenant,+21650634537,Tunisie,Tataouine,2006-11-20,"Communication, Informatique, Entrepreneuriat, Innovation, DevOps"
22718,Hiba Ghanmi,hiba.ghanmi10@yahoo.fr,apprenant,+21650295357,Tunisie,Tozeur,2002-05-13,"Communication, E-commerce, Conseil"
22719,Amira Limam,amira.limam146@yahoo.fr,apprenant,+21624624652,Tunisie,Siliana,2004-07-22,"Développement web, E-commerce, Blockchain"
22720,Sabrine Gasmi,sabrine.gasmi694@laposte.net,apprenant,+21698859411,Tunisie,Béja,1999-08-23,"Audit, Communication"
22721,Imed Mansouri,imed.mansouri284@outlook.com,apprenant,+21657248407,Tunisie,Gabès,2002-01-24,"Innovation, Gestion de projet"
22722,Marwan Mrad,marwan.mrad526@hotmail.com,apprenant,+21627929506,Tunisie,Ariana,1993-09-09,"Certification, Cloud computing, Communication"
22723,Hiba Jebali,hiba.jebali968@yahoo.fr,apprenant,+21622250240,Tunisie,Kasserine,2007-03-08,"Technologie, Mentoring, Entrepreneuriat"
22724,Wafa Derbali,wafa.derbali26@live.com,apprenant,+21656607138,Tunisie,Médenine,1988-10-22,"Coaching, Stratégie d'entreprise, Entrepreneuriat"
22725,Lassad Gharbi,lassad.gharbi187@orange.tn,apprenant,+21690762443,Tunisie,Sfax,1985-06-15,"Stratégie d'entreprise, Analyse de données, Informatique"
22726,Omar Hamdi,omar.hamdi707@orange.tn,apprenant,+21690150615,Tunisie,Jendouba,1990-04-25,"Innovation, Analyse de données, Qualité"
22727,Manel Jazi,manel.jazi894@hotmail.com,apprenant,+21656724601,Tunisie,Sidi Bouzid,1991-03-17,"Gestion de projet, Stratégie d'entreprise, Ressources humaines, Business intelligence"
22728,Sami Hmida,sami.hmida462@topnet.tn,apprenant,+21659896945,Tunisie,Sousse,2004-04-19,"Cloud computing, Agile, E-commerce, Stratégie d'entreprise, Digital transformation, Finance"
22729,Hajer Hadj,hajer.hadj535@laposte.net,apprenant,+21657059753,Tunisie,Manouba,1999-04-07,"Audit, DevOps, Veille technologique, Digital transformation, Blockchain, Développement web"
22730,Lassad Bouaziz,lassad.bouaziz100@orange.tn,apprenant,+21626573506,Tunisie,Siliana,1994-11-15,"Conseil, Formation professionnelle, Blockchain, Qualité, Management, Certification"
22731,Farouk Ezzine,farouk.ezzine19@outlook.com,apprenant,+21659303430,Tunisie,Bizerte,1987-04-18,"Gestion de projet, Mentoring, Certification, Conseil, ITIL"
22732,Noureddine Ghanmi,noureddine.ghanmi235@gmail.com,apprenant,+21627819598,Tunisie,Tataouine,1990-10-02,"Gestion de projet, Lean management, Cybersécurité, Technologie, Finance, Innovation"
22733,Emad Hamdi,emad.hamdi46@laposte.net,apprenant,+21693915640,Tunisie,Sfax,1985-05-22,"Digital transformation, Développement web, Qualité, Informatique, Agile"
22734,Nour Derbali,nour.derbali246@live.com,apprenant,+21623324689,Tunisie,Béja,2005-06-25,"Mentoring, Intelligence artificielle, ITIL, Business intelligence, Informatique, Innovation"
22735,Salah Fkih,salah.fkih693@orange.tn,apprenant,+21654075812,Tunisie,Ben Arous,1987-05-16,"Communication, Marketing digital, Blockchain, Technologie, Cloud computing"
22736,Ahlem Chebbi,ahlem.chebbi395@gmail.com,apprenant,+21659364518,Tunisie,Sidi Bouzid,2003-01-12,"Marketing digital, IoT, Finance"
22737,Fatma Fourati,fatma.fourati147@live.com,apprenant,+21657624106,Tunisie,Mahdia,2004-08-15,"Conseil, E-commerce"
22738,Yosra Fatnassi,yosra.fatnassi925@orange.tn,apprenant,+21651960983,Tunisie,Jendouba,1991-12-09,"Management, Veille technologique, DevOps, E-commerce"
22739,Ali Ouali,ali.ouali697@orange.tn,apprenant,+21626584293,Tunisie,Le Kef,1993-01-15,"Conseil, Analyse de données, Mentoring, Management, Certification, Veille technologique"
22740,Zouheir Jelassi,zouheir.jelassi16@gmail.com,apprenant,+21699685820,Tunisie,Béja,2001-06-25,"Coaching, ITIL"
22741,Ridha Labidi,ridha.labidi212@topnet.tn,apprenant,+21652732951,Tunisie,Siliana,1994-08-14,"Coaching, Digital transformation, Ressources humaines"
22742,Taoufik Ktari,taoufik.ktari592@yahoo.fr,apprenant,+21620325343,Tunisie,Kairouan,1999-01-04,"Qualité, Leadership, E-commerce, Business intelligence"
22743,Thouraya Hleli,thouraya.hleli816@yahoo.fr,apprenant,+21626600967,Tunisie,Sfax,1988-10-31,"Communication, E-commerce"
22744,Zohra Sellami,zohra.sellami723@yahoo.fr,apprenant,+21656708822,Tunisie,Ben Arous,2002-12-22,"Développement web, Digital transformation, Certification, Management, Audit, Intelligence artificielle"
22745,Zohra Bouhamed,zohra.bouhamed150@outlook.com,apprenant,+21697528749,Tunisie,Mahdia,1986-07-25,"Entrepreneuriat, Qualité, Veille technologique, Blockchain, Ressources humaines"
22746,Wael Ktari,wael.ktari849@topnet.tn,apprenant,+21698215731,Tunisie,Monastir,1987-10-17,"Certification, Technologie, Conseil"
22747,Imed Miled,imed.miled516@live.com,apprenant,+21620770752,Tunisie,Siliana,1998-03-13,"Intelligence artificielle, Innovation, Technologie, Veille technologique, Leadership, ITIL"
22748,Slim Horchani,slim.horchani740@gmail.com,apprenant,+21657595193,Tunisie,Nabeul,1996-10-09,"Informatique, Conseil, Machine learning, Agile"
22749,Samir Ben Ali,samir.ben.ali558@yahoo.fr,apprenant,+21623934525,Tunisie,Tataouine,2001-06-03,"Marketing digital, Informatique"
22750,Dalila Labidi,dalila.labidi34@live.com,apprenant,+21653443961,Tunisie,Béja,1998-02-13,"Formation professionnelle, ITIL, Communication, Informatique"
22751,Latifa Bouslama,latifa.bouslama110@laposte.net,apprenant,+21621941719,Tunisie,Sfax,2006-05-10,"Leadership, Qualité, Entrepreneuriat, Audit"
22752,Karima Marzouki,karima.marzouki573@topnet.tn,apprenant,+21627713120,Tunisie,Ariana,2000-06-10,"IoT, Qualité, Stratégie d'entreprise, Cloud computing, Leadership, Blockchain"
22753,Besma Karoui,besma.karoui967@laposte.net,apprenant,+21699201790,Tunisie,Sfax,2007-05-31,"Cloud computing, DevOps, Management, Cybersécurité, Leadership, Intelligence artificielle"
22754,Emad Ghali,emad.ghali873@topnet.tn,apprenant,+21659600078,Tunisie,Tozeur,1999-02-16,"Informatique, Stratégie d'entreprise, Certification, DevOps"
22755,Walid Hleli,walid.hleli4@orange.tn,apprenant,+21629461933,Tunisie,Médenine,2005-09-30,"Leadership, ITIL, Mentoring, Intelligence artificielle"
22756,Thouraya Horchani,thouraya.horchani218@topnet.tn,apprenant,+21651731806,Tunisie,Kébili,2005-07-22,"Finance, Stratégie d'entreprise, E-commerce, Développement web"
22757,Yasmine Guizani,yasmine.guizani116@hotmail.com,apprenant,+21629445428,Tunisie,Jendouba,2005-11-08,"Marketing digital, Analyse de données, DevOps, Développement web, Cloud computing"
22758,Fares Hajji,fares.hajji244@live.com,apprenant,+21623353896,Tunisie,Gabès,1987-11-04,"Qualité, Marketing digital, Conseil, IoT, Coaching"
22759,Bassem Hajji,bassem.hajji999@laposte.net,apprenant,+21695448779,Tunisie,Siliana,2002-07-24,"Management, Machine learning, Stratégie d'entreprise"
22760,Dorra Maaloul,dorra.maaloul815@yahoo.fr,apprenant,+21627305964,Tunisie,Ariana,1994-10-26,"Cloud computing, Qualité, Certification"
22761,Hajer Mansouri,hajer.mansouri159@yahoo.fr,apprenant,+21621784296,Tunisie,Kairouan,2006-03-25,"Finance, Leadership, Technologie, E-commerce, Gestion de projet, Informatique"
22762,Hedi Essid,hedi.essid22@gmail.com,apprenant,+21695842954,Tunisie,Sidi Bouzid,2001-04-02,"ITIL, Certification, Blockchain, Mentoring"
22763,Yasmine Hamza,yasmine.hamza954@hotmail.com,apprenant,+21628283762,Tunisie,Kairouan,1992-12-20,"Coaching, Analyse de données"
22764,Nesrine Gabsi,nesrine.gabsi119@laposte.net,apprenant,+21657899130,Tunisie,Manouba,2005-05-03,"Communication, Veille technologique"
22765,Noureddine Hajji,noureddine.hajji634@orange.tn,apprenant,+21652524205,Tunisie,Ariana,2007-06-05,"Analyse de données, Entrepreneuriat, Conseil, Stratégie d'entreprise, Cybersécurité, Qualité"
22766,Wafa Karoui,wafa.karoui623@orange.tn,apprenant,+21696061356,Tunisie,Tozeur,1991-05-31,"Entrepreneuriat, Formation professionnelle, Développement web, Certification, Agile"
22767,Takwa Guizani,takwa.guizani974@yahoo.fr,apprenant,+21658746010,Tunisie,Jendouba,2002-06-01,"IoT, Finance"
22768,Khaled Neffati,khaled.neffati212@outlook.com,apprenant,+21625125083,Tunisie,Gafsa,2007-09-08,"Machine learning, Blockchain, Agile, Qualité, Ressources humaines, Finance"
22769,Karima Jazi,karima.jazi450@gmail.com,apprenant,+21697193723,Tunisie,Jendouba,1994-11-07,"Finance, Innovation"
22770,Olfa Chaabane,olfa.chaabane356@topnet.tn,apprenant,+21695241214,Tunisie,Tozeur,1985-03-03,"Développement web, Marketing digital, Certification, Mentoring"
22771,Ridha Ben Salah,ridha.ben.salah57@orange.tn,apprenant,+21696187445,Tunisie,Zaghouan,1988-03-11,"Blockchain, Entrepreneuriat, Analyse de données, Agile, Intelligence artificielle, Digital transformation"
22772,Mohamed Ghanmi,mohamed.ghanmi605@live.com,apprenant,+21698185159,Tunisie,Manouba,1985-02-02,"Blockchain, Communication, Agile, Intelligence artificielle"
22773,Farouk Mestiri,farouk.mestiri730@live.com,apprenant,+21621024028,Tunisie,Mahdia,1993-02-08,"Management, Lean management, Intelligence artificielle"
22774,Besma Ferjani,besma.ferjani882@laposte.net,apprenant,+21622481727,Tunisie,Ariana,2003-12-16,"E-commerce, Cloud computing, Certification, Stratégie d'entreprise, Lean management"
22775,Samir Labidi,samir.labidi970@laposte.net,apprenant,+21657989244,Tunisie,Sidi Bouzid,1993-12-08,"Lean management, Mentoring, Analyse de données, E-commerce"
22776,Sofiane Jemli,sofiane.jemli503@topnet.tn,apprenant,+21690709677,Tunisie,Béja,1990-07-20,"Blockchain, Analyse de données, Cybersécurité, Stratégie d'entreprise, Machine learning, Lean management"
22777,Wided Essid,wided.essid115@orange.tn,apprenant,+21658408511,Tunisie,Nabeul,2005-03-20,"ITIL, IoT, Blockchain, E-commerce, DevOps"
22778,Cyrine Ezzine,cyrine.ezzine632@gmail.com,apprenant,+21651245515,Tunisie,Le Kef,1987-01-20,"Management, Formation professionnelle, Digital transformation, Communication, Ressources humaines, Analyse de données"
22779,Dorra Bouslama,dorra.bouslama476@live.com,apprenant,+21694488724,Tunisie,Monastir,1997-08-07,"Gestion de projet, Cloud computing, E-commerce, Leadership, Blockchain, Analyse de données"
22780,Marwan Daoud,marwan.daoud574@outlook.com,apprenant,+21693705094,Tunisie,Ariana,2006-09-24,"Informatique, Machine learning"
22781,Hana Khlif,hana.khlif213@yahoo.fr,apprenant,+21657779634,Tunisie,Jendouba,1999-05-05,"Cybersécurité, Management"
22782,Mohamed Ben Ali,mohamed.ben.ali828@laposte.net,apprenant,+21659105292,Tunisie,Kairouan,1998-08-06,"Finance, ITIL"
