ID,Nom,Email,Rôle,Téléphone,Pays,Ville,Date de naissance,Centres d'intérêt
22783,Khaled Khlif,khaled.khlif340@live.com,apprenant,+21696846986,Tunisie,Tataouine,2004-02-19,"Stratégie d'entreprise, Cybersécurité"
22784,Samir Mahjoub,samir.mahjoub308@laposte.net,apprenant,+21690498878,Tunisie,Béja,1985-02-08,"Lean management, Cloud computing, Formation professionnelle, Analyse de données, Gestion de projet, Technologie"
22785,Bochra Daoud,bochra.daoud781@live.com,apprenant,+21620211261,Tunisie,Sousse,2005-06-01,"Digital transformation, Innovation"
22786,Ridha Gharbi,ridha.gharbi836@yahoo.fr,apprenant,+21694032686,Tunisie,Tunis,1998-01-07,"Audit, Gestion de projet, Entrepreneuriat"
22787,Fares Mejri,fares.mejri757@gmail.com,apprenant,+21695032634,Tunisie,Bizerte,2005-04-14,"Conseil, Digital transformation, Certification, Blockchain, Technologie, ITIL"
22788,Farah Neffati,farah.neffati165@hotmail.com,apprenant,+21690492966,Tunisie,Gafsa,1999-12-14,"Digital transformation, Stratégie d'entreprise, Finance"
22789,Kais Guizani,kais.guizani444@live.com,apprenant,+21629540227,Tunisie,Gabès,1991-10-15,"Agile, Certification, Technologie"
22790,Latifa Louati,latifa.louati615@orange.tn,apprenant,+21650791731,Tunisie,Gabès,2005-07-03,"Intelligence artificielle, DevOps, ITIL, Finance, Développement web"
22791,Fatma Limam,fatma.limam415@hotmail.com,apprenant,+21698213724,Tunisie,Gabès,1992-10-16,"Analyse de données, Développement web, Cybersécurité"
22792,Hiba Sellami,hiba.sellami296@yahoo.fr,apprenant,+21627290054,Tunisie,Siliana,1993-11-04,"Management, Informatique, Communication, Business intelligence"
22793,Nesrine Layouni,nesrine.layouni139@orange.tn,apprenant,+21657561242,Tunisie,Ben Arous,1986-10-09,"Coaching, Audit, Marketing digital, Cybersécurité, ITIL, Stratégie d'entreprise"
22794,Yassine Ben Ali,yassine.ben.ali54@live.com,apprenant,+21658876668,Tunisie,Manouba,1988-05-27,"Intelligence artificielle, Qualité, DevOps, Audit, Informatique"
22795,Dalila Bouaziz,dalila.bouaziz322@outlook.com,apprenant,+21655882368,Tunisie,Médenine,2006-10-05,"Ressources humaines, E-commerce"
22796,Myriam Sellami,myriam.sellami241@orange.tn,apprenant,+21623239864,Tunisie,Jendouba,2004-10-18,"ITIL, Digital transformation, Communication"
22797,Aymen Hachicha,aymen.hachicha917@hotmail.com,apprenant,+21627883701,Tunisie,Mahdia,1995-09-17,"Machine learning, Conseil, Veille technologique"
22798,Nabil Landolsi,nabil.landolsi442@live.com,apprenant,+21628648651,Tunisie,Médenine,1990-12-15,"Informatique, Cybersécurité, Communication, Digital transformation, Entrepreneuriat"
22799,Fethi Hleli,fethi.hleli522@hotmail.com,apprenant,+21622324883,Tunisie,Gafsa,1990-08-27,"Agile, IoT, Cybersécurité, Finance, Innovation, Technologie"
22800,Nader Layouni,nader.layouni390@gmail.com,apprenant,+21627531255,Tunisie,Médenine,1993-12-11,"Digital transformation, ITIL, Machine learning, Certification, Finance"
22801,Sonia Ktari,sonia.ktari556@gmail.com,apprenant,+21656534322,Tunisie,Gabès,2007-09-10,"Gestion de projet, Ressources humaines, Veille technologique, Mentoring, Technologie"
22802,Imed Khedher,imed.khedher743@hotmail.com,apprenant,+21690622487,Tunisie,Tataouine,2004-03-06,"Blockchain, Mentoring, DevOps, Ressources humaines, Innovation"
22803,Ahlem Mrad,ahlem.mrad375@topnet.tn,apprenant,+21621037805,Tunisie,Siliana,2003-12-14,"Ressources humaines, Cybersécurité"
22804,Walid Jazi,walid.jazi481@hotmail.com,apprenant,+21696459164,Tunisie,Manouba,1992-10-08,"Certification, Digital transformation"
22805,Omar Ben Salah,omar.ben.salah993@laposte.net,apprenant,+21657126392,Tunisie,Zaghouan,2001-02-02,"E-commerce, Formation professionnelle, Business intelligence, Innovation"
22806,Takwa Jelassi,takwa.jelassi461@outlook.com,apprenant,+21699069278,Tunisie,Béja,1995-05-10,"Innovation, Coaching"
22807,Hedi Hajji,hedi.hajji151@laposte.net,apprenant,+21695067389,Tunisie,Zaghouan,1998-07-09,"Analyse de données, Cloud computing"
22808,Rim Trabelsi,rim.trabelsi149@outlook.com,apprenant,+21620774569,Tunisie,Tunis,1986-07-12,"Audit, Conseil, Communication, Finance"
22809,Farouk Khlif,farouk.khlif538@laposte.net,apprenant,+21694240198,Tunisie,Médenine,1992-10-23,"ITIL, Cybersécurité"
22810,Bochra Ouali,bochra.ouali437@laposte.net,apprenant,+21690080117,Tunisie,Le Kef,2004-12-18,"Marketing digital, Ressources humaines"
22811,Bilel Miled,bilel.miled461@live.com,apprenant,+21699008863,Tunisie,Ben Arous,1996-07-21,"Leadership, Stratégie d'entreprise"
22812,Wafa Karray,wafa.karray934@orange.tn,apprenant,+21657322380,Tunisie,Kasserine,1997-03-14,"Informatique, Lean management"
22813,Rami Mestiri,rami.mestiri170@live.com,apprenant,+21652103965,Tunisie,Manouba,2007-10-04,"Qualité, Leadership, ITIL, Digital transformation, Innovation, Informatique"
22814,Wafa Mestiri,wafa.mestiri700@hotmail.com,apprenant,+21695416115,Tunisie,Bizerte,1999-05-24,"Conseil, Finance, Gestion de projet, E-commerce, Cloud computing, Veille technologique"
22815,Adel Khedher,adel.khedher480@orange.tn,apprenant,+21627648933,Tunisie,Kasserine,2003-07-09,"Leadership, Certification, Innovation, Gestion de projet, Ressources humaines"
22816,Olfa Mestiri,olfa.mestiri695@yahoo.fr,apprenant,+21623855261,Tunisie,Kébili,2001-08-05,"Digital transformation, Finance, Conseil, Ressources humaines, Qualité"
22817,Farah Ghorbel,farah.ghorbel779@hotmail.com,apprenant,+21693407976,Tunisie,Gafsa,2001-12-15,"ITIL, Développement web, Stratégie d'entreprise, Communication, Finance"
22818,Moez Limam,moez.limam892@laposte.net,apprenant,+21625581475,Tunisie,Béja,2006-12-03,"Stratégie d'entreprise, Business intelligence, Informatique"
22819,Wassim Bouslama,wassim.bouslama586@hotmail.com,apprenant,+21692249173,Tunisie,Sidi Bouzid,1993-04-12,"Machine learning, Cybersécurité, Leadership, Ressources humaines"
22820,Jihene Hassen,jihene.hassen241@hotmail.com,apprenant,+21629832403,Tunisie,Kairouan,1991-12-11,"Management, Blockchain, Audit"
22821,Imed Mansouri,imed.mansouri715@live.com,apprenant,+21694483961,Tunisie,Kasserine,1991-06-12,"Ressources humaines, Innovation"
22822,Kais Dridi,kais.dridi799@laposte.net,apprenant,+21654852347,Tunisie,Tunis,2001-11-18,"Développement web, Conseil, Technologie, Certification"
22823,Kais Hachicha,kais.hachicha347@live.com,apprenant,+21629552187,Tunisie,Gafsa,1997-02-13,"DevOps, Finance, Formation professionnelle, Stratégie d'entreprise, E-commerce, Ressources humaines"
22824,Yassine Jelassi,yassine.jelassi225@live.com,apprenant,+21695689168,Tunisie,Sidi Bouzid,1985-02-28,"Ressources humaines, Leadership, Technologie, Innovation, ITIL"
22825,Wael Karoui,wael.karoui49@live.com,apprenant,+21651919662,Tunisie,Ben Arous,1999-06-17,"IoT, Entrepreneuriat, E-commerce, Technologie, Blockchain"
22826,Emna Karoui,emna.karoui8@live.com,apprenant,+21620682935,Tunisie,Tozeur,1994-05-19,"Veille technologique, Marketing digital, Certification, Intelligence artificielle, Qualité"
22827,Nabil Khlif,nabil.khlif402@gmail.com,apprenant,+21624674747,Tunisie,Tataouine,2003-09-17,"Veille technologique, Cloud computing"
22828,Karima Sellami,karima.sellami500@hotmail.com,apprenant,+21651419868,Tunisie,Gabès,1997-02-22,"E-commerce, Leadership, Ressources humaines, Intelligence artificielle, Management, Technologie"
22829,Slim Laabidi,slim.laabidi909@laposte.net,apprenant,+21624438694,Tunisie,Ariana,2006-11-04,"Machine learning, Lean management, Management, Conseil, Cloud computing, Audit"
22830,Zied Miled,zied.miled243@outlook.com,apprenant,+21651880658,Tunisie,Ben Arous,2003-08-31,"Management, Conseil"
22831,Wassim Omrani,wassim.omrani784@topnet.tn,apprenant,+21695735379,Tunisie,Nabeul,1991-10-27,"Blockchain, Cloud computing, Agile"
22832,Fatma Rekik,fatma.rekik506@gmail.com,apprenant,+21657595946,Tunisie,Gafsa,1996-11-16,"Lean management, Gestion de projet, Blockchain, Innovation, Informatique"
22833,Aymen Ezzine,aymen.ezzine683@topnet.tn,apprenant,+21693805741,Tunisie,Le Kef,1991-02-03,"Cybersécurité, Machine learning, Qualité, Audit, Digital transformation"
22834,Tarek Gasmi,tarek.gasmi902@yahoo.fr,apprenant,+21621625382,Tunisie,Zaghouan,1991-03-10,"E-commerce, Ressources humaines, Agile, ITIL"
22835,Maroua Bouhamed,maroua.bouhamed428@gmail.com,apprenant,+21697443835,Tunisie,Kasserine,1993-02-25,"Business intelligence, IoT, Finance, Qualité, Innovation"
22836,Salah Mejri,salah.mejri707@yahoo.fr,apprenant,+21628299563,Tunisie,Siliana,2006-07-13,"Communication, Digital transformation, IoT, Technologie, Entrepreneuriat, Mentoring"
22837,Noureddine Fatnassi,noureddine.fatnassi453@yahoo.fr,apprenant,+21695717433,Tunisie,Jendouba,1996-06-20,"Développement web, Technologie"
22838,Samir Essid,samir.essid773@live.com,apprenant,+21692700924,Tunisie,Sidi Bouzid,1985-06-24,"Cloud computing, Agile, Communication, Business intelligence"
22839,Youssef Nasri,youssef.nasri131@laposte.net,apprenant,+21654636963,Tunisie,Gafsa,1997-11-23,"E-commerce, Stratégie d'entreprise, Formation professionnelle"
22840,Nabil Hassen,nabil.hassen483@hotmail.com,apprenant,+21629384990,Tunisie,Siliana,1993-09-18,"Analyse de données, Leadership, Gestion de projet, Mentoring"
22841,Ahmed Ben Salah,ahmed.ben.salah798@gmail.com,apprenant,+21697738684,Tunisie,Béja,1991-06-22,"Agile, Machine learning"
22842,Rania Landolsi,rania.landolsi77@orange.tn,apprenant,+21691088863,Tunisie,Gabès,2005-12-12,"DevOps, Entrepreneuriat, Management, Finance, Innovation"
22843,Dali Sellami,dali.sellami914@topnet.tn,apprenant,+21657809805,Tunisie,Mahdia,2001-11-05,"Coaching, Conseil"
22844,Nader Hamza,nader.hamza667@laposte.net,apprenant,+21693642663,Tunisie,Béja,1989-08-15,"Analyse de données, Informatique"
22845,Adel Jazi,adel.jazi863@live.com,apprenant,+21696960843,Tunisie,Sousse,1998-12-07,"Veille technologique, Audit, Agile, Business intelligence"
22846,Jamel Jelassi,jamel.jelassi571@topnet.tn,apprenant,+21693538047,Tunisie,Nabeul,1996-11-19,"Informatique, Leadership, Lean management, Stratégie d'entreprise, IoT, Machine learning"
22847,Lamia Khlif,lamia.khlif958@yahoo.fr,apprenant,+21651645585,Tunisie,Jendouba,2004-11-10,"Coaching, ITIL, Intelligence artificielle, Digital transformation, Business intelligence"
22848,Amine Rekik,amine.rekik150@orange.tn,apprenant,+21696832762,Tunisie,Jendouba,1985-11-25,"Leadership, Cloud computing, Communication, Coaching"
22849,Moncef Mabrouk,moncef.mabrouk625@topnet.tn,apprenant,+21653960360,Tunisie,Monastir,1993-07-08,"Communication, Technologie, Gestion de projet, Informatique, Mentoring"
22850,Ikram Bouzid,ikram.bouzid784@live.com,apprenant,+21655970257,Tunisie,Gabès,1995-03-23,"Certification, Formation professionnelle"
22851,Karim Layouni,karim.layouni380@yahoo.fr,apprenant,+21654155081,Tunisie,Monastir,1991-02-02,"Veille technologique, Innovation, Qualité, Blockchain, Entrepreneuriat"
22852,Dorsaf Karray,dorsaf.karray105@gmail.com,apprenant,+21694264393,Tunisie,Ben Arous,2000-04-09,"Informatique, Développement web, Conseil, Veille technologique, Blockchain, Formation professionnelle"
22853,Imed Bouaziz,imed.bouaziz449@hotmail.com,apprenant,+21654598601,Tunisie,Béja,2002-01-06,"DevOps, Management, ITIL, Conseil"
22854,Myriam Jebali,myriam.jebali352@yahoo.fr,apprenant,+21699045789,Tunisie,Bizerte,1994-01-11,"Coaching, Audit, Intelligence artificielle, Communication"
22855,Nader Bouzid,nader.bouzid624@hotmail.com,apprenant,+21652392524,Tunisie,Siliana,2003-12-25,"Cloud computing, Lean management, Audit"
22856,Samir Nasri,samir.nasri853@live.com,apprenant,+21698479090,Tunisie,Tozeur,1993-02-14,"Management, Coaching, Stratégie d'entreprise, Développement web, Certification, Intelligence artificielle"
22857,Ridha Feriani,ridha.feriani868@orange.tn,apprenant,+21699780906,Tunisie,Tozeur,1996-11-10,"Entrepreneuriat, Qualité, Audit, Business intelligence, IoT"
22858,Najoua Mabrouk,najoua.mabrouk683@live.com,apprenant,+21627129825,Tunisie,Manouba,2003-05-14,"Cybersécurité, Ressources humaines, DevOps, Coaching"
22859,Kais Omrani,kais.omrani375@live.com,apprenant,+21650356308,Tunisie,Jendouba,2000-01-19,"Mentoring, Business intelligence, Blockchain, Digital transformation, Innovation, Veille technologique"
22860,Intissar Kchir,intissar.kchir857@outlook.com,apprenant,+21694666277,Tunisie,Tataouine,1995-02-23,"Entrepreneuriat, Technologie, Blockchain, ITIL, Machine learning, IoT"
22861,Sofiane Chihaoui,sofiane.chihaoui732@hotmail.com,apprenant,+21698859272,Tunisie,Tozeur,2006-04-17,"IoT, Gestion de projet, Machine learning, Cybersécurité, Marketing digital, Certification"
22862,Slim Hamdi,slim.hamdi101@yahoo.fr,apprenant,+21628113059,Tunisie,Manouba,1995-05-02,"Intelligence artificielle, Marketing digital"
22863,Intissar Fourati,intissar.fourati682@yahoo.fr,apprenant,+21628271371,Tunisie,Tozeur,2003-06-17,"E-commerce, Cybersécurité, Machine learning"
22864,Wided Limam,wided.limam716@live.com,apprenant,+21622595048,Tunisie,Tataouine,1996-11-27,"Communication, Certification, Conseil, Audit, Analyse de données"
22865,Ahlem Fatnassi,ahlem.fatnassi710@live.com,apprenant,+21659806742,Tunisie,Bizerte,2002-12-24,"Mentoring, Management, Finance, Marketing digital, Cybersécurité"
22866,Makram Hadj,makram.hadj424@outlook.com,apprenant,+21656728686,Tunisie,Nabeul,1994-04-07,"Innovation, Veille technologique, IoT, Lean management, Marketing digital, Communication"
22867,Makram Trabelsi,makram.trabelsi448@gmail.com,apprenant,+21620314507,Tunisie,Tunis,1987-03-19,"Veille technologique, Machine learning"
22868,Rami Nabli,rami.nabli129@gmail.com,apprenant,+21652658847,Tunisie,Le Kef,1986-09-10,"Ressources humaines, Qualité, DevOps, Intelligence artificielle"
22869,Amel Ghorbel,amel.ghorbel826@orange.tn,apprenant,+21657896431,Tunisie,Kébili,2007-05-02,"Certification, Ressources humaines, Entrepreneuriat, E-commerce, Digital transformation"
22870,Jamel Bouzid,jamel.bouzid643@topnet.tn,apprenant,+21629570633,Tunisie,Ariana,1997-07-12,"Ressources humaines, Agile, Veille technologique, Cybersécurité, Audit"
22871,Ikram Benhassan,ikram.benhassan215@yahoo.fr,apprenant,+21650474016,Tunisie,Sidi Bouzid,1999-12-13,"Analyse de données, Business intelligence, Technologie"
22872,Emad Laabidi,emad.laabidi935@orange.tn,apprenant,+21695235310,Tunisie,Jendouba,2007-01-20,"DevOps, Business intelligence, Veille technologique, Certification"
22873,Nader Neffati,nader.neffati238@hotmail.com,apprenant,+21691019164,Tunisie,Ben Arous,1985-04-01,"Entrepreneuriat, Certification, Stratégie d'entreprise, Qualité"
22874,Myriam Ghali,myriam.ghali307@gmail.com,apprenant,+21622456839,Tunisie,Kairouan,1985-04-12,"Veille technologique, Technologie, Stratégie d'entreprise, Cloud computing"
22875,Makram Hadj,makram.hadj526@live.com,apprenant,+21695913073,Tunisie,Gafsa,1985-02-07,"Business intelligence, Stratégie d'entreprise, ITIL, Blockchain, Machine learning"
22876,Samir Ghali,samir.ghali149@gmail.com,apprenant,+21657375396,Tunisie,Kasserine,1999-06-08,"Digital transformation, Cloud computing, Ressources humaines, Développement web"
22877,Omar Ghanmi,omar.ghanmi875@laposte.net,apprenant,+21621327396,Tunisie,Mahdia,1997-07-07,"Marketing digital, Intelligence artificielle"
22878,Zied Ben Ali,zied.ben.ali168@hotmail.com,apprenant,+21620812260,Tunisie,Sfax,2005-04-05,"Formation professionnelle, E-commerce, Communication, Business intelligence"
22879,Olfa Rekik,olfa.rekik662@yahoo.fr,apprenant,+21624503405,Tunisie,Manouba,1986-01-14,"Analyse de données, Stratégie d'entreprise"
22880,Lobna Layouni,lobna.layouni150@gmail.com,apprenant,+21659503439,Tunisie,Le Kef,1991-12-25,"Informatique, IoT, DevOps, Veille technologique, Marketing digital"
22881,Dalila Chihaoui,dalila.chihaoui989@topnet.tn,apprenant,+21657161912,Tunisie,Béja,2002-02-27,"Coaching, Communication"
22882,Wided Chihaoui,wided.chihaoui141@outlook.com,apprenant,+21620851973,Tunisie,Le Kef,2004-09-11,"ITIL, Business intelligence, Marketing digital"
22883,Dorsaf Ben Ali,dorsaf.ben.ali55@hotmail.com,apprenant,+21699752782,Tunisie,Mahdia,1993-12-25,"Management, Informatique, Veille technologique, Digital transformation, Leadership, Machine learning"
22884,Sofiane Ferchichi,sofiane.ferchichi463@outlook.com,apprenant,+21622893280,Tunisie,Tunis,1993-01-19,"Management, Machine learning, Audit, Innovation, Finance"
22885,Yosra Hadj,yosra.hadj549@hotmail.com,apprenant,+21698358342,Tunisie,Monastir,1985-06-16,"Cloud computing, Lean management, Cybersécurité, Mentoring, Certification, DevOps"
22886,Cyrine Labidi,cyrine.labidi241@live.com,apprenant,+21696672236,Tunisie,Kairouan,1994-11-02,"Audit, Coaching"
22887,Fethi Chihaoui,fethi.chihaoui507@outlook.com,apprenant,+21693199840,Tunisie,Monastir,2005-09-08,"Audit, Finance, Management, Digital transformation, Communication"
22888,Bassem Hleli,bassem.hleli59@yahoo.fr,apprenant,+21656747930,Tunisie,Mahdia,1999-05-21,"Agile, Qualité, Entrepreneuriat, E-commerce, Cybersécurité, DevOps"
22889,Lassad Hmida,lassad.hmida640@laposte.net,apprenant,+21625154295,Tunisie,Bizerte,1991-09-22,"DevOps, Développement web, Digital transformation"
22890,Hana Ghanmi,hana.ghanmi348@hotmail.com,apprenant,+21655808287,Tunisie,Le Kef,2003-03-27,"Formation professionnelle, Finance"
22891,Ali Ferjani,ali.ferjani962@gmail.com,apprenant,+21626353597,Tunisie,Mahdia,2007-11-06,"Communication, Certification, Cybersécurité, Conseil"
22892,Yosra Laabidi,yosra.laabidi4@yahoo.fr,apprenant,+21659747714,Tunisie,Monastir,1991-07-15,"Blockchain, Digital transformation, ITIL, Ressources humaines"
22893,Makram Hmida,makram.hmida513@live.com,apprenant,+21694753153,Tunisie,Siliana,1992-02-02,"Technologie, Marketing digital, Cybersécurité"
22894,Sabrine Bouaziz,sabrine.bouaziz67@outlook.com,apprenant,+21622025977,Tunisie,Kairouan,1989-11-24,"Certification, Ressources humaines, Cybersécurité, Qualité, Intelligence artificielle"
22895,Ghada Hamdi,ghada.hamdi926@hotmail.com,apprenant,+21629696133,Tunisie,Jendouba,1986-08-18,"Innovation, Formation professionnelle, Intelligence artificielle, Veille technologique"
22896,Khadija Fkih,khadija.fkih904@outlook.com,apprenant,+21629659351,Tunisie,Monastir,2003-05-05,"Leadership, Audit"
22897,Yosra Marzouki,yosra.marzouki792@yahoo.fr,apprenant,+21621410527,Tunisie,Sousse,2003-06-24,"Finance, Audit, Stratégie d'entreprise, Cybersécurité"
22898,Fatma Jouini,fatma.jouini2@topnet.tn,apprenant,+21695907313,Tunisie,Kébili,1995-02-03,"Coaching, Intelligence artificielle, Développement web, Leadership, Cybersécurité, Machine learning"
22899,Yassine Sellami,yassine.sellami520@laposte.net,apprenant,+21693458869,Tunisie,Sidi Bouzid,2006-08-20,"Développement web, Formation professionnelle, Digital transformation, Machine learning, Lean management, Technologie"
22900,Adel Chebbi,adel.chebbi451@gmail.com,apprenant,+21653403231,Tunisie,Kairouan,2005-08-04,"Développement web, Informatique, Cloud computing, Qualité"
22901,Lassad Meddeb,lassad.meddeb955@live.com,apprenant,+21691938366,Tunisie,Kairouan,2004-09-23,"Cybersécurité, Coaching, Finance, Formation professionnelle, Agile"
22902,Zied Bouzid,zied.bouzid649@laposte.net,apprenant,+21656354696,Tunisie,Ben Arous,2005-04-10,"IoT, Leadership, Veille technologique, Entrepreneuriat"
22903,Wael Hleli,wael.hleli541@live.com,apprenant,+21654981814,Tunisie,Bizerte,2007-01-26,"Informatique, Stratégie d'entreprise, Management"
22904,Farah Jelassi,farah.jelassi668@topnet.tn,apprenant,+21691034979,Tunisie,Gafsa,1994-04-05,"Certification, Leadership, Technologie, Intelligence artificielle"
22905,Manel Miled,manel.miled892@gmail.com,apprenant,+21625048795,Tunisie,Sfax,2006-07-26,"Conseil, Ressources humaines, Business intelligence, Management, Développement web, Communication"
22906,Slim Ktari,slim.ktari421@topnet.tn,apprenant,+21698347963,Tunisie,Sidi Bouzid,1985-11-01,"Entrepreneuriat, Finance, Audit, IoT, Blockchain"
22907,Myriam Maaloul,myriam.maaloul154@yahoo.fr,apprenant,+21652837812,Tunisie,Jendouba,2003-04-18,"Agile, Marketing digital, IoT, Analyse de données"
22908,Farah Fatnassi,farah.fatnassi390@live.com,apprenant,+21692423852,Tunisie,Jendouba,2007-06-19,"Technologie, E-commerce, Conseil, Lean management, Ressources humaines"
22909,Ines Khedher,ines.khedher668@hotmail.com,apprenant,+21627270625,Tunisie,Kasserine,1999-03-25,"Analyse de données, Innovation, Entrepreneuriat"
22910,Rim Mejri,rim.mejri523@laposte.net,apprenant,+21652752017,Tunisie,Kasserine,1989-08-10,"Machine learning, Leadership, Intelligence artificielle, Informatique, Conseil"
22911,Moez Bouhamed,moez.bouhamed355@outlook.com,apprenant,+21658591466,Tunisie,Kasserine,1995-12-11,"Leadership, Gestion de projet, Certification, ITIL"
22912,Dali Fourati,dali.fourati248@yahoo.fr,apprenant,+21623993671,Tunisie,Bizerte,1997-01-01,"Cloud computing, Analyse de données, Coaching, Leadership, Cybersécurité, Blockchain"
22913,Intissar Kchir,intissar.kchir353@laposte.net,apprenant,+21697193458,Tunisie,Ben Arous,1993-11-11,"Entrepreneuriat, ITIL, DevOps, Qualité, Ressources humaines, E-commerce"
22914,Mariam Hamza,mariam.hamza176@yahoo.fr,apprenant,+21625498312,Tunisie,Tozeur,1991-07-26,"Entrepreneuriat, ITIL"
22915,Nour Mrad,nour.mrad173@gmail.com,apprenant,+21695996671,Tunisie,Nabeul,1988-07-15,"Communication, Management, Machine learning, Stratégie d'entreprise, Cybersécurité, Cloud computing"
22916,Fares Hamdi,fares.hamdi216@gmail.com,apprenant,+21657158037,Tunisie,Gafsa,1985-05-25,"Cybersécurité, Certification, Qualité, Développement web"
22917,Yasmine Ben Ali,yasmine.ben.ali251@live.com,apprenant,+21628874013,Tunisie,Jendouba,1987-06-26,"Business intelligence, Intelligence artificielle"
22918,Fadia Bouaziz,fadia.bouaziz862@laposte.net,apprenant,+21655312079,Tunisie,Béja,1985-06-01,"Stratégie d'entreprise, Gestion de projet, Business intelligence"
22919,Kais Mejri,kais.mejri446@orange.tn,apprenant,+21692664857,Tunisie,Tunis,1993-06-27,"Marketing digital, Communication, Formation professionnelle, Développement web, Cybersécurité, Business intelligence"
22920,Sami Khedher,sami.khedher976@live.com,apprenant,+21623960691,Tunisie,Kairouan,2007-12-23,"Leadership, Machine learning, Entrepreneuriat"
22921,Ghada Chebbi,ghada.chebbi249@yahoo.fr,apprenant,+21624680183,Tunisie,Jendouba,1995-12-01,"Leadership, Machine learning, Business intelligence, Ressources humaines, Finance"
22922,Amira Ben Ali,amira.ben.ali521@laposte.net,apprenant,+21626828363,Tunisie,Béja,1998-05-07,"Innovation, Management, Cloud computing"
22923,Hedi Ghanmi,hedi.ghanmi143@topnet.tn,apprenant,+21693653263,Tunisie,Médenine,1987-11-01,"Communication, Innovation"
22924,Samia Louati,samia.louati693@hotmail.com,apprenant,+21624312450,Tunisie,Zaghouan,1997-04-25,"Technologie, Finance, E-commerce, Stratégie d'entreprise, Intelligence artificielle, DevOps"
22925,Bochra Ferjani,bochra.ferjani536@laposte.net,apprenant,+21650629821,Tunisie,Sidi Bouzid,1990-11-15,"Gestion de projet, Mentoring"
22926,Cyrine Ktari,cyrine.ktari973@laposte.net,apprenant,+21624057332,Tunisie,Kairouan,1986-01-10,"Communication, Lean management, Certification, Intelligence artificielle, Innovation, Stratégie d'entreprise"
22927,Omar Ferchichi,omar.ferchichi959@topnet.tn,apprenant,+21697484590,Tunisie,Kairouan,1989-09-23,"Finance, Machine learning, Certification, Qualité"
22928,Omar Meddeb,omar.meddeb495@orange.tn,apprenant,+21650599337,Tunisie,Sfax,1989-07-10,"Analyse de données, Cloud computing"
22929,Fatma Mabrouk,fatma.mabrouk256@live.com,apprenant,+21625086456,Tunisie,Sidi Bouzid,2000-01-23,"Communication, Certification, Technologie, Management, ITIL"
22930,Moez Ferchichi,moez.ferchichi866@live.com,apprenant,+21693974863,Tunisie,Ariana,1988-07-01,"Marketing digital, Analyse de données, Certification"
22931,Sabrine Bouhamed,sabrine.bouhamed868@yahoo.fr,apprenant,+21653465229,Tunisie,Tunis,1989-02-22,"Agile, Certification, Communication, Veille technologique, Analyse de données, Machine learning"
22932,Nesrine Daoud,nesrine.daoud619@live.com,apprenant,+21629384492,Tunisie,Ben Arous,1997-04-08,"Cloud computing, IoT, Digital transformation, Innovation, Certification, Entrepreneuriat"
22933,Farah Mestiri,farah.mestiri114@laposte.net,apprenant,+21654713737,Tunisie,Le Kef,1990-09-03,"Blockchain, Business intelligence, Ressources humaines, Stratégie d'entreprise, Agile, Machine learning"
22934,Hichem Fkih,hichem.fkih630@orange.tn,apprenant,+21656238957,Tunisie,Béja,1993-06-23,"Digital transformation, Blockchain, Stratégie d'entreprise, Qualité"
22935,Chiraz Gasmi,chiraz.gasmi211@laposte.net,apprenant,+21698837118,Tunisie,Jendouba,1986-02-16,"IoT, ITIL, Communication"
22936,Mariam Mabrouk,mariam.mabrouk796@hotmail.com,apprenant,+21658857842,Tunisie,Sidi Bouzid,1987-04-17,"Entrepreneuriat, Informatique, Certification, Cybersécurité, Veille technologique, Management"
22937,Yassine Miled,yassine.miled351@live.com,apprenant,+21690621607,Tunisie,Manouba,1986-08-17,"Conseil, Entrepreneuriat, E-commerce, Mentoring, ITIL, Coaching"
22938,Makram Hassen,makram.hassen101@orange.tn,apprenant,+21651941157,Tunisie,Béja,2002-04-21,"Blockchain, Conseil, Formation professionnelle, Digital transformation, Développement web"
22939,Samia Bouzid,samia.bouzid885@yahoo.fr,apprenant,+21691067259,Tunisie,Sfax,2003-04-06,"Finance, Conseil, Machine learning, Qualité"
22940,Amel Ben Youssef,amel.ben.youssef465@gmail.com,apprenant,+21655429963,Tunisie,Mahdia,1988-01-25,"Innovation, Ressources humaines, Leadership, Intelligence artificielle, Entrepreneuriat"
22941,Amel Guizani,amel.guizani450@hotmail.com,apprenant,+21652176718,Tunisie,Béja,2006-12-13,"Machine learning, E-commerce, Lean management"
22942,Jamel Guizani,jamel.guizani725@orange.tn,apprenant,+21620150526,Tunisie,Zaghouan,1993-10-03,"Développement web, Innovation, Conseil, Management"
22943,Slim Miled,slim.miled48@gmail.com,apprenant,+21692900900,Tunisie,Tunis,1987-09-17,"Coaching, Lean management, Analyse de données, E-commerce, Digital transformation"
