ID,Nom,Email,Rôle,Téléphone,Pays,Ville,Date de naissance,Centres d'intérêt
22297,Yosra Hachicha,yosra.hachicha946@hotmail.com,apprenant,+21621555144,Tunisie,Manouba,2003-04-08,"Certification, Management, Finance, Qualité, Formation professionnelle, Technologie"
22298,Makram Bouzid,makram.bouzid748@orange.tn,apprenant,+21625654404,Tunisie,Monastir,1999-11-17,"Intelligence artificielle, Blockchain, Stratégie d'entreprise, Développement web, E-commerce"
22299,Wassim Sellami,wassim.sellami694@gmail.com,apprenant,+21623945601,Tunisie,Siliana,1996-05-12,"Agile, Leadership, Entrepreneuriat"
22300,Farah Mabrouk,farah.mabrouk520@orange.tn,apprenant,+21692563214,Tunisie,Béja,1992-12-04,"Analyse de données, Business intelligence, Cloud computing, Lean management, Machine learning, Stratégie d'entreprise"
22301,Sonia Essid,sonia.essid438@hotmail.com,apprenant,+21655599110,Tunisie,Tunis,1997-08-17,"Business intelligence, Formation professionnelle"
22302,Yasmine Daoud,yasmine.daoud446@hotmail.com,apprenant,+21652166827,Tunisie,Tunis,2006-01-03,"Qualité, Agile, Machine learning, Leadership, Analyse de données"
22303,Kais Omrani,kais.omrani181@live.com,apprenant,+21691558881,Tunisie,Sfax,1988-03-06,"Analyse de données, Digital transformation, E-commerce"
22304,Fadia Dhouib,fadia.dhouib851@live.com,apprenant,+21659861430,Tunisie,Kairouan,1993-02-15,"Qualité, Marketing digital, Développement web, Intelligence artificielle"
22305,Omar Jazi,omar.jazi286@laposte.net,apprenant,+21654513660,Tunisie,Bizerte,1988-02-22,"DevOps, Veille technologique"
22306,Wafa Ben Ali,wafa.ben.ali928@orange.tn,apprenant,+21623221902,Tunisie,Médenine,1989-07-19,"Management, Marketing digital, Entrepreneuriat, Coaching, Cloud computing, Finance"
22307,Hajer Rekik,hajer.rekik556@laposte.net,apprenant,+21659990914,Tunisie,Gabès,1987-04-07,"Agile, Technologie"
22308,Sofiane Ezzine,sofiane.ezzine728@laposte.net,apprenant,+21691984081,Tunisie,Siliana,1993-01-07,"DevOps, Audit"
22309,Thouraya Bouaziz,thouraya.bouaziz354@gmail.com,apprenant,+21697511250,Tunisie,Kébili,2004-11-02,"Ressources humaines, E-commerce, Blockchain, Cloud computing"
22310,Bochra Dhouib,bochra.dhouib418@gmail.com,apprenant,+21652586561,Tunisie,Zaghouan,1996-07-15,"Mentoring, Cybersécurité, Ressources humaines, Audit, Finance"
22311,Hatem Ouali,hatem.ouali587@orange.tn,apprenant,+21650861670,Tunisie,Tataouine,1990-08-22,"Blockchain, Audit, Entrepreneuriat, Formation professionnelle, Ressources humaines, IoT"
22312,Makram Mrad,makram.mrad786@live.com,apprenant,+21622241924,Tunisie,Jendouba,2004-02-02,"Entrepreneuriat, Machine learning"
22313,Besma Bouzid,besma.bouzid34@laposte.net,apprenant,+21656157998,Tunisie,Sidi Bouzid,2004-03-05,"Ressources humaines, Stratégie d'entreprise, DevOps, Veille technologique, Cloud computing, Conseil"
22314,Wided Fourati,wided.fourati711@topnet.tn,apprenant,+21658469459,Tunisie,Gabès,1999-10-17,"Certification, Conseil, Intelligence artificielle"
22315,Ghada Trabelsi,ghada.trabelsi389@live.com,apprenant,+21656376647,Tunisie,Monastir,1992-07-19,"Intelligence artificielle, Agile, Informatique, Cloud computing"
22316,Cyrine Jemli,cyrine.jemli725@live.com,apprenant,+21659028728,Tunisie,Médenine,1999-04-17,"Digital transformation, Veille technologique"
22317,Wael Ktari,wael.ktari942@orange.tn,apprenant,+21657917769,Tunisie,Jendouba,2007-12-27,"Intelligence artificielle, Ressources humaines, Technologie, Formation professionnelle, Business intelligence"
22318,Emna Jelassi,emna.jelassi836@yahoo.fr,apprenant,+21620121724,Tunisie,Tozeur,2001-11-11,"Leadership, Ressources humaines, Certification, Digital transformation, Agile"
22319,Hedi Guesmi,hedi.guesmi900@laposte.net,apprenant,+21627223566,Tunisie,Siliana,1990-05-22,"Marketing digital, Stratégie d'entreprise, Finance, Conseil, Management"
22320,Farah Trabelsi,farah.trabelsi12@yahoo.fr,apprenant,+21659139293,Tunisie,Tunis,1992-12-03,"Business intelligence, Management, Marketing digital, Mentoring"
22321,Maroua Kchir,maroua.kchir329@topnet.tn,apprenant,+21629824231,Tunisie,Tunis,2001-02-23,"Agile, Intelligence artificielle"
22322,Hana Bouzid,hana.bouzid76@orange.tn,apprenant,+21656922089,Tunisie,Ariana,1998-08-09,"Intelligence artificielle, Marketing digital, Certification, Qualité, Stratégie d'entreprise, Formation professionnelle"
22323,Aymen Nabli,aymen.nabli203@laposte.net,apprenant,+21654280374,Tunisie,Jendouba,1990-11-10,"Ressources humaines, Informatique, Analyse de données"
22324,Kenza Hajji,kenza.hajji924@outlook.com,apprenant,+21697795678,Tunisie,Ariana,2001-06-12,"Business intelligence, Mentoring"
22325,Imed Bouaziz,imed.bouaziz827@live.com,apprenant,+21650848169,Tunisie,Mahdia,1996-11-21,"Entrepreneuriat, Blockchain"
22326,Ali Chedly,ali.chedly272@topnet.tn,apprenant,+21659439839,Tunisie,Ariana,1990-10-04,"Ressources humaines, DevOps, Marketing digital, Mentoring, Entrepreneuriat"
22327,Salah Trabelsi,salah.trabelsi435@yahoo.fr,apprenant,+21625901361,Tunisie,Bizerte,1999-11-19,"Mentoring, Intelligence artificielle, E-commerce, Business intelligence, Informatique"
22328,Samir Fatnassi,samir.fatnassi17@orange.tn,apprenant,+21624927836,Tunisie,Gafsa,1996-01-07,"Développement web, Innovation, Formation professionnelle, Veille technologique, Cloud computing"
22329,Kais Ferchichi,kais.ferchichi78@yahoo.fr,apprenant,+21620499978,Tunisie,Le Kef,1987-01-12,"Innovation, Audit, Stratégie d'entreprise, Cloud computing, E-commerce"
22330,Ridha Ben Youssef,ridha.ben.youssef14@outlook.com,apprenant,+21621677501,Tunisie,Ben Arous,1991-09-07,"ITIL, Formation professionnelle, Audit, Analyse de données"
22331,Wafa Meddeb,wafa.meddeb179@topnet.tn,apprenant,+21651383519,Tunisie,Tunis,1988-10-04,"Audit, Certification, Machine learning"
22332,Dorsaf Hadj,dorsaf.hadj392@topnet.tn,apprenant,+21656303800,Tunisie,Sousse,2000-09-23,"Conseil, Cybersécurité"
22333,Fares Ben Ali,fares.ben.ali442@topnet.tn,apprenant,+21693819579,Tunisie,Monastir,1994-05-22,"Cloud computing, Formation professionnelle"
22334,Chedly Miled,chedly.miled730@live.com,apprenant,+21696507748,Tunisie,Gabès,1987-04-12,"Développement web, Innovation, Formation professionnelle, Veille technologique"
22335,Karim Hajji,karim.hajji732@live.com,apprenant,+21625413515,Tunisie,Tataouine,1985-09-03,"Marketing digital, Management, Business intelligence, Cloud computing"
22336,Yosra Sellami,yosra.sellami635@laposte.net,apprenant,+21624358998,Tunisie,Jendouba,2002-03-14,"Informatique, Entrepreneuriat, Digital transformation"
22337,Wael Mahjoub,wael.mahjoub80@hotmail.com,apprenant,+21656871718,Tunisie,Monastir,2003-10-21,"Gestion de projet, Agile, Entrepreneuriat, Digital transformation, Business intelligence, DevOps"
22338,Hajer Bouzid,hajer.bouzid581@outlook.com,apprenant,+21698169536,Tunisie,Nabeul,1985-04-02,"Audit, IoT, Digital transformation"
22339,Karima Ben Ali,karima.ben.ali845@topnet.tn,apprenant,+21620931363,Tunisie,Tunis,2004-01-26,"Entrepreneuriat, Certification, Business intelligence, Marketing digital, Mentoring, E-commerce"
22340,Yassine Omrani,yassine.omrani589@outlook.com,apprenant,+21628971284,Tunisie,Mahdia,1986-05-19,"Cybersécurité, Ressources humaines"
22341,Karim Omrani,karim.omrani166@topnet.tn,apprenant,+21693798256,Tunisie,Zaghouan,1995-03-16,"Formation professionnelle, Technologie, Digital transformation, Communication"
22342,Wael Jebali,wael.jebali960@outlook.com,apprenant,+21628806639,Tunisie,Bizerte,1998-02-02,"Lean management, ITIL, Cloud computing, Veille technologique, Machine learning, Management"
22343,Kais Mansouri,kais.mansouri217@hotmail.com,apprenant,+21659447151,Tunisie,Kairouan,1987-10-18,"Informatique, Formation professionnelle, ITIL, Lean management, Management"
22344,Chiraz Ferchichi,chiraz.ferchichi353@yahoo.fr,apprenant,+21656551374,Tunisie,Sousse,1985-05-19,"Conseil, Machine learning"
22345,Noureddine Nasri,noureddine.nasri869@hotmail.com,apprenant,+21654252214,Tunisie,Kébili,1991-01-24,"Conseil, Agile, Développement web, Certification"
22346,Bilel Hassen,bilel.hassen530@yahoo.fr,apprenant,+21691035929,Tunisie,Kasserine,1986-03-01,"Mentoring, Cloud computing, Analyse de données, Finance, Audit"
22347,Walid Hleli,walid.hleli808@orange.tn,apprenant,+21651242159,Tunisie,Bizerte,1995-02-12,"Informatique, Veille technologique, Blockchain"
22348,Walid Gasmi,walid.gasmi379@laposte.net,apprenant,+21629357111,Tunisie,Ariana,1991-05-21,"Digital transformation, Analyse de données, Communication, Cybersécurité, Business intelligence, Stratégie d'entreprise"
22349,Hajer Nabli,hajer.nabli471@orange.tn,apprenant,+21655267946,Tunisie,Le Kef,1991-04-05,"Stratégie d'entreprise, Intelligence artificielle, Conseil, Finance, Audit"
22350,Zohra Hamza,zohra.hamza292@outlook.com,apprenant,+21650933846,Tunisie,Gabès,2004-01-19,"Intelligence artificielle, Digital transformation, DevOps, Mentoring, Blockchain, Cybersécurité"
22351,Latifa Mabrouk,latifa.mabrouk395@hotmail.com,apprenant,+21658731509,Tunisie,Sidi Bouzid,1985-09-22,"Analyse de données, Informatique, Ressources humaines, Leadership, Machine learning"
22352,Latifa Ktari,latifa.ktari494@yahoo.fr,apprenant,+21691849011,Tunisie,Kasserine,1992-06-30,"Marketing digital, Communication, Leadership, Innovation, Machine learning"
22353,Myriam Ouali,myriam.ouali586@outlook.com,apprenant,+21624131613,Tunisie,Kairouan,1992-05-27,"Stratégie d'entreprise, Leadership, Lean management"
22354,Bassem Louati,bassem.louati43@laposte.net,apprenant,+21694324354,Tunisie,Sfax,2007-02-16,"Innovation, Cybersécurité, Qualité, Agile"
22355,Cyrine Dhouib,cyrine.dhouib711@laposte.net,apprenant,+21620703070,Tunisie,Béja,1996-03-07,"Business intelligence, Lean management, DevOps, Machine learning, Formation professionnelle"
22356,Bassem Fkih,bassem.fkih154@live.com,apprenant,+21625580662,Tunisie,Zaghouan,1987-01-31,"Cloud computing, Coaching, Veille technologique, Marketing digital"
22357,Lobna Bouhamed,lobna.bouhamed424@gmail.com,apprenant,+21658325205,Tunisie,Sfax,2001-02-28,"Développement web, Lean management, Informatique, E-commerce"
22358,Cyrine Ferjani,cyrine.ferjani855@laposte.net,apprenant,+21654592973,Tunisie,Ariana,2003-06-01,"Intelligence artificielle, Entrepreneuriat, Blockchain, IoT, Certification"
22359,Karima Karoui,karima.karoui493@hotmail.com,apprenant,+21624652013,Tunisie,Gabès,1986-02-03,"Agile, Développement web, Cloud computing, Marketing digital"
22360,Nour Karray,nour.karray763@outlook.com,apprenant,+21625654389,Tunisie,Monastir,1997-03-11,"Intelligence artificielle, Leadership"
22361,Amel Bouslama,amel.bouslama718@gmail.com,apprenant,+21651160759,Tunisie,Tozeur,1992-08-21,"Ressources humaines, Informatique, Communication, Marketing digital"
22362,Chedly Horchani,chedly.horchani283@outlook.com,apprenant,+21658587983,Tunisie,Gafsa,2001-07-16,"Business intelligence, Innovation, Gestion de projet, Leadership, ITIL, Mentoring"
22363,Ghazi Layouni,ghazi.layouni170@topnet.tn,apprenant,+21690239970,Tunisie,Jendouba,1987-04-01,"ITIL, Qualité, E-commerce"
22364,Aymen Dali,aymen.dali826@outlook.com,apprenant,+21623341402,Tunisie,Mahdia,1996-03-10,"Ressources humaines, Agile, Conseil, Marketing digital, Cloud computing, Leadership"
22365,Maher Feriani,maher.feriani267@yahoo.fr,apprenant,+21650375526,Tunisie,Tataouine,1989-02-18,"Qualité, Formation professionnelle, Gestion de projet"
22366,Manel Ferchichi,manel.ferchichi155@orange.tn,apprenant,+21655478570,Tunisie,Tunis,1990-04-04,"Machine learning, Intelligence artificielle, Innovation, Technologie"
22367,Zouheir Ouali,zouheir.ouali572@laposte.net,apprenant,+21626475690,Tunisie,Kairouan,2002-08-12,"IoT, Analyse de données"
22368,Wafa Ben Ali,wafa.ben.ali918@laposte.net,apprenant,+21657778236,Tunisie,Bizerte,1988-08-07,"Innovation, Coaching, Technologie"
22369,Dorra Mrad,dorra.mrad64@live.com,apprenant,+21657023599,Tunisie,Bizerte,1985-03-03,"Digital transformation, Management, ITIL, Intelligence artificielle, Entrepreneuriat"
22370,Imed Gabsi,imed.gabsi105@outlook.com,apprenant,+21690888293,Tunisie,Ben Arous,1993-06-07,"Coaching, E-commerce, Informatique"
22371,Karim Mestiri,karim.mestiri405@yahoo.fr,apprenant,+21625760626,Tunisie,Sfax,2000-03-15,"Leadership, Mentoring, Certification, Ressources humaines, Informatique"
22372,Hatem Chedly,hatem.chedly467@laposte.net,apprenant,+21626441007,Tunisie,Kairouan,2005-03-18,"Veille technologique, Agile, Conseil, Stratégie d'entreprise"
22373,Najoua Chedly,najoua.chedly221@orange.tn,apprenant,+21654124967,Tunisie,Siliana,1991-05-31,"DevOps, Conseil, Coaching, Marketing digital"
22374,Yassine Dali,yassine.dali403@gmail.com,apprenant,+21693003544,Tunisie,Nabeul,2004-11-03,"ITIL, Technologie, Coaching, IoT, Informatique"
22375,Bochra Karray,bochra.karray562@live.com,apprenant,+21627934195,Tunisie,Nabeul,2005-12-09,"E-commerce, Leadership, Analyse de données, Coaching"
22376,Ghazi Gasmi,ghazi.gasmi902@topnet.tn,apprenant,+21696602683,Tunisie,Sidi Bouzid,2005-01-23,"Audit, Ressources humaines, Analyse de données"
22377,Lassad Marzouki,lassad.marzouki802@laposte.net,apprenant,+21655205849,Tunisie,Tataouine,2005-05-08,"Stratégie d'entreprise, Qualité, Informatique"
22378,Chedly Ouali,chedly.ouali598@topnet.tn,apprenant,+21620414932,Tunisie,Mahdia,1990-08-31,"Qualité, Agile, Stratégie d'entreprise, Gestion de projet"
22379,Salma Jazi,salma.jazi430@yahoo.fr,apprenant,+21698630024,Tunisie,Manouba,2001-07-02,"Qualité, Technologie, Finance, Coaching, E-commerce"
22380,Ahmed Fatnassi,ahmed.fatnassi822@hotmail.com,apprenant,+21652748725,Tunisie,Zaghouan,1995-11-15,"Digital transformation, Innovation, Machine learning, Analyse de données, Marketing digital, Entrepreneuriat"
22381,Dalila Kchir,dalila.kchir553@outlook.com,apprenant,+21627636157,Tunisie,Jendouba,1989-10-23,"Innovation, Mentoring"
22382,Yosra Karray,yosra.karray978@outlook.com,apprenant,+21694174522,Tunisie,Kasserine,1991-03-21,"ITIL, Mentoring, Intelligence artificielle, Machine learning, Stratégie d'entreprise"
22383,Dorra Mestiri,dorra.mestiri416@gmail.com,apprenant,+21697596748,Tunisie,Tataouine,1992-08-03,"Analyse de données, Audit"
22384,Najoua Guesmi,najoua.guesmi596@hotmail.com,apprenant,+21653716486,Tunisie,Kasserine,1988-08-10,"Leadership, DevOps"
22385,Ghada Horchani,ghada.horchani245@live.com,apprenant,+21690027812,Tunisie,Gafsa,2002-07-25,"Cloud computing, Formation professionnelle, Digital transformation"
22386,Salah Khlif,salah.khlif693@gmail.com,apprenant,+21624362917,Tunisie,Jendouba,1996-08-03,"Certification, Finance, Ressources humaines, Stratégie d'entreprise, Mentoring"
22387,Dalila Jemli,dalila.jemli50@outlook.com,apprenant,+21697852289,Tunisie,Siliana,1998-07-31,"Qualité, Gestion de projet, ITIL, IoT, Veille technologique, Blockchain"
22388,Adel Jouini,adel.jouini911@orange.tn,apprenant,+21620453095,Tunisie,Sidi Bouzid,2000-09-01,"DevOps, Entrepreneuriat, Mentoring, ITIL"
22389,Zeineb Daoud,zeineb.daoud469@gmail.com,apprenant,+21624945460,Tunisie,Tataouine,1986-03-18,"Communication, Technologie, Digital transformation, Management"
22390,Lassad Ferjani,lassad.ferjani852@topnet.tn,apprenant,+21654261016,Tunisie,Kairouan,2002-11-18,"Développement web, Mentoring, Gestion de projet, Entrepreneuriat"
22391,Sonia Louati,sonia.louati853@live.com,apprenant,+21691365873,Tunisie,Sidi Bouzid,1997-05-08,"Entrepreneuriat, Technologie, Qualité, Business intelligence, DevOps, E-commerce"
22392,Nabil Mansouri,nabil.mansouri908@gmail.com,apprenant,+21627987129,Tunisie,Gabès,1989-09-01,"Marketing digital, Digital transformation, Qualité"
22393,Lamia Chaabane,lamia.chaabane394@gmail.com,apprenant,+21651499164,Tunisie,Bizerte,1990-02-09,"Mentoring, Marketing digital, Technologie, Veille technologique"
22394,Zeineb Karray,zeineb.karray96@topnet.tn,apprenant,+21629944744,Tunisie,Médenine,1993-01-01,"Audit, Machine learning, Stratégie d'entreprise, Conseil"
22395,Walid Benhassan,walid.benhassan429@orange.tn,apprenant,+21622425339,Tunisie,Tunis,2007-06-14,"Audit, Cybersécurité, Veille technologique, Ressources humaines, IoT"
22396,Marwan Chebbi,marwan.chebbi662@hotmail.com,apprenant,+21654328007,Tunisie,Kasserine,2005-01-13,"Machine learning, Cloud computing, E-commerce, Analyse de données, Management, Formation professionnelle"
22397,Chedly Meddeb,chedly.meddeb683@yahoo.fr,apprenant,+21656833184,Tunisie,Sidi Bouzid,1993-08-24,"Business intelligence, ITIL, Agile, Mentoring, Coaching, Intelligence artificielle"
22398,Najoua Neffati,najoua.neffati742@yahoo.fr,apprenant,+21691091600,Tunisie,Gabès,2002-10-20,"Certification, Communication, Veille technologique"
22399,Hiba Jelassi,hiba.jelassi956@outlook.com,apprenant,+21627049077,Tunisie,Zaghouan,1997-04-30,"Finance, Communication"
22400,Taoufik Labidi,taoufik.labidi597@live.com,apprenant,+21650794417,Tunisie,Médenine,2000-10-07,"Innovation, Audit, E-commerce, Communication, Veille technologique"
22401,Ikram Ben Youssef,ikram.ben.youssef63@orange.tn,apprenant,+21628206434,Tunisie,Siliana,2003-10-18,"Cloud computing, Management, IoT"
22402,Wael Feriani,wael.feriani90@topnet.tn,apprenant,+21620155863,Tunisie,Tunis,1998-06-02,"ITIL, Entrepreneuriat"
22403,Manel Labidi,manel.labidi789@laposte.net,apprenant,+21658260418,Tunisie,Kébili,2003-06-18,"Informatique, Coaching, Leadership, Digital transformation, Cloud computing"
22404,Lassad Jelassi,lassad.jelassi147@gmail.com,apprenant,+21696340783,Tunisie,Sidi Bouzid,1993-05-12,"Cloud computing, Lean management, DevOps"
22405,Wided Jebali,wided.jebali473@topnet.tn,apprenant,+21626554931,Tunisie,Sfax,2003-12-02,"Business intelligence, IoT, Certification, Finance, Lean management"
22406,Hajer Mabrouk,hajer.mabrouk314@live.com,apprenant,+21656832642,Tunisie,Béja,2001-12-24,"Coaching, DevOps, Analyse de données, Intelligence artificielle, Veille technologique"
22407,Ali Hachicha,ali.hachicha522@laposte.net,apprenant,+21629263423,Tunisie,Sousse,2002-11-12,"E-commerce, Lean management, Finance, Technologie, Développement web, Business intelligence"
22408,Amel Ferchichi,amel.ferchichi714@outlook.com,apprenant,+21692471760,Tunisie,Gafsa,1989-07-23,"DevOps, Certification, Communication, Stratégie d'entreprise, Entrepreneuriat, Qualité"
22409,Jamel Derbali,jamel.derbali237@gmail.com,apprenant,+21658065563,Tunisie,Béja,1991-06-12,"Informatique, Développement web, Stratégie d'entreprise, Machine learning"
22410,Walid Jazi,walid.jazi912@orange.tn,apprenant,+21696054910,Tunisie,Gabès,1999-01-31,"Lean management, Cloud computing, Analyse de données, Machine learning, Ressources humaines"
22411,Dalila Dali,dalila.dali96@gmail.com,apprenant,+21691434120,Tunisie,Zaghouan,1995-07-01,"Développement web, Technologie, Finance, Ressources humaines, Conseil, Lean management"
22412,Samia Ghorbel,samia.ghorbel335@outlook.com,apprenant,+21629709477,Tunisie,Médenine,1992-11-09,"Blockchain, Business intelligence, Certification"
22413,Wassim Trabelsi,wassim.trabelsi762@yahoo.fr,apprenant,+21694905913,Tunisie,Manouba,2003-03-20,"Machine learning, Audit, E-commerce, Gestion de projet, Certification"
22414,Yassine Ouali,yassine.ouali257@gmail.com,apprenant,+21696026246,Tunisie,Ben Arous,1991-05-05,"Marketing digital, Développement web, Cybersécurité, Coaching, Informatique"
22415,Ines Bouaziz,ines.bouaziz242@outlook.com,apprenant,+21620951263,Tunisie,Jendouba,2001-11-02,"Agile, Lean management"
22416,Fethi Karray,fethi.karray103@hotmail.com,apprenant,+21696334741,Tunisie,Bizerte,2003-11-07,"E-commerce, Machine learning, Qualité"
22417,Ahlem Ferchichi,ahlem.ferchichi215@gmail.com,apprenant,+21654379254,Tunisie,Bizerte,1996-04-18,"Communication, Finance, Blockchain"
22418,Nabil Meddeb,nabil.meddeb440@orange.tn,apprenant,+21659218618,Tunisie,Zaghouan,2007-09-16,"Innovation, Communication, Cybersécurité, Marketing digital"
22419,Hiba Labidi,hiba.labidi320@gmail.com,apprenant,+21628632630,Tunisie,Médenine,1998-03-13,"Informatique, ITIL, Entrepreneuriat, Mentoring, Certification"
22420,Wassim Jebali,wassim.jebali982@orange.tn,apprenant,+21626822850,Tunisie,Sidi Bouzid,1988-03-04,"Veille technologique, Ressources humaines, Communication, Conseil, Leadership, Informatique"
22421,Myriam Labidi,myriam.labidi247@laposte.net,apprenant,+21690091035,Tunisie,Kasserine,1985-09-24,"Mentoring, Intelligence artificielle"
22422,Farah Fatnassi,farah.fatnassi239@topnet.tn,apprenant,+21650609946,Tunisie,Zaghouan,1997-06-23,"Technologie, Ressources humaines"
22423,Wassim Fkih,wassim.fkih637@outlook.com,apprenant,+21620032360,Tunisie,Monastir,1993-10-31,"Conseil, Lean management, Blockchain, Management, E-commerce, Marketing digital"
22424,Yasmine Landolsi,yasmine.landolsi194@outlook.com,apprenant,+21620996389,Tunisie,Siliana,1999-04-14,"Lean management, DevOps, Agile, ITIL, Business intelligence"
22425,Farouk Chedly,farouk.chedly750@outlook.com,apprenant,+21698996414,Tunisie,Kasserine,1995-04-01,"Communication, Gestion de projet, Marketing digital, Stratégie d'entreprise, Digital transformation, Technologie"
22426,Jihene Guesmi,jihene.guesmi244@outlook.com,apprenant,+21656267472,Tunisie,Siliana,1997-12-20,"Technologie, Informatique"
22427,Ines Nasri,ines.nasri149@topnet.tn,apprenant,+21653669457,Tunisie,Tunis,1988-10-10,"Management, Développement web, ITIL, Agile"
22428,Najoua Miled,najoua.miled256@gmail.com,apprenant,+21653697870,Tunisie,Tataouine,1985-11-25,"Digital transformation, Cloud computing, Conseil, Intelligence artificielle, Mentoring, Qualité"
22429,Samir Mejri,samir.mejri485@yahoo.fr,apprenant,+21652435135,Tunisie,Monastir,2004-08-19,"Communication, Cloud computing"
22430,Lamia Karray,lamia.karray712@topnet.tn,apprenant,+21627203739,Tunisie,Gafsa,1988-10-15,"Informatique, Audit"
22431,Zohra Ferjani,zohra.ferjani406@hotmail.com,apprenant,+21693862323,Tunisie,Le Kef,1999-05-26,"IoT, Management, Cybersécurité, Cloud computing"
22432,Manel Ben Ali,manel.ben.ali138@gmail.com,apprenant,+21698923327,Tunisie,Ariana,1993-03-04,"Innovation, Entrepreneuriat, Cloud computing, IoT"
22433,Emad Karoui,emad.karoui322@orange.tn,apprenant,+21629602878,Tunisie,Jendouba,1991-05-25,"Business intelligence, Mentoring"
22434,Sami Hadj,sami.hadj547@laposte.net,apprenant,+21651208139,Tunisie,Manouba,1987-04-14,"Business intelligence, Blockchain"
22435,Fatma Hajji,fatma.hajji982@laposte.net,apprenant,+21694613576,Tunisie,Kébili,2002-11-21,"Conseil, Audit, Stratégie d'entreprise"
22436,Ghada Laabidi,ghada.laabidi556@laposte.net,apprenant,+21629073771,Tunisie,Nabeul,1997-06-30,"Stratégie d'entreprise, Ressources humaines, Qualité, Business intelligence, Développement web"
22437,Omar Ghali,omar.ghali944@orange.tn,apprenant,+21656490754,Tunisie,Monastir,1985-08-08,"Gestion de projet, Communication, Ressources humaines, Blockchain, Audit, Agile"
22438,Nader Rekik,nader.rekik877@live.com,apprenant,+21624152037,Tunisie,Kairouan,1986-02-24,"DevOps, Intelligence artificielle, Marketing digital, Technologie"
22439,Farah Mahjoub,farah.mahjoub361@yahoo.fr,apprenant,+21653303059,Tunisie,Kébili,1999-11-01,"Stratégie d'entreprise, Finance, Lean management, Digital transformation, Formation professionnelle, Business intelligence"
22440,Nour Omrani,nour.omrani475@outlook.com,apprenant,+21695760050,Tunisie,Ben Arous,2002-09-16,"Gestion de projet, Machine learning, Intelligence artificielle, Audit"
22441,Slim Neffati,slim.neffati676@orange.tn,apprenant,+21622126153,Tunisie,Sidi Bouzid,1988-02-06,"Ressources humaines, Développement web, Innovation, Machine learning, Lean management, Marketing digital"
22442,Zeineb Omrani,zeineb.omrani795@topnet.tn,apprenant,+21693207599,Tunisie,Tozeur,1985-11-23,"Technologie, Qualité"
22443,Salah Hleli,salah.hleli741@topnet.tn,apprenant,+21626580255,Tunisie,Ben Arous,1995-03-09,"Lean management, Informatique, DevOps, Développement web, ITIL, Coaching"
22444,Yassine Bouzid,yassine.bouzid897@hotmail.com,apprenant,+21620055084,Tunisie,Kébili,1987-02-22,"Qualité, Technologie, DevOps, Communication, Veille technologique"
22445,Lamia Jazi,lamia.jazi638@laposte.net,apprenant,+21697289720,Tunisie,Manouba,1990-07-21,"Technologie, Audit, Intelligence artificielle, Développement web"
22446,Samia Gabsi,samia.gabsi180@outlook.com,apprenant,+21629477191,Tunisie,Kairouan,2003-09-09,"Audit, Leadership, Qualité"
22447,Mehdi Jemli,mehdi.jemli718@hotmail.com,apprenant,+21696853272,Tunisie,Jendouba,2004-02-22,"Certification, Audit, E-commerce"
22448,Yasmine Jebali,yasmine.jebali318@live.com,apprenant,+21624595965,Tunisie,Le Kef,2004-03-10,"Technologie, Lean management, Cybersécurité, Marketing digital"
22449,Farouk Nasri,farouk.nasri489@yahoo.fr,apprenant,+21629707435,Tunisie,Gafsa,2006-12-09,"Coaching, Développement web, Finance, Leadership"
22450,Ghazi Derbali,ghazi.derbali280@live.com,apprenant,+21656692205,Tunisie,Jendouba,1985-12-21,"Leadership, Informatique, Analyse de données, Management"
22451,Farouk Ben Ahmed,farouk.ben.ahmed28@topnet.tn,apprenant,+21629812175,Tunisie,Kébili,1999-02-15,"Cloud computing, Ressources humaines, DevOps, Digital transformation"
22452,Wafa Karray,wafa.karray426@orange.tn,apprenant,+21622206086,Tunisie,Bizerte,1986-05-08,"Cloud computing, DevOps, E-commerce, Digital transformation, Finance, Blockchain"
22453,Yosra Hleli,yosra.hleli950@orange.tn,apprenant,+21659536025,Tunisie,Manouba,2001-09-08,"Entrepreneuriat, Cybersécurité"
22454,Moez Meddeb,moez.meddeb899@outlook.com,apprenant,+21652625869,Tunisie,Zaghouan,2007-12-19,"Conseil, Mentoring, Coaching, IoT"
22455,Kais Kchir,kais.kchir238@outlook.com,apprenant,+21620248673,Tunisie,Médenine,1987-09-11,"Analyse de données, Business intelligence, ITIL, Agile"
22456,Zouheir Chaieb,zouheir.chaieb434@outlook.com,apprenant,+21625090267,Tunisie,Gafsa,1995-09-04,"Informatique, Audit"
22457,Yassine Hachicha,yassine.hachicha584@hotmail.com,apprenant,+21620251752,Tunisie,Tunis,1997-10-02,"Ressources humaines, Analyse de données, Finance, Intelligence artificielle, Marketing digital"
