ID,Nom,Email,Rôle,Téléphone,Pays,Ville,Date de naissance,Centres d'intérêt
15837,Makram Ben Ali,makram.ben.ali621@yahoo.fr,apprenant,+21627056910,Tunisie,Jendouba,2005-01-03,"IoT, Leadership, Informatique, Digital transformation, Qualité, Coaching"
15838,Chiraz Nabli,chiraz.nabli609@yahoo.fr,apprenant,+21627336847,Tunisie,Zaghouan,1985-09-27,"Coaching, Management, IoT, Stratégie d'entreprise, Certification, Informatique"
15839,Lobna Omrani,lobna.omrani511@gmail.com,apprenant,+21690577077,Tunisie,Siliana,1990-09-10,"Communication, Coaching, Machine learning, Digital transformation"
15840,Mohamed Hamza,mohamed.hamza197@orange.tn,apprenant,+21652898722,Tunisie,Tataouine,1988-09-20,"Ressources humaines, Mentoring, Conseil, Analyse de données, Blockchain, Lean management"
15841,Fethi Dridi,fethi.dridi33@laposte.net,apprenant,+21626891281,Tunisie,Kébili,2007-07-16,"E-commerce, Lean management, Coaching, Business intelligence, Mentoring, Veille technologique"
15842,Nader Jouini,nader.jouini533@gmail.com,apprenant,+21621862333,Tunisie,Sousse,1993-10-24,"Développement web, Digital transformation, Communication, Business intelligence"
15843,Amel Hadj,amel.hadj98@topnet.tn,apprenant,+21628317513,Tunisie,Béja,2004-10-24,"Analyse de données, Certification"
15844,Hedi Jebali,hedi.jebali154@gmail.com,apprenant,+21622469736,Tunisie,Sidi Bouzid,2006-02-13,"Mentoring, Audit, Analyse de données"
15845,Olfa Hachicha,olfa.hachicha415@live.com,apprenant,+21656936555,Tunisie,Kairouan,2004-10-04,"Gestion de projet, Machine learning, Entrepreneuriat, E-commerce, Coaching"
15846,Amira Chihaoui,amira.chihaoui901@topnet.tn,apprenant,+21694456367,Tunisie,Monastir,2003-11-05,"Finance, Leadership, Entrepreneuriat, Agile"
15847,Rania Hachicha,rania.hachicha2@orange.tn,apprenant,+21627128339,Tunisie,Jendouba,1995-04-04,"Blockchain, Innovation, Analyse de données, Technologie"
15848,Salah Benhassan,salah.benhassan426@orange.tn,apprenant,+21629288115,Tunisie,Zaghouan,1987-07-03,"Finance, Développement web"
15849,Farah Mahjoub,farah.mahjoub34@laposte.net,apprenant,+21657604827,Tunisie,Sfax,1985-01-15,"Technologie, Informatique, Lean management, IoT, Finance, Digital transformation"
15850,Salah Marzouki,salah.marzouki403@orange.tn,apprenant,+21691907320,Tunisie,Sousse,1992-01-20,"Formation professionnelle, Finance, Stratégie d'entreprise, Qualité"
15851,Aymen Khedher,aymen.khedher410@yahoo.fr,apprenant,+21627664945,Tunisie,Jendouba,1999-06-01,"Analyse de données, Agile"
15852,Lassad Chaabane,lassad.chaabane298@yahoo.fr,apprenant,+21657988771,Tunisie,Médenine,1995-04-03,"Entrepreneuriat, Conseil, Veille technologique, Qualité, Digital transformation"
15853,Noureddine Hamza,noureddine.hamza336@live.com,apprenant,+21659462117,Tunisie,Manouba,1999-03-01,"ITIL, Innovation, Business intelligence, Blockchain"
15854,Jihene Karray,jihene.karray327@yahoo.fr,apprenant,+21657532496,Tunisie,Nabeul,2007-12-17,"ITIL, Innovation, Cybersécurité"
15855,Lassad Layouni,lassad.layouni982@hotmail.com,apprenant,+21692448018,Tunisie,Ariana,1990-06-02,"E-commerce, Digital transformation, Informatique, DevOps, Ressources humaines"
15856,Zohra Ghali,zohra.ghali658@gmail.com,apprenant,+21626171552,Tunisie,Kasserine,1993-07-27,"Management, Stratégie d'entreprise, Marketing digital"
15857,Nesrine Ferjani,nesrine.ferjani438@hotmail.com,apprenant,+21627279783,Tunisie,Kébili,1997-03-24,"Certification, Analyse de données, Marketing digital, Cloud computing, Audit"
15858,Marwan Landolsi,marwan.landolsi99@laposte.net,apprenant,+21627206261,Tunisie,Ariana,1993-04-11,"DevOps, Veille technologique"
15859,Zohra Meddeb,zohra.meddeb118@live.com,apprenant,+21657499964,Tunisie,Sousse,1985-12-31,"Innovation, Certification, DevOps, Machine learning, Stratégie d'entreprise, Intelligence artificielle"
15860,Bassem Guizani,bassem.guizani105@outlook.com,apprenant,+21692661395,Tunisie,Ben Arous,1990-02-09,"Digital transformation, Qualité, IoT, ITIL, Analyse de données"
15861,Omar Miled,omar.miled233@yahoo.fr,apprenant,+21628867958,Tunisie,Siliana,1999-04-07,"Conseil, Marketing digital, Intelligence artificielle, Stratégie d'entreprise"
15862,Dalila Maaloul,dalila.maaloul37@orange.tn,apprenant,+21653439558,Tunisie,Sidi Bouzid,1997-11-17,"Digital transformation, DevOps, Analyse de données, Entrepreneuriat"
15863,Sabrine Ferchichi,sabrine.ferchichi538@topnet.tn,apprenant,+21656237172,Tunisie,Kébili,2004-08-15,"DevOps, Digital transformation, Finance, Coaching, Qualité, Technologie"
15864,Hedi Ghanmi,hedi.ghanmi421@orange.tn,apprenant,+21693940282,Tunisie,Bizerte,1995-12-18,"Formation professionnelle, Cloud computing, Machine learning, Leadership"
15865,Rami Jouini,rami.jouini607@hotmail.com,apprenant,+21690802200,Tunisie,Ariana,2006-01-10,"Conseil, Communication, Agile, Développement web, Finance, Formation professionnelle"
15866,Hedi Fatnassi,hedi.fatnassi122@gmail.com,apprenant,+21625356285,Tunisie,Sfax,2001-09-25,"ITIL, Stratégie d'entreprise, Communication, E-commerce, Formation professionnelle"
15867,Marwan Ferjani,marwan.ferjani83@outlook.com,apprenant,+21690040383,Tunisie,Siliana,2000-05-20,"Machine learning, Qualité, Lean management, Blockchain, Conseil"
15868,Farah Guesmi,farah.guesmi834@laposte.net,apprenant,+21623756573,Tunisie,Gafsa,1997-01-19,"Entrepreneuriat, Communication, Marketing digital, Technologie, Certification"
15869,Jamel Ghanmi,jamel.ghanmi791@live.com,apprenant,+21653395274,Tunisie,Zaghouan,1989-07-13,"Marketing digital, Mentoring, Cloud computing, Cybersécurité, Communication"
15870,Latifa Feriani,latifa.feriani954@orange.tn,apprenant,+21621924436,Tunisie,Médenine,1989-07-20,"Qualité, Leadership"
15871,Slim Bouslama,slim.bouslama923@laposte.net,apprenant,+21626984161,Tunisie,Mahdia,1999-12-24,"Digital transformation, Veille technologique"
15872,Yasmine Jemli,yasmine.jemli857@topnet.tn,apprenant,+21693566551,Tunisie,Kébili,1989-05-21,"Business intelligence, Cloud computing, Mentoring, Conseil"
15873,Besma Karray,besma.karray666@gmail.com,apprenant,+21622247047,Tunisie,Manouba,1995-03-20,"Lean management, Machine learning, Finance, Business intelligence, Blockchain, Cloud computing"
15874,Emna Neffati,emna.neffati990@yahoo.fr,apprenant,+21694501396,Tunisie,Sfax,1992-09-01,"Management, Qualité, Communication, Formation professionnelle, Analyse de données, Blockchain"
15875,Sonia Dridi,sonia.dridi396@orange.tn,apprenant,+21626497869,Tunisie,Sfax,1988-10-22,"E-commerce, Coaching, IoT, Business intelligence, Informatique"
15876,Hiba Karoui,hiba.karoui309@hotmail.com,apprenant,+21620397652,Tunisie,Bizerte,2004-11-14,"Conseil, Formation professionnelle"
15877,Ridha Maaloul,ridha.maaloul384@outlook.com,apprenant,+21654573061,Tunisie,Nabeul,1988-04-12,"Certification, Conseil, Business intelligence, Veille technologique"
15878,Nesrine Rekik,nesrine.rekik949@live.com,apprenant,+21626088411,Tunisie,Monastir,1993-12-06,"Agile, ITIL, Gestion de projet, Coaching, Analyse de données"
15879,Adel Neffati,adel.neffati441@outlook.com,apprenant,+21621061061,Tunisie,Jendouba,1985-11-05,"Certification, Leadership, Ressources humaines, Conseil, ITIL, Innovation"
15880,Lassad Chedly,lassad.chedly862@topnet.tn,apprenant,+21621083971,Tunisie,Bizerte,2007-06-18,"Analyse de données, IoT, Gestion de projet, Conseil, Cybersécurité"
15881,Fatma Chaabane,fatma.chaabane641@orange.tn,apprenant,+21652231874,Tunisie,Médenine,2003-10-07,"E-commerce, Cloud computing, Certification, Marketing digital"
15882,Dalila Omrani,dalila.omrani758@gmail.com,apprenant,+21694511976,Tunisie,Monastir,2001-11-08,"Informatique, Blockchain, DevOps, Digital transformation, Cybersécurité"
15883,Sami Hleli,sami.hleli948@live.com,apprenant,+21698842148,Tunisie,Gabès,1991-05-23,"Management, Entrepreneuriat, Blockchain"
15884,Ikram Karray,ikram.karray616@yahoo.fr,apprenant,+21627645216,Tunisie,Gabès,2004-02-14,"ITIL, Finance, Mentoring, Informatique, Analyse de données"
15885,Ikram Derbali,ikram.derbali527@live.com,apprenant,+21652575617,Tunisie,Ariana,2006-11-11,"Qualité, Agile, ITIL, E-commerce, Blockchain"
15886,Youssef Chedly,youssef.chedly603@outlook.com,apprenant,+21694940120,Tunisie,Le Kef,1987-08-27,"Lean management, Leadership, Mentoring, Gestion de projet"
15887,Jihene Mahjoub,jihene.mahjoub607@hotmail.com,apprenant,+21621130804,Tunisie,Gafsa,1997-11-16,"Marketing digital, Innovation, Intelligence artificielle"
15888,Karim Essid,karim.essid20@live.com,apprenant,+21656839450,Tunisie,Kébili,1994-03-24,"Mentoring, Gestion de projet, Audit"
15889,Emna Limam,emna.limam255@hotmail.com,apprenant,+21621921381,Tunisie,Kasserine,2002-05-12,"Technologie, Business intelligence, ITIL, Développement web, Lean management, Blockchain"
15890,Zied Dali,zied.dali856@yahoo.fr,apprenant,+21696697447,Tunisie,Kairouan,2005-06-07,"Machine learning, Veille technologique, Communication"
15891,Wided Neffati,wided.neffati409@laposte.net,apprenant,+21624777550,Tunisie,Ariana,1993-09-19,"DevOps, Machine learning, Management, Informatique, Audit, Entrepreneuriat"
15892,Emna Gharbi,emna.gharbi986@live.com,apprenant,+21652484183,Tunisie,Tataouine,2004-05-31,"Cybersécurité, Développement web, Intelligence artificielle, Technologie, Lean management, Digital transformation"
15893,Moncef Gharbi,moncef.gharbi854@topnet.tn,apprenant,+21659355671,Tunisie,Le Kef,1987-12-10,"Business intelligence, Mentoring, Certification, Audit, Conseil"
15894,Karima Chaieb,karima.chaieb772@laposte.net,apprenant,+21698509478,Tunisie,Sfax,1985-06-07,"Qualité, Formation professionnelle, Management, Entrepreneuriat"
15895,Amel Mabrouk,amel.mabrouk488@topnet.tn,apprenant,+21626846425,Tunisie,Kairouan,1994-02-08,"Développement web, Conseil, Audit"
15896,Noureddine Ben Youssef,noureddine.ben.youssef513@live.com,apprenant,+21627803991,Tunisie,Le Kef,2004-03-27,"Coaching, Entrepreneuriat, IoT"
15897,Wael Meddeb,wael.meddeb99@live.com,apprenant,+21620514873,Tunisie,Nabeul,2002-02-18,"Informatique, Qualité"
15898,Rami Rekik,rami.rekik274@hotmail.com,apprenant,+21652838178,Tunisie,Tunis,1986-04-18,"Coaching, IoT, Technologie, Stratégie d'entreprise, Agile, Conseil"
15899,Besma Nasri,besma.nasri220@yahoo.fr,apprenant,+21699472265,Tunisie,Sousse,1989-01-22,"Finance, Cybersécurité, Qualité, Lean management"
15900,Wassim Neffati,wassim.neffati999@orange.tn,apprenant,+21622377667,Tunisie,Tataouine,2004-08-13,"Business intelligence, Développement web, Intelligence artificielle"
15901,Moncef Gasmi,moncef.gasmi125@live.com,apprenant,+21653225120,Tunisie,Sidi Bouzid,2006-06-24,"Audit, Management, Formation professionnelle, ITIL, Analyse de données"
15902,Tarek Hassen,tarek.hassen591@topnet.tn,apprenant,+21656468869,Tunisie,Nabeul,1996-10-23,"Informatique, Stratégie d'entreprise, Lean management, E-commerce"
15903,Rania Gharbi,rania.gharbi100@topnet.tn,apprenant,+21699617089,Tunisie,Ben Arous,1996-07-02,"Audit, IoT, Certification, Lean management"
15904,Hedi Fkih,hedi.fkih839@outlook.com,apprenant,+21624588512,Tunisie,Bizerte,2001-01-26,"Management, IoT, Communication, Business intelligence, Intelligence artificielle, Audit"
15905,Farouk Mahjoub,farouk.mahjoub226@topnet.tn,apprenant,+21659767825,Tunisie,Kasserine,2001-02-14,"Innovation, Entrepreneuriat, Analyse de données"
15906,Ines Kchir,ines.kchir940@topnet.tn,apprenant,+21622065457,Tunisie,Monastir,2006-07-08,"Ressources humaines, Certification, Informatique"
15907,Jamel Hamza,jamel.hamza115@yahoo.fr,apprenant,+21697504214,Tunisie,Gafsa,2007-03-24,"Marketing digital, Innovation, Analyse de données"
15908,Zouheir Mrad,zouheir.mrad160@orange.tn,apprenant,+21657528742,Tunisie,Mahdia,1992-12-31,"Développement web, Technologie, Lean management, Agile, DevOps, Audit"
15909,Fatma Ferjani,fatma.ferjani812@topnet.tn,apprenant,+21694725673,Tunisie,Bizerte,1990-01-21,"Conseil, Ressources humaines"
15910,Fatma Khlif,fatma.khlif94@hotmail.com,apprenant,+21694419203,Tunisie,Le Kef,1999-09-22,"Technologie, Analyse de données, Veille technologique, Développement web, Conseil, Entrepreneuriat"
15911,Emad Fatnassi,emad.fatnassi409@topnet.tn,apprenant,+21651306470,Tunisie,Gabès,1986-05-05,"Management, Ressources humaines, Marketing digital, Agile, Innovation, Digital transformation"
15912,Chiraz Guesmi,chiraz.guesmi663@hotmail.com,apprenant,+21699096757,Tunisie,Bizerte,1989-10-01,"Conseil, Veille technologique, Intelligence artificielle, Agile, Informatique"
15913,Nour Jouini,nour.jouini950@laposte.net,apprenant,+21659679614,Tunisie,Siliana,1987-06-07,"Veille technologique, Qualité, Digital transformation"
15914,Karima Ghanmi,karima.ghanmi562@topnet.tn,apprenant,+21690954947,Tunisie,Tunis,1986-10-02,"Leadership, Qualité, Blockchain, DevOps, Business intelligence, Formation professionnelle"
15915,Fethi Nasri,fethi.nasri271@hotmail.com,apprenant,+21651828641,Tunisie,Le Kef,2003-03-04,"Analyse de données, Lean management, Certification"
15916,Hajer Rekik,hajer.rekik361@laposte.net,apprenant,+21628632342,Tunisie,Tozeur,2000-05-07,"Conseil, Machine learning, Finance, Mentoring"
15917,Rania Mahjoub,rania.mahjoub691@gmail.com,apprenant,+21623505519,Tunisie,Tunis,2004-05-26,"Intelligence artificielle, Stratégie d'entreprise, Audit"
15918,Makram Gasmi,makram.gasmi439@live.com,apprenant,+21656259061,Tunisie,Tunis,2007-02-07,"Cloud computing, Communication, Informatique"
15919,Tarek Hleli,tarek.hleli876@laposte.net,apprenant,+21620706305,Tunisie,Gafsa,2007-08-22,"Gestion de projet, Intelligence artificielle"
15920,Wided Louati,wided.louati528@gmail.com,apprenant,+21623779290,Tunisie,Médenine,1994-04-11,"Audit, Qualité, Management"
15921,Latifa Bouzid,latifa.bouzid839@outlook.com,apprenant,+21653080664,Tunisie,Médenine,1990-06-25,"Blockchain, Mentoring, Cybersécurité, Communication, Ressources humaines"
15922,Ahmed Fatnassi,ahmed.fatnassi795@topnet.tn,apprenant,+21624938967,Tunisie,Sfax,1993-02-02,"Cybersécurité, Certification, Leadership, Business intelligence, ITIL, Marketing digital"
15923,Rania Benhassan,rania.benhassan221@topnet.tn,apprenant,+21658732782,Tunisie,Jendouba,2005-09-13,"Coaching, E-commerce, Veille technologique"
15924,Karima Khlif,karima.khlif9@orange.tn,apprenant,+21651505629,Tunisie,Kasserine,1987-07-13,"Marketing digital, Agile"
15925,Ahmed Derbali,ahmed.derbali571@orange.tn,apprenant,+21626353636,Tunisie,Kasserine,1987-10-24,"Blockchain, Cloud computing"
15926,Wael Ghanmi,wael.ghanmi862@outlook.com,apprenant,+21621619965,Tunisie,Sousse,2002-12-23,"Stratégie d'entreprise, Lean management, Entrepreneuriat, Analyse de données"
15927,Ikram Derbali,ikram.derbali194@topnet.tn,apprenant,+21653288771,Tunisie,Tunis,2005-08-22,"ITIL, Innovation"
15928,Ines Laabidi,ines.laabidi212@topnet.tn,apprenant,+21651088461,Tunisie,Mahdia,2005-03-07,"Digital transformation, Lean management, IoT, Cybersécurité, Business intelligence"
15929,Bochra Bouzid,bochra.bouzid160@outlook.com,apprenant,+21693494106,Tunisie,Kasserine,1988-05-12,"Digital transformation, Stratégie d'entreprise, Analyse de données, Innovation, Leadership, E-commerce"
15930,Olfa Omrani,olfa.omrani122@yahoo.fr,apprenant,+21696471800,Tunisie,Sousse,1994-10-12,"E-commerce, Leadership, Informatique, Communication, IoT, DevOps"
15931,Kenza Feriani,kenza.feriani1@topnet.tn,apprenant,+21625585854,Tunisie,Bizerte,1987-08-02,"Machine learning, Cybersécurité, Gestion de projet, Développement web"
15932,Lobna Meddeb,lobna.meddeb412@yahoo.fr,apprenant,+21626811990,Tunisie,Zaghouan,2007-11-10,"Business intelligence, Agile, Informatique, Cybersécurité, Management"
15933,Salah Mansouri,salah.mansouri384@gmail.com,apprenant,+21655245774,Tunisie,Le Kef,1992-03-14,"Digital transformation, Certification, Gestion de projet"
15934,Hiba Jazi,hiba.jazi564@orange.tn,apprenant,+21653882139,Tunisie,Nabeul,1992-09-18,"Innovation, Blockchain, Analyse de données"
15935,Zohra Ferjani,zohra.ferjani503@live.com,apprenant,+21698288723,Tunisie,Tozeur,1992-06-26,"Stratégie d'entreprise, Leadership, Développement web"
15936,Ghazi Gharbi,ghazi.gharbi451@laposte.net,apprenant,+21656859911,Tunisie,Kairouan,2000-05-31,"DevOps, Mentoring, Finance, Agile, Qualité, Technologie"
15937,Fethi Karray,fethi.karray938@outlook.com,apprenant,+21693726352,Tunisie,Tataouine,2004-06-11,"Formation professionnelle, Gestion de projet, Certification, Marketing digital"
15938,Adel Marzouki,adel.marzouki516@orange.tn,apprenant,+21624736320,Tunisie,Kairouan,1991-07-05,"Veille technologique, Mentoring, DevOps"
15939,Fadia Ghorbel,fadia.ghorbel91@gmail.com,apprenant,+21623207336,Tunisie,Médenine,1997-11-02,"E-commerce, Communication, Formation professionnelle, Intelligence artificielle"
15940,Jamel Bouaziz,jamel.bouaziz349@gmail.com,apprenant,+21695486937,Tunisie,Tozeur,1985-12-03,"Communication, Certification"
15941,Hajer Mansouri,hajer.mansouri831@live.com,apprenant,+21653786771,Tunisie,Kairouan,1985-10-19,"Certification, Communication, Cybersécurité, Conseil"
15942,Makram Jouini,makram.jouini493@orange.tn,apprenant,+21696692096,Tunisie,Tataouine,1990-04-03,"Gestion de projet, Communication, Développement web, Informatique, Cybersécurité"
15943,Hedi Fourati,hedi.fourati807@orange.tn,apprenant,+21695028812,Tunisie,Sidi Bouzid,2006-11-13,"Finance, Innovation, Intelligence artificielle, Entrepreneuriat, Cloud computing"
15944,Makram Karoui,makram.karoui287@yahoo.fr,apprenant,+21693231786,Tunisie,Le Kef,1988-11-05,"Finance, Certification, Cloud computing"
16082,Takwa Gabsi,takwa.gabsi655@gmail.com,apprenant,+21658120444,Tunisie,Médenine,1988-11-12,"Conseil, Informatique, Certification"
15945,Tarek Omrani,tarek.omrani881@live.com,apprenant,+21620291439,Tunisie,Sidi Bouzid,1994-03-06,"Veille technologique, Stratégie d'entreprise, Business intelligence, E-commerce"
15946,Yosra Horchani,yosra.horchani118@laposte.net,apprenant,+21697767370,Tunisie,Gafsa,2002-09-08,"Entrepreneuriat, Développement web"
15947,Najoua Chedly,najoua.chedly891@live.com,apprenant,+21622241759,Tunisie,Sousse,1986-08-14,"Certification, Machine learning"
15948,Hana Ouali,hana.ouali393@orange.tn,apprenant,+21652149033,Tunisie,Jendouba,1995-05-16,"Lean management, Machine learning, Communication, Agile"
15949,Intissar Chaabane,intissar.chaabane886@laposte.net,apprenant,+21693999076,Tunisie,Kasserine,2002-11-13,"Informatique, Agile, Leadership, Machine learning"
15950,Slim Sellami,slim.sellami51@yahoo.fr,apprenant,+21651126124,Tunisie,Zaghouan,1996-06-21,"Finance, Lean management, Marketing digital, Ressources humaines, Mentoring"
15951,Jamel Essid,jamel.essid218@yahoo.fr,apprenant,+21622160349,Tunisie,Kasserine,1998-04-09,"Informatique, Gestion de projet, Communication"
15952,Farah Ben Ali,farah.ben.ali293@gmail.com,apprenant,+21652060498,Tunisie,Gafsa,2006-10-26,"Développement web, Leadership"
15953,Emna Laabidi,emna.laabidi520@live.com,apprenant,+21694209960,Tunisie,Jendouba,2004-12-07,"Ressources humaines, Marketing digital"
15954,Imed Bouhamed,imed.bouhamed721@outlook.com,apprenant,+21696880315,Tunisie,Gafsa,1991-08-08,"Machine learning, ITIL, Marketing digital, Leadership, IoT"
15955,Omar Ben Youssef,omar.ben.youssef251@laposte.net,apprenant,+21659706953,Tunisie,Gabès,2007-10-14,"Cybersécurité, Formation professionnelle, Veille technologique, Communication, Stratégie d'entreprise, Audit"
15956,Najoua Khlif,najoua.khlif198@outlook.com,apprenant,+21624470450,Tunisie,Manouba,1997-09-22,"Développement web, Gestion de projet, Blockchain, IoT, Certification"
15957,Zied Trabelsi,zied.trabelsi594@topnet.tn,apprenant,+21628613592,Tunisie,Gabès,2001-03-25,"Entrepreneuriat, Stratégie d'entreprise, E-commerce, Coaching"
15958,Hichem Khlif,hichem.khlif885@outlook.com,apprenant,+21699676141,Tunisie,Zaghouan,2000-04-27,"Blockchain, Analyse de données, Conseil"
15959,Wafa Mestiri,wafa.mestiri413@laposte.net,apprenant,+21625271680,Tunisie,Mahdia,1994-12-12,"Intelligence artificielle, Mentoring, Coaching, ITIL"
15960,Lassad Bouslama,lassad.bouslama182@outlook.com,apprenant,+21658008683,Tunisie,Sousse,1989-05-03,"ITIL, Finance, Développement web, Cybersécurité"
15961,Olfa Laabidi,olfa.laabidi172@outlook.com,apprenant,+21652992557,Tunisie,Sfax,1990-09-14,"Digital transformation, Technologie, Entrepreneuriat, Communication, Mentoring"
15962,Khadija Hachicha,khadija.hachicha60@topnet.tn,apprenant,+21621993830,Tunisie,Gafsa,1988-12-21,"Analyse de données, Management, Cybersécurité, Finance, Audit"
15963,Najoua Sellami,najoua.sellami349@orange.tn,apprenant,+21659340576,Tunisie,Tataouine,1997-05-02,"Intelligence artificielle, Digital transformation, Cybersécurité"
15964,Moez Ben Ahmed,moez.ben.ahmed345@live.com,apprenant,+21655778128,Tunisie,Sousse,1994-04-30,"Intelligence artificielle, Innovation, Finance"
15965,Wael Rekik,wael.rekik603@hotmail.com,apprenant,+21695669623,Tunisie,Tozeur,2000-07-10,"Ressources humaines, Machine learning, Gestion de projet, IoT, Informatique, Entrepreneuriat"
15966,Ghada Hleli,ghada.hleli620@yahoo.fr,apprenant,+21699098002,Tunisie,Ben Arous,2006-11-22,"Leadership, Lean management, Cybersécurité, Technologie, Mentoring"
15967,Farouk Ben Youssef,farouk.ben.youssef523@topnet.tn,apprenant,+21655557579,Tunisie,Sousse,1987-10-20,"DevOps, IoT"
15968,Salma Ben Ahmed,salma.ben.ahmed462@yahoo.fr,apprenant,+21653470179,Tunisie,Kébili,1996-02-27,"Gestion de projet, Leadership"
15969,Dali Ghali,dali.ghali225@outlook.com,apprenant,+21623898641,Tunisie,Kairouan,1985-09-07,"Coaching, Mentoring, Technologie"
15970,Omar Bouaziz,omar.bouaziz169@topnet.tn,apprenant,+21694719896,Tunisie,Tunis,1989-04-10,"Qualité, Cloud computing, Certification, Cybersécurité, Stratégie d'entreprise"
15971,Emna Chaabane,emna.chaabane977@gmail.com,apprenant,+21623322609,Tunisie,Gafsa,1998-11-10,"Intelligence artificielle, Stratégie d'entreprise, Cloud computing, Certification, Digital transformation, Technologie"
15972,Zied Ktari,zied.ktari611@outlook.com,apprenant,+21691470288,Tunisie,Gabès,2006-09-18,"Formation professionnelle, Informatique, Veille technologique"
15973,Moez Mejri,moez.mejri413@hotmail.com,apprenant,+21651388012,Tunisie,Sousse,2006-10-17,"Innovation, Formation professionnelle, Machine learning"
15974,Khaled Dali,khaled.dali382@yahoo.fr,apprenant,+21653562417,Tunisie,Siliana,2000-05-19,"E-commerce, ITIL, Ressources humaines, Management, Innovation, Communication"
15975,Moncef Fourati,moncef.fourati45@hotmail.com,apprenant,+21657180761,Tunisie,Bizerte,1998-01-20,"Technologie, Management, Veille technologique, Coaching"
15976,Farah Ferjani,farah.ferjani386@outlook.com,apprenant,+21659609940,Tunisie,Gafsa,1999-02-21,"Digital transformation, Innovation, Audit, IoT, E-commerce, Certification"
15977,Kais Nabli,kais.nabli530@live.com,apprenant,+21697835344,Tunisie,Kébili,2003-08-16,"Innovation, Technologie"
15978,Amine Ktari,amine.ktari16@gmail.com,apprenant,+21690894929,Tunisie,Kairouan,1988-06-27,"Stratégie d'entreprise, Informatique, Lean management"
15979,Mariam Chihaoui,mariam.chihaoui826@topnet.tn,apprenant,+21654750906,Tunisie,Bizerte,2005-04-09,"Digital transformation, Communication, Ressources humaines, Formation professionnelle, Conseil, Leadership"
15980,Hajer Sellami,hajer.sellami455@live.com,apprenant,+21625407455,Tunisie,Jendouba,1992-12-01,"Développement web, Conseil, Marketing digital, Innovation"
15981,Zohra Ferjani,zohra.ferjani58@outlook.com,apprenant,+21624140424,Tunisie,Tozeur,1987-06-07,"DevOps, Gestion de projet, Stratégie d'entreprise, ITIL, Analyse de données, Innovation"
15982,Ali Layouni,ali.layouni308@outlook.com,apprenant,+21625637585,Tunisie,Kasserine,2007-04-17,"Business intelligence, Ressources humaines"
15983,Bochra Rekik,bochra.rekik607@laposte.net,apprenant,+21651679446,Tunisie,Gabès,1993-05-16,"Coaching, Management, Innovation"
15984,Kais Layouni,kais.layouni152@orange.tn,apprenant,+21693786563,Tunisie,Mahdia,1992-05-05,"Leadership, Business intelligence, Informatique"
15985,Zied Gasmi,zied.gasmi260@hotmail.com,apprenant,+21658098357,Tunisie,Tataouine,1992-08-12,"Intelligence artificielle, Stratégie d'entreprise, Marketing digital, Certification, Innovation, Digital transformation"
15986,Cyrine Hleli,cyrine.hleli652@yahoo.fr,apprenant,+21694788620,Tunisie,Médenine,2006-12-12,"Blockchain, Conseil, Développement web, Certification, Mentoring, Cloud computing"
15987,Marwan Fourati,marwan.fourati523@orange.tn,apprenant,+21628801036,Tunisie,Mahdia,2003-05-10,"Stratégie d'entreprise, Business intelligence"
15988,Hatem Sellami,hatem.sellami299@hotmail.com,apprenant,+21699982311,Tunisie,Tunis,2002-12-07,"Ressources humaines, IoT, Cloud computing, Certification, Management"
15989,Hedi Fourati,hedi.fourati940@hotmail.com,apprenant,+21657493843,Tunisie,Kébili,2000-07-14,"Agile, Marketing digital, Analyse de données, Innovation, Leadership, Intelligence artificielle"
15990,Fares Ben Ali,fares.ben.ali343@laposte.net,apprenant,+21626085703,Tunisie,Sfax,1985-03-13,"Coaching, Gestion de projet, Audit, Formation professionnelle, Agile, ITIL"
15991,Mehdi Guizani,mehdi.guizani616@topnet.tn,apprenant,+21628055904,Tunisie,Kairouan,1999-12-25,"Développement web, IoT, Veille technologique"
15992,Moncef Hleli,moncef.hleli179@laposte.net,apprenant,+21698624432,Tunisie,Sidi Bouzid,1987-01-31,"Finance, ITIL"
15993,Ghazi Mabrouk,ghazi.mabrouk90@laposte.net,apprenant,+21699814532,Tunisie,Sfax,1985-08-23,"Marketing digital, Entrepreneuriat, Qualité"
15994,Hedi Fkih,hedi.fkih664@gmail.com,apprenant,+21622120025,Tunisie,Gabès,1991-11-18,"IoT, Marketing digital"
15995,Cyrine Ferjani,cyrine.ferjani751@yahoo.fr,apprenant,+21652327909,Tunisie,Sfax,1997-10-07,"Formation professionnelle, ITIL, IoT, Veille technologique, Agile"
15996,Olfa Gabsi,olfa.gabsi96@yahoo.fr,apprenant,+21625447338,Tunisie,Tozeur,2000-09-23,"Formation professionnelle, ITIL, Blockchain, E-commerce"
15997,Fatma Dridi,fatma.dridi750@live.com,apprenant,+21629564429,Tunisie,Le Kef,1995-10-20,"Agile, DevOps, Conseil, Business intelligence, Blockchain, Certification"
