ID,Nom,Email,Rôle,Téléphone,Pays,Ville,Date de naissance,Centres d'intérêt
15676,Zied Jelassi,zied.jelassi858@gmail.com,apprenant,+21695710075,Tunisie,Gafsa,1996-03-07,"Analyse de données, Marketing digital, Technologie, Cybersécurité, Lean management"
15677,Hedi Essid,hedi.essid387@laposte.net,apprenant,+21658370419,Tunisie,Nabeul,2007-11-25,"Formation professionnelle, Communication, Informatique"
15678,Kenza Feriani,kenza.feriani860@gmail.com,apprenant,+21629072820,Tunisie,Sidi Bouzid,1996-09-01,"ITIL, Veille technologique, Machine learning, Analyse de données"
15679,Kais Hassen,kais.hassen439@topnet.tn,apprenant,+21623253389,Tunisie,Sousse,1995-03-19,"Stratégie d'entreprise, Lean management"
15680,Bochra Ghali,bochra.ghali63@laposte.net,apprenant,+21624928386,Tunisie,Sidi Bouzid,2006-05-21,"Gestion de projet, E-commerce, Business intelligence, Conseil"
15681,Sofiane Nabli,sofiane.nabli120@topnet.tn,apprenant,+21695633762,Tunisie,Médenine,1999-10-06,"Finance, Management"
15682,Sabrine Miled,sabrine.miled172@laposte.net,apprenant,+21690095556,Tunisie,Tataouine,2007-01-21,"Digital transformation, Marketing digital"
15683,Cyrine Miled,cyrine.miled582@orange.tn,apprenant,+21621826193,Tunisie,Kébili,1994-01-22,"Blockchain, Cloud computing, Marketing digital, Machine learning, Communication"
15684,Samir Ferjani,samir.ferjani780@topnet.tn,apprenant,+21653918133,Tunisie,Jendouba,1989-09-03,"Mentoring, Business intelligence, Analyse de données, Leadership, Conseil, Formation professionnelle"
15685,Tarek Ben Ahmed,tarek.ben.ahmed779@yahoo.fr,apprenant,+21629336524,Tunisie,Médenine,2006-11-30,"Coaching, DevOps, Intelligence artificielle, Gestion de projet, Management, Développement web"
15686,Moez Meddeb,moez.meddeb214@live.com,apprenant,+21696095874,Tunisie,Monastir,1987-06-27,"Lean management, Stratégie d'entreprise"
15687,Amine Hamza,amine.hamza731@gmail.com,apprenant,+21698659264,Tunisie,Monastir,1991-12-31,"Coaching, Informatique, Cloud computing, Technologie, Leadership, Formation professionnelle"
15688,Imed Khedher,imed.khedher44@orange.tn,apprenant,+21629050659,Tunisie,Le Kef,1999-06-06,"Développement web, Veille technologique"
15689,Ali Nabli,ali.nabli347@live.com,apprenant,+21629435224,Tunisie,Béja,2006-05-04,"Analyse de données, Stratégie d'entreprise, Finance, Communication, Management, Coaching"
15690,Hatem Mabrouk,hatem.mabrouk971@orange.tn,apprenant,+21652554567,Tunisie,Nabeul,1999-10-04,"Analyse de données, Business intelligence, Leadership, Audit, Informatique, Agile"
15691,Hichem Kchir,hichem.kchir820@gmail.com,apprenant,+21659723547,Tunisie,Kairouan,2007-10-01,"Ressources humaines, DevOps, Management"
15692,Hiba Mrad,hiba.mrad743@gmail.com,apprenant,+21628684625,Tunisie,Kébili,1998-06-18,"Machine learning, Développement web, Coaching, Marketing digital, Business intelligence"
15693,Dorsaf Ferjani,dorsaf.ferjani488@hotmail.com,apprenant,+21650583953,Tunisie,Sousse,2006-04-02,"Technologie, Ressources humaines, Finance, Stratégie d'entreprise"
15694,Ghada Ktari,ghada.ktari901@live.com,apprenant,+21656491786,Tunisie,Sousse,1988-10-05,"Stratégie d'entreprise, DevOps, Analyse de données, Agile, Leadership"
15695,Imed Layouni,imed.layouni961@hotmail.com,apprenant,+21696340591,Tunisie,Jendouba,1986-06-20,"Coaching, Ressources humaines, DevOps, Stratégie d'entreprise, Informatique"
15696,Hajer Ezzine,hajer.ezzine116@yahoo.fr,apprenant,+21651436698,Tunisie,Kébili,1991-02-24,"Cybersécurité, Conseil, Informatique, Agile"
15697,Sonia Chebbi,sonia.chebbi810@orange.tn,apprenant,+21624718691,Tunisie,Kébili,1992-06-14,"Gestion de projet, Cloud computing, Certification, Développement web, Leadership, Business intelligence"
15698,Kenza Ghali,kenza.ghali238@topnet.tn,apprenant,+21624664092,Tunisie,Tataouine,1988-08-24,"Business intelligence, Machine learning, Développement web"
15699,Makram Ouali,makram.ouali985@yahoo.fr,apprenant,+21695839596,Tunisie,Kasserine,2004-05-21,"Conseil, IoT"
15700,Amel Ezzine,amel.ezzine953@laposte.net,apprenant,+21626724117,Tunisie,Kébili,1992-02-03,"Entrepreneuriat, Blockchain, Communication"
15701,Ahmed Bouhamed,ahmed.bouhamed750@hotmail.com,apprenant,+21650861318,Tunisie,Kairouan,1998-07-21,"Business intelligence, ITIL, Marketing digital, Certification, Mentoring, Machine learning"
15702,Yasmine Fkih,yasmine.fkih835@live.com,apprenant,+21657808812,Tunisie,Sfax,1986-06-12,"Veille technologique, Leadership, Mentoring, Machine learning"
15703,Lamia Chaieb,lamia.chaieb192@hotmail.com,apprenant,+21653849981,Tunisie,Tozeur,1990-06-22,"Développement web, Technologie, Leadership, ITIL"
15704,Moez Horchani,moez.horchani406@laposte.net,apprenant,+21698998717,Tunisie,Nabeul,1991-03-16,"Développement web, Business intelligence, Technologie, Conseil, Ressources humaines"
15705,Khaled Neffati,khaled.neffati909@orange.tn,apprenant,+21628434543,Tunisie,Kébili,2004-04-21,"E-commerce, Blockchain, Développement web, Digital transformation, Technologie"
15706,Rami Hajji,rami.hajji706@hotmail.com,apprenant,+21652783592,Tunisie,Ben Arous,1985-08-18,"Blockchain, Innovation"
15707,Ikram Ben Youssef,ikram.ben.youssef341@orange.tn,apprenant,+21657948253,Tunisie,Bizerte,1998-10-01,"Audit, Machine learning, Certification, Stratégie d'entreprise, Gestion de projet, Qualité"
15708,Wael Mrad,wael.mrad219@live.com,apprenant,+21699020405,Tunisie,Sfax,1992-09-26,"Cybersécurité, ITIL"
15709,Hiba Laabidi,hiba.laabidi542@hotmail.com,apprenant,+21656793969,Tunisie,Zaghouan,1989-07-20,"Intelligence artificielle, Conseil, Management"
15710,Marwan Essid,marwan.essid841@yahoo.fr,apprenant,+21620446729,Tunisie,Kairouan,1987-06-03,"IoT, Finance, Business intelligence"
15711,Fadia Hamza,fadia.hamza93@laposte.net,apprenant,+21693298950,Tunisie,Ariana,1987-08-18,"Entrepreneuriat, Blockchain, Certification, DevOps, Innovation"
15712,Wassim Ktari,wassim.ktari301@live.com,apprenant,+21627075285,Tunisie,Sfax,1988-07-03,"Cloud computing, Informatique, Finance"
15713,Ali Feriani,ali.feriani982@live.com,apprenant,+21620405922,Tunisie,Le Kef,1996-07-17,"ITIL, Blockchain, Veille technologique, Conseil, Machine learning"
15714,Zouheir Gasmi,zouheir.gasmi195@topnet.tn,apprenant,+21654702277,Tunisie,Tataouine,2004-05-17,"Marketing digital, Agile"
15715,Myriam Ezzine,myriam.ezzine464@topnet.tn,apprenant,+21691249774,Tunisie,Mahdia,1987-08-06,"Leadership, Formation professionnelle, Intelligence artificielle"
15716,Fares Marzouki,fares.marzouki913@laposte.net,apprenant,+21655125513,Tunisie,Le Kef,1992-05-18,"Entrepreneuriat, Communication, Gestion de projet"
15717,Noureddine Jebali,noureddine.jebali884@yahoo.fr,apprenant,+21655179732,Tunisie,Médenine,1992-05-15,"Gestion de projet, Innovation, Conseil, Technologie, Ressources humaines, Audit"
15718,Besma Ktari,besma.ktari803@hotmail.com,apprenant,+21628654764,Tunisie,Tunis,1998-11-07,"Technologie, Machine learning, Conseil, ITIL, Cybersécurité"
15719,Slim Hamza,slim.hamza608@live.com,apprenant,+21692846316,Tunisie,Sfax,1985-12-20,"E-commerce, Business intelligence, Ressources humaines"
15720,Nabil Mestiri,nabil.mestiri962@topnet.tn,apprenant,+21657814435,Tunisie,Ariana,1992-07-11,"Marketing digital, Entrepreneuriat, Digital transformation, Gestion de projet"
15721,Yasmine Chaabane,yasmine.chaabane215@live.com,apprenant,+21692662942,Tunisie,Sfax,1994-09-17,"Intelligence artificielle, Mentoring, Lean management"
15722,Ghazi Chihaoui,ghazi.chihaoui473@orange.tn,apprenant,+21654980967,Tunisie,Siliana,1986-01-13,"Certification, Stratégie d'entreprise, Formation professionnelle"
15723,Ghada Bouslama,ghada.bouslama693@outlook.com,apprenant,+21629685663,Tunisie,Sidi Bouzid,1989-07-16,"Conseil, Informatique"
15724,Zohra Hamdi,zohra.hamdi73@hotmail.com,apprenant,+21659098892,Tunisie,Gafsa,2001-09-12,"Certification, Cybersécurité, Formation professionnelle, Gestion de projet"
15725,Mohamed Sellami,mohamed.sellami171@gmail.com,apprenant,+21657595665,Tunisie,Jendouba,2003-10-17,"E-commerce, IoT, Certification, Business intelligence, Machine learning, Digital transformation"
15726,Rim Sellami,rim.sellami103@gmail.com,apprenant,+21696702958,Tunisie,Kébili,1985-10-18,"Audit, Veille technologique, Développement web"
15727,Ridha Mestiri,ridha.mestiri828@orange.tn,apprenant,+21621406842,Tunisie,Monastir,1988-03-19,"Gestion de projet, Formation professionnelle, Mentoring, Audit, Certification"
15728,Chedly Limam,chedly.limam423@yahoo.fr,apprenant,+21695181628,Tunisie,Tunis,2001-07-26,"Entrepreneuriat, Cloud computing, Innovation, IoT"
15729,Rim Benhassan,rim.benhassan626@hotmail.com,apprenant,+21693365891,Tunisie,Sfax,1988-12-16,"Finance, Blockchain, Entrepreneuriat, Coaching, Formation professionnelle"
15730,Kais Khlif,kais.khlif587@live.com,apprenant,+21658383954,Tunisie,Gafsa,1991-09-16,"Marketing digital, Ressources humaines, Intelligence artificielle, Communication, Finance, Lean management"
15731,Rania Mahjoub,rania.mahjoub193@orange.tn,apprenant,+21697919116,Tunisie,Monastir,2003-09-18,"Marketing digital, Technologie"
15732,Samia Gasmi,samia.gasmi157@hotmail.com,apprenant,+21693706109,Tunisie,Tozeur,1997-09-30,"E-commerce, Coaching"
15733,Rami Ghali,rami.ghali695@hotmail.com,apprenant,+21691113553,Tunisie,Gafsa,2000-03-14,"Marketing digital, ITIL, DevOps, Qualité, Gestion de projet"
15734,Adel Hamza,adel.hamza330@gmail.com,apprenant,+21692565053,Tunisie,Kasserine,1991-03-24,"Intelligence artificielle, Leadership"
15735,Adel Nasri,adel.nasri124@gmail.com,apprenant,+21690204043,Tunisie,Gabès,1997-02-17,"Communication, Digital transformation, DevOps, Certification, Business intelligence"
15736,Mehdi Mansouri,mehdi.mansouri296@gmail.com,apprenant,+21627775739,Tunisie,Zaghouan,2002-09-10,"Intelligence artificielle, Coaching, ITIL, Conseil, Management, Stratégie d'entreprise"
15737,Sami Ghanmi,sami.ghanmi985@live.com,apprenant,+21654643361,Tunisie,Kébili,1999-08-27,"Leadership, Lean management, Intelligence artificielle"
15738,Amel Mahjoub,amel.mahjoub264@outlook.com,apprenant,+21623487481,Tunisie,Tataouine,1995-06-20,"Analyse de données, E-commerce, Certification"
15739,Zouheir Mabrouk,zouheir.mabrouk183@gmail.com,apprenant,+21621766434,Tunisie,Siliana,1988-09-13,"IoT, E-commerce, Conseil"
15740,Nabil Ktari,nabil.ktari768@laposte.net,apprenant,+21699231061,Tunisie,Gafsa,1985-02-22,"Leadership, Cloud computing, Communication, Formation professionnelle, Entrepreneuriat"
15741,Latifa Ghali,latifa.ghali150@orange.tn,apprenant,+21628234503,Tunisie,Béja,1987-02-22,"Cybersécurité, Développement web, Intelligence artificielle, Stratégie d'entreprise"
15742,Moez Laabidi,moez.laabidi924@gmail.com,apprenant,+21657186779,Tunisie,Le Kef,1985-10-14,"Développement web, Finance, IoT, Machine learning, Innovation, Agile"
15743,Sonia Mejri,sonia.mejri255@topnet.tn,apprenant,+21627738762,Tunisie,Bizerte,1991-01-23,"Stratégie d'entreprise, Machine learning, Intelligence artificielle, Finance, Veille technologique"
15744,Kais Ghanmi,kais.ghanmi417@yahoo.fr,apprenant,+21653217535,Tunisie,Jendouba,1998-02-06,"Cloud computing, Entrepreneuriat, DevOps, Développement web, Lean management, Cybersécurité"
15745,Amine Omrani,amine.omrani304@orange.tn,apprenant,+21697003021,Tunisie,Ben Arous,2002-06-16,"Agile, Technologie"
15746,Dorsaf Miled,dorsaf.miled971@live.com,apprenant,+21652419431,Tunisie,Manouba,2007-01-04,"DevOps, Stratégie d'entreprise, Technologie, Leadership"
15747,Fadia Jouini,fadia.jouini483@gmail.com,apprenant,+21624721807,Tunisie,Béja,1990-08-23,"Technologie, Entrepreneuriat"
15748,Amira Hamza,amira.hamza867@laposte.net,apprenant,+21656446224,Tunisie,Tataouine,1990-08-11,"Cloud computing, Finance, Communication, Machine learning, Stratégie d'entreprise"
15749,Hajer Hassen,hajer.hassen610@live.com,apprenant,+21625895843,Tunisie,Béja,1991-08-07,"Stratégie d'entreprise, Mentoring, Veille technologique, Technologie, Cloud computing"
15750,Chiraz Fatnassi,chiraz.fatnassi598@orange.tn,apprenant,+21629528387,Tunisie,Tataouine,2006-09-16,"Informatique, DevOps"
15751,Bilel Jouini,bilel.jouini825@orange.tn,apprenant,+21620744173,Tunisie,Ben Arous,2006-02-01,"Lean management, Finance"
15752,Manel Fatnassi,manel.fatnassi754@laposte.net,apprenant,+21652302614,Tunisie,Gafsa,1987-03-23,"Ressources humaines, Mentoring, Intelligence artificielle"
15753,Chiraz Essid,chiraz.essid184@yahoo.fr,apprenant,+21659259011,Tunisie,Kasserine,2002-04-30,"Digital transformation, Marketing digital"
15754,Taoufik Omrani,taoufik.omrani377@topnet.tn,apprenant,+21692073975,Tunisie,Manouba,2006-08-01,"Stratégie d'entreprise, Ressources humaines"
15755,Fethi Jemli,fethi.jemli131@topnet.tn,apprenant,+21652716912,Tunisie,Bizerte,1996-01-05,"Audit, Coaching"
15756,Imed Laabidi,imed.laabidi147@laposte.net,apprenant,+21623808326,Tunisie,Ariana,1997-04-08,"Gestion de projet, Machine learning, Innovation, Digital transformation, Certification, Cybersécurité"
15757,Kais Feriani,kais.feriani650@gmail.com,apprenant,+21694548382,Tunisie,Kasserine,2007-09-02,"Finance, ITIL, Certification, Communication, Intelligence artificielle"
15758,Rania Hamdi,rania.hamdi340@topnet.tn,apprenant,+21652507495,Tunisie,Kasserine,1999-03-06,"E-commerce, Finance, Analyse de données, Veille technologique"
15759,Kenza Omrani,kenza.omrani509@gmail.com,apprenant,+21652829634,Tunisie,Nabeul,1998-09-19,"Veille technologique, Conseil, Blockchain, Finance, Développement web, Informatique"
15760,Cyrine Mestiri,cyrine.mestiri331@outlook.com,apprenant,+21695313564,Tunisie,Ben Arous,1998-04-23,"Innovation, Formation professionnelle, Business intelligence, Analyse de données"
15761,Jihene Ben Salah,jihene.ben.salah826@orange.tn,apprenant,+21650023251,Tunisie,Kébili,2005-07-06,"Technologie, Analyse de données, ITIL, Agile, Ressources humaines, Lean management"
15762,Nesrine Daoud,nesrine.daoud802@topnet.tn,apprenant,+21651276527,Tunisie,Ben Arous,2004-11-24,"Leadership, Formation professionnelle, Communication"
15763,Moez Sellami,moez.sellami860@yahoo.fr,apprenant,+21625542274,Tunisie,Tunis,2007-08-26,"E-commerce, Formation professionnelle, Business intelligence, Veille technologique"
15764,Mariam Hajji,mariam.hajji66@live.com,apprenant,+21699450180,Tunisie,Nabeul,2002-04-04,"Cybersécurité, Stratégie d'entreprise"
15765,Karima Kammoun,karima.kammoun994@topnet.tn,apprenant,+21699906669,Tunisie,Zaghouan,1995-03-27,"Digital transformation, Gestion de projet, Cybersécurité, Formation professionnelle"
15766,Taoufik Ben Salah,taoufik.ben.salah975@yahoo.fr,apprenant,+21629502805,Tunisie,Ariana,2002-02-12,"Intelligence artificielle, Finance"
15767,Fadia Jelassi,fadia.jelassi835@outlook.com,apprenant,+21690298344,Tunisie,Ariana,2004-07-10,"Développement web, Communication, Business intelligence"
15768,Dali Mejri,dali.mejri149@laposte.net,apprenant,+21625156682,Tunisie,Kasserine,1989-10-15,"Coaching, Formation professionnelle, Informatique"
15769,Cyrine Jebali,cyrine.jebali461@gmail.com,apprenant,+21654923149,Tunisie,Kasserine,2001-11-27,"Conseil, ITIL, Innovation, Informatique"
15770,Dorra Ferjani,dorra.ferjani738@laposte.net,apprenant,+21658652010,Tunisie,Bizerte,2002-12-24,"Communication, Digital transformation, Certification, Qualité, Mentoring"
15771,Amira Hassen,amira.hassen204@yahoo.fr,apprenant,+21692400677,Tunisie,Mahdia,1994-09-24,"E-commerce, Leadership, DevOps"
15772,Mohamed Hachicha,mohamed.hachicha6@laposte.net,apprenant,+21697056432,Tunisie,Kairouan,1992-08-14,"DevOps, Innovation, Machine learning"
15773,Lamia Ben Ali,lamia.ben.ali687@live.com,apprenant,+21650811579,Tunisie,Gabès,1988-06-26,"IoT, Analyse de données"
15774,Latifa Rekik,latifa.rekik261@yahoo.fr,apprenant,+21692386987,Tunisie,Nabeul,2006-07-14,"Formation professionnelle, Agile, Machine learning, IoT"
15775,Maher Ben Salah,maher.ben.salah990@laposte.net,apprenant,+21621875684,Tunisie,Kasserine,2000-02-10,"Innovation, Machine learning, Stratégie d'entreprise, Certification"
15776,Samia Bouslama,samia.bouslama96@outlook.com,apprenant,+21690092957,Tunisie,Tozeur,2006-03-22,"Gestion de projet, Technologie, ITIL, Ressources humaines"
15777,Hana Mestiri,hana.mestiri478@live.com,apprenant,+21692000959,Tunisie,Gafsa,1999-11-24,"Ressources humaines, Entrepreneuriat, Marketing digital, Cybersécurité"
15778,Samia Laabidi,samia.laabidi749@laposte.net,apprenant,+21653484125,Tunisie,Kébili,2001-01-27,"Agile, DevOps, Ressources humaines"
15779,Fadia Kchir,fadia.kchir357@hotmail.com,apprenant,+21699692870,Tunisie,Ariana,2003-10-23,"Business intelligence, Communication, Digital transformation, Gestion de projet, Veille technologique, Formation professionnelle"
15780,Ghazi Gabsi,ghazi.gabsi865@outlook.com,apprenant,+21694750103,Tunisie,Béja,1992-10-02,"Digital transformation, E-commerce, Business intelligence"
15781,Salma Hleli,salma.hleli991@topnet.tn,apprenant,+21698921170,Tunisie,Kairouan,1989-09-19,"Agile, E-commerce, Cybersécurité, Analyse de données, Gestion de projet, Mentoring"
15782,Nesrine Ferjani,nesrine.ferjani308@orange.tn,apprenant,+21690956657,Tunisie,Kébili,1996-06-14,"Intelligence artificielle, Développement web"
15783,Bassem Meddeb,bassem.meddeb249@yahoo.fr,apprenant,+21690348314,Tunisie,Sidi Bouzid,1992-05-02,"Certification, Leadership, Cloud computing, Intelligence artificielle, ITIL, Business intelligence"
15784,Manel Chaabane,manel.chaabane167@orange.tn,apprenant,+21657966864,Tunisie,Monastir,2002-10-08,"Analyse de données, Management, Machine learning"
15785,Bochra Jebali,bochra.jebali376@topnet.tn,apprenant,+21693023977,Tunisie,Sfax,1992-05-05,"Veille technologique, Mentoring"
15786,Khadija Jebali,khadija.jebali392@live.com,apprenant,+21650522424,Tunisie,Tataouine,2004-12-09,"Analyse de données, Conseil, Audit, Marketing digital, Informatique"
15787,Hiba Hleli,hiba.hleli495@hotmail.com,apprenant,+21622441519,Tunisie,Manouba,2007-01-15,"Stratégie d'entreprise, Blockchain"
15788,Chedly Hmida,chedly.hmida221@live.com,apprenant,+21629103448,Tunisie,Kébili,2007-06-27,"Lean management, Certification, Mentoring, Veille technologique"
15789,Maher Essid,maher.essid133@hotmail.com,apprenant,+21654576618,Tunisie,Zaghouan,2005-05-17,"Certification, Ressources humaines, E-commerce, Qualité, Veille technologique"
15790,Cyrine Jemli,cyrine.jemli329@outlook.com,apprenant,+21698202683,Tunisie,Ben Arous,1991-06-18,"Conseil, Blockchain, Veille technologique"
15791,Khaled Khlif,khaled.khlif639@outlook.com,apprenant,+21697608317,Tunisie,Zaghouan,2004-04-02,"ITIL, Informatique, Audit"
15792,Najoua Mabrouk,najoua.mabrouk382@gmail.com,apprenant,+21695533633,Tunisie,Jendouba,1997-08-02,"Entrepreneuriat, Audit, DevOps, Gestion de projet, Qualité, Informatique"
15793,Sofiane Jebali,sofiane.jebali589@gmail.com,apprenant,+21657083778,Tunisie,Sfax,2005-08-15,"Mentoring, Analyse de données, Informatique, Gestion de projet, Innovation"
15794,Taoufik Ben Salah,taoufik.ben.salah693@yahoo.fr,apprenant,+21625168413,Tunisie,Jendouba,1985-05-17,"Innovation, Conseil, Digital transformation, Agile, Machine learning"
15795,Zouheir Ktari,zouheir.ktari462@gmail.com,apprenant,+21652199197,Tunisie,Béja,1992-08-22,"Leadership, Coaching, Finance"
15796,Taoufik Mrad,taoufik.mrad234@yahoo.fr,apprenant,+21694237563,Tunisie,Kairouan,1989-04-26,"Entrepreneuriat, Digital transformation, Lean management, Communication, Business intelligence, Développement web"
15797,Wael Ghali,wael.ghali496@orange.tn,apprenant,+21656595225,Tunisie,Kébili,2000-12-11,"Technologie, Agile, Cybersécurité, Ressources humaines"
15798,Latifa Miled,latifa.miled773@yahoo.fr,apprenant,+21652897537,Tunisie,Jendouba,1995-09-17,"Intelligence artificielle, Développement web"
15799,Maroua Neffati,maroua.neffati764@live.com,apprenant,+21658381240,Tunisie,Tunis,1993-03-08,"Cybersécurité, Finance"
15800,Ghazi Mrad,ghazi.mrad280@topnet.tn,apprenant,+21698190301,Tunisie,Jendouba,1987-10-27,"Communication, Analyse de données, Développement web, ITIL, Formation professionnelle, Entrepreneuriat"
15801,Wassim Hajji,wassim.hajji245@gmail.com,apprenant,+21692485855,Tunisie,Sidi Bouzid,1986-01-15,"IoT, Marketing digital, Coaching, Management, Digital transformation"
15802,Sabrine Gabsi,sabrine.gabsi277@gmail.com,apprenant,+21698067969,Tunisie,Gabès,2005-08-03,"Cloud computing, Business intelligence, Leadership"
15803,Thouraya Landolsi,thouraya.landolsi214@topnet.tn,apprenant,+21629354335,Tunisie,Ben Arous,1993-10-11,"Lean management, Blockchain, Communication"
15804,Fethi Chaabane,fethi.chaabane522@topnet.tn,apprenant,+21659408631,Tunisie,Bizerte,1989-11-27,"Communication, Blockchain, Intelligence artificielle"
15805,Intissar Rekik,intissar.rekik222@laposte.net,apprenant,+21627721513,Tunisie,Mahdia,1993-09-26,"Conseil, Qualité, Entrepreneuriat, Formation professionnelle, IoT"
15806,Sonia Sellami,sonia.sellami627@outlook.com,apprenant,+21697793280,Tunisie,Sousse,2007-12-12,"Conseil, Ressources humaines"
15807,Moncef Rekik,moncef.rekik916@hotmail.com,apprenant,+21622449739,Tunisie,Tataouine,2004-11-09,"Communication, Cybersécurité, DevOps, Business intelligence"
15808,Farouk Benhassan,farouk.benhassan796@outlook.com,apprenant,+21624143755,Tunisie,Gafsa,1987-02-27,"Ressources humaines, Veille technologique, Finance, Informatique, Analyse de données, Formation professionnelle"
15809,Amel Mrad,amel.mrad374@outlook.com,apprenant,+21693121593,Tunisie,Mahdia,1991-04-05,"Marketing digital, Machine learning, Management, Lean management"
15810,Karim Hamdi,karim.hamdi444@yahoo.fr,apprenant,+21656229905,Tunisie,Tozeur,1987-07-21,"Cybersécurité, Blockchain, Lean management, Marketing digital"
15811,Latifa Khlif,latifa.khlif562@gmail.com,apprenant,+21622333149,Tunisie,Gafsa,1991-07-31,"Cloud computing, Digital transformation, Communication, Business intelligence, Audit"
15812,Karima Neffati,karima.neffati38@gmail.com,apprenant,+21699634547,Tunisie,Le Kef,2003-01-03,"Lean management, Veille technologique, E-commerce"
15813,Dalila Gharbi,dalila.gharbi650@gmail.com,apprenant,+21653070622,Tunisie,Zaghouan,1988-04-05,"Coaching, Cybersécurité, Business intelligence, Marketing digital, Ressources humaines, Développement web"
15814,Ahmed Ghali,ahmed.ghali750@orange.tn,apprenant,+21624867875,Tunisie,Kairouan,2005-04-25,"Blockchain, Développement web, Business intelligence, Machine learning, DevOps, Cloud computing"
15815,Besma Kchir,besma.kchir915@topnet.tn,apprenant,+21626127149,Tunisie,Kasserine,2003-03-08,"Lean management, Business intelligence, IoT, Développement web, Informatique"
15816,Manel Nasri,manel.nasri100@orange.tn,apprenant,+21652184962,Tunisie,Monastir,1991-07-26,"Conseil, Informatique, Développement web"
15817,Amel Neffati,amel.neffati517@orange.tn,apprenant,+21656297400,Tunisie,Sfax,1987-07-08,"Informatique, Certification, Lean management, Cybersécurité"
15818,Hajer Gasmi,hajer.gasmi805@live.com,apprenant,+21655129313,Tunisie,Siliana,1986-03-14,"Mentoring, Leadership, Audit, DevOps, Technologie"
15819,Hatem Fkih,hatem.fkih293@laposte.net,apprenant,+21651468717,Tunisie,Sousse,1986-05-10,"Technologie, Analyse de données, Machine learning, Informatique"
15820,Nader Ben Salah,nader.ben.salah66@orange.tn,apprenant,+21622400739,Tunisie,Kairouan,2005-09-11,"DevOps, Leadership"
15821,Rania Ktari,rania.ktari433@yahoo.fr,apprenant,+21623264961,Tunisie,Tataouine,1998-05-31,"Entrepreneuriat, Machine learning, Communication"
15822,Rania Dridi,rania.dridi104@laposte.net,apprenant,+21696185713,Tunisie,Siliana,2006-01-21,"Analyse de données, Gestion de projet, Intelligence artificielle, Audit, Formation professionnelle"
15823,Farouk Ezzine,farouk.ezzine947@live.com,apprenant,+21658582269,Tunisie,Gafsa,2001-01-05,"Coaching, Analyse de données, Leadership, Innovation, E-commerce"
15824,Sonia Jebali,sonia.jebali969@hotmail.com,apprenant,+21629521380,Tunisie,Tataouine,1992-04-08,"Mentoring, Analyse de données, Machine learning, Informatique, Technologie, Stratégie d'entreprise"
15825,Nader Hleli,nader.hleli324@gmail.com,apprenant,+21655447329,Tunisie,Sousse,2007-08-09,"Informatique, Machine learning"
15826,Noureddine Dhouib,noureddine.dhouib488@hotmail.com,apprenant,+21624398323,Tunisie,Ariana,2005-09-05,"Leadership, Conseil, Business intelligence, Marketing digital, Qualité"
15827,Jihene Ben Ahmed,jihene.ben.ahmed846@gmail.com,apprenant,+21627737071,Tunisie,Monastir,1989-05-27,"Technologie, Marketing digital, Innovation"
15828,Yassine Chaieb,yassine.chaieb238@yahoo.fr,apprenant,+21651875469,Tunisie,Kébili,2006-02-28,"Cybersécurité, Veille technologique, Gestion de projet, Mentoring, Technologie, Blockchain"
15829,Jihene Hamdi,jihene.hamdi643@gmail.com,apprenant,+21624263722,Tunisie,Kairouan,2005-06-04,"ITIL, DevOps, Formation professionnelle, Digital transformation, Conseil"
15830,Jihene Khedher,jihene.khedher937@hotmail.com,apprenant,+21625612145,Tunisie,Gafsa,1993-02-07,"Qualité, Cloud computing, Ressources humaines, Lean management, E-commerce, Agile"
15831,Walid Mansouri,walid.mansouri236@orange.tn,apprenant,+21693191488,Tunisie,Ben Arous,1985-05-13,"Conseil, DevOps, Agile"
15832,Sami Hajji,sami.hajji563@hotmail.com,apprenant,+21652635706,Tunisie,Béja,1991-08-25,"Management, Qualité, IoT, Cloud computing, Marketing digital"
15833,Hajer Trabelsi,hajer.trabelsi201@hotmail.com,apprenant,+21624853414,Tunisie,Kairouan,2005-10-26,"Lean management, Formation professionnelle, ITIL, Entrepreneuriat, Conseil"
15834,Kais Neffati,kais.neffati363@orange.tn,apprenant,+21622687137,Tunisie,Le Kef,1988-06-19,"ITIL, Cloud computing, Management, Analyse de données, Conseil, Innovation"
15835,Lamia Gharbi,lamia.gharbi472@live.com,apprenant,+21622953432,Tunisie,Kébili,1988-04-05,"Ressources humaines, Cybersécurité, Stratégie d'entreprise, Qualité"
15836,Karim Kammoun,karim.kammoun209@yahoo.fr,apprenant,+21699482568,Tunisie,Béja,1996-05-06,"Technologie, Digital transformation, Business intelligence, Agile"
