ID,Nom,Email,Rôle,Téléphone,Pays,Ville,Date de naissance,Centres d'intérêt
16853,Lamia Sellami,lamia.sellami92@outlook.com,apprenant,+21656803086,Tunisie,Gabès,1989-05-20,"Audit, E-commerce, Machine learning, Formation professionnelle, Management, ITIL"
16854,Salah Maaloul,salah.maaloul779@topnet.tn,apprenant,+21624642700,Tunisie,Nabeul,1991-10-19,"Cybersécurité, Entrepreneuriat, Technologie"
16855,Zouheir Louati,zouheir.louati478@outlook.com,apprenant,+21654169893,Tunisie,Nabeul,2006-03-12,"Conseil, Finance, Agile, ITIL, Formation professionnelle"
16856,Sabrine Khlif,sabrine.khlif794@laposte.net,apprenant,+21625790122,Tunisie,Kébili,2007-03-12,"DevOps, Communication, Gestion de projet, Innovation, ITIL"
16857,Omar Mahjoub,omar.mahjoub591@live.com,apprenant,+21691095560,Tunisie,Le Kef,1992-04-27,"Leadership, Lean management, Communication, Analyse de données"
16858,Ghada Jazi,ghada.jazi221@live.com,apprenant,+21658426575,Tunisie,Tozeur,2004-04-16,"Certification, Technologie, Audit, Blockchain"
16859,Sonia Jelassi,sonia.jelassi71@live.com,apprenant,+21650577120,Tunisie,Tataouine,1989-02-15,"Innovation, Qualité, Formation professionnelle, Stratégie d'entreprise, Intelligence artificielle, E-commerce"
16860,Emna Laabidi,emna.laabidi491@yahoo.fr,apprenant,+21622079468,Tunisie,Ben Arous,1997-04-08,"Lean management, Digital transformation, Coaching, Informatique, DevOps"
16861,Samia Mestiri,samia.mestiri29@live.com,apprenant,+21693974348,Tunisie,Tunis,1992-08-05,"Conseil, Lean management, Agile, Marketing digital"
16862,Rania Chebbi,rania.chebbi818@hotmail.com,apprenant,+21624905501,Tunisie,Zaghouan,2004-02-14,"Technologie, Marketing digital, Conseil, Finance"
16863,Rami Mejri,rami.mejri57@laposte.net,apprenant,+21690380312,Tunisie,Jendouba,1989-03-04,"Analyse de données, DevOps, Stratégie d'entreprise, Marketing digital, Développement web"
16864,Bilel Ghorbel,bilel.ghorbel678@yahoo.fr,apprenant,+21620996888,Tunisie,Le Kef,1989-12-18,"Stratégie d'entreprise, Certification, Lean management, Conseil, Cloud computing"
16865,Wassim Khedher,wassim.khedher832@live.com,apprenant,+21654487300,Tunisie,Sfax,2007-06-20,"Marketing digital, Machine learning, Cybersécurité, Technologie, Formation professionnelle, Analyse de données"
16866,Bochra Hassen,bochra.hassen777@yahoo.fr,apprenant,+21656913717,Tunisie,Ariana,2007-09-15,"ITIL, Audit, Technologie, Agile"
16867,Ahmed Maaloul,ahmed.maaloul907@hotmail.com,apprenant,+21621105777,Tunisie,Manouba,1986-01-14,"IoT, Qualité, Coaching"
16868,Salah Ktari,salah.ktari828@orange.tn,apprenant,+21651507715,Tunisie,Manouba,1986-02-15,"Marketing digital, Machine learning, Technologie, Lean management, Stratégie d'entreprise"
16869,Dorra Ouali,dorra.ouali502@yahoo.fr,apprenant,+21623770161,Tunisie,Kébili,2000-06-01,"Ressources humaines, Développement web, E-commerce"
16870,Marwan Trabelsi,marwan.trabelsi831@gmail.com,apprenant,+21628722460,Tunisie,Tunis,2001-06-03,"Technologie, Analyse de données, Cybersécurité"
16871,Fares Meddeb,fares.meddeb652@yahoo.fr,apprenant,+21694822479,Tunisie,Jendouba,2000-01-06,"Business intelligence, Gestion de projet"
16872,Ali Guesmi,ali.guesmi663@live.com,apprenant,+21696744238,Tunisie,Siliana,1988-10-19,"Communication, Veille technologique, Mentoring, Cybersécurité, E-commerce, Leadership"
16873,Jihene Rekik,jihene.rekik196@outlook.com,apprenant,+21694226523,Tunisie,Tozeur,2004-06-25,"Analyse de données, Entrepreneuriat"
16874,Bassem Hadj,bassem.hadj274@laposte.net,apprenant,+21653189755,Tunisie,Le Kef,1992-02-15,"Marketing digital, Lean management, Leadership"
16875,Sofiane Trabelsi,sofiane.trabelsi873@outlook.com,apprenant,+21624745942,Tunisie,Nabeul,1987-04-13,"Ressources humaines, Informatique, Technologie, Innovation, Analyse de données, Mentoring"
16876,Youssef Jemli,youssef.jemli768@outlook.com,apprenant,+21627410617,Tunisie,Tataouine,1988-02-27,"Coaching, Qualité, Formation professionnelle, Communication"
16877,Lassad Landolsi,lassad.landolsi645@live.com,apprenant,+21690918560,Tunisie,Gafsa,1993-10-20,"Conseil, Digital transformation, Leadership, Intelligence artificielle"
16878,Yasmine Hassen,yasmine.hassen941@yahoo.fr,apprenant,+21625058864,Tunisie,Kairouan,2001-08-17,"Cloud computing, Mentoring, Innovation, Gestion de projet"
16879,Jihene Bouslama,jihene.bouslama374@gmail.com,apprenant,+21625625750,Tunisie,Tunis,2003-10-16,"E-commerce, Lean management, Analyse de données, Conseil, Informatique, Innovation"
16880,Ghazi Rekik,ghazi.rekik27@gmail.com,apprenant,+21620388856,Tunisie,Tozeur,2002-10-21,"IoT, Mentoring, Développement web"
16881,Omar Laabidi,omar.laabidi631@live.com,apprenant,+21624568495,Tunisie,Mahdia,1990-03-14,"Management, Ressources humaines, Stratégie d'entreprise, Mentoring, Blockchain, Intelligence artificielle"
16882,Cyrine Sellami,cyrine.sellami182@hotmail.com,apprenant,+21628554762,Tunisie,Gabès,1985-10-10,"Développement web, Certification, ITIL"
16883,Maher Hassen,maher.hassen687@topnet.tn,apprenant,+21658164720,Tunisie,Sousse,1998-11-08,"Marketing digital, Cybersécurité"
16884,Moez Ghanmi,moez.ghanmi930@topnet.tn,apprenant,+21626463149,Tunisie,Kairouan,1990-07-12,"Veille technologique, E-commerce, Informatique, Lean management, Formation professionnelle, Ressources humaines"
16885,Noureddine Ghali,noureddine.ghali552@laposte.net,apprenant,+21655516217,Tunisie,Manouba,2000-04-24,"Entrepreneuriat, Machine learning, Ressources humaines"
16886,Tarek Karray,tarek.karray101@yahoo.fr,apprenant,+21659567250,Tunisie,Monastir,1989-06-26,"Cloud computing, Digital transformation, Communication"
16887,Hedi Chedly,hedi.chedly171@outlook.com,apprenant,+21690257329,Tunisie,Kasserine,1999-11-11,"Certification, Digital transformation, IoT, Mentoring, Stratégie d'entreprise"
16888,Hedi Maaloul,hedi.maaloul666@laposte.net,apprenant,+21623735888,Tunisie,Médenine,2003-11-30,"Veille technologique, Communication, DevOps, Mentoring, Entrepreneuriat"
16889,Manel Ben Youssef,manel.ben.youssef856@laposte.net,apprenant,+21628128818,Tunisie,Gabès,2001-01-24,"Lean management, Innovation, E-commerce, Veille technologique, Stratégie d'entreprise"
16890,Salah Bouaziz,salah.bouaziz410@laposte.net,apprenant,+21699829796,Tunisie,Sidi Bouzid,1996-09-24,"Lean management, Finance, Coaching"
16891,Myriam Nabli,myriam.nabli599@outlook.com,apprenant,+21653580305,Tunisie,Manouba,1987-06-23,"Leadership, Audit, Analyse de données"
16892,Makram Mansouri,makram.mansouri53@outlook.com,apprenant,+21697199640,Tunisie,Sfax,1990-12-07,"Intelligence artificielle, Business intelligence, Analyse de données, Marketing digital, Ressources humaines"
16893,Hatem Jelassi,hatem.jelassi843@orange.tn,apprenant,+21651919690,Tunisie,Ariana,2002-10-20,"ITIL, Ressources humaines, Coaching, Technologie, Cloud computing, Machine learning"
16894,Makram Horchani,makram.horchani81@live.com,apprenant,+21698240186,Tunisie,Sousse,2000-09-20,"Business intelligence, Cybersécurité, Machine learning"
16895,Zeineb Bouzid,zeineb.bouzid806@yahoo.fr,apprenant,+21652112884,Tunisie,Sousse,2006-07-31,"Marketing digital, Développement web"
16896,Wael Essid,wael.essid680@yahoo.fr,apprenant,+21691524000,Tunisie,Mahdia,1991-01-09,"Analyse de données, Lean management, Cloud computing, Conseil, Développement web, Certification"
16897,Hedi Dali,hedi.dali389@live.com,apprenant,+21652598665,Tunisie,Tunis,1987-09-17,"Innovation, Analyse de données, Veille technologique"
16898,Moncef Daoud,moncef.daoud589@laposte.net,apprenant,+21626462530,Tunisie,Mahdia,2004-05-22,"E-commerce, Analyse de données"
16899,Jihene Omrani,jihene.omrani457@gmail.com,apprenant,+21696605574,Tunisie,Monastir,1992-01-08,"Ressources humaines, Marketing digital"
16900,Olfa Fourati,olfa.fourati517@orange.tn,apprenant,+21656249447,Tunisie,Tozeur,2002-02-19,"Digital transformation, Agile, Finance"
16901,Ghazi Mestiri,ghazi.mestiri80@outlook.com,apprenant,+21692182883,Tunisie,Le Kef,2000-04-10,"Stratégie d'entreprise, Développement web, Mentoring"
16902,Intissar Mahjoub,intissar.mahjoub473@outlook.com,apprenant,+21659389145,Tunisie,Le Kef,1991-01-20,"Innovation, Communication"
16903,Amel Nasri,amel.nasri110@outlook.com,apprenant,+21652515170,Tunisie,Sidi Bouzid,1986-07-23,"Développement web, Intelligence artificielle, Veille technologique, Management"
16904,Adel Bouslama,adel.bouslama315@live.com,apprenant,+21629581091,Tunisie,Siliana,1986-09-26,"Intelligence artificielle, Mentoring, Cybersécurité, Machine learning, Ressources humaines, Entrepreneuriat"
16905,Fethi Hamza,fethi.hamza906@live.com,apprenant,+21694716225,Tunisie,Ben Arous,2000-06-21,"Entrepreneuriat, Informatique"
16906,Hichem Karoui,hichem.karoui523@laposte.net,apprenant,+21624443499,Tunisie,Monastir,1999-10-11,"Marketing digital, Ressources humaines, Business intelligence"
16907,Farouk Dridi,farouk.dridi132@gmail.com,apprenant,+21651799810,Tunisie,Kairouan,1991-05-22,"Formation professionnelle, Informatique, Cloud computing, Communication"
16908,Nabil Ezzine,nabil.ezzine66@gmail.com,apprenant,+21692586875,Tunisie,Bizerte,2006-10-10,"Technologie, Qualité, Management"
16909,Bochra Maaloul,bochra.maaloul566@gmail.com,apprenant,+21698592004,Tunisie,Kasserine,1990-04-24,"Analyse de données, Business intelligence, Leadership"
16910,Mariam Hajji,mariam.hajji66@orange.tn,apprenant,+21627063611,Tunisie,Kairouan,1997-02-02,"Innovation, Conseil"
16911,Chiraz Karray,chiraz.karray943@hotmail.com,apprenant,+21655199978,Tunisie,Le Kef,1993-06-09,"Mentoring, Gestion de projet, Développement web, IoT, Coaching"
16912,Olfa Gasmi,olfa.gasmi231@orange.tn,apprenant,+21699142689,Tunisie,Nabeul,2005-10-03,"Veille technologique, Intelligence artificielle, E-commerce, Leadership"
16913,Sonia Dali,sonia.dali92@topnet.tn,apprenant,+21659229060,Tunisie,Kairouan,2005-06-14,"Management, Communication, Technologie, Conseil, Informatique, Cloud computing"
16914,Latifa Neffati,latifa.neffati153@orange.tn,apprenant,+21697267376,Tunisie,Sfax,2002-06-16,"Développement web, Business intelligence, ITIL, Innovation"
16915,Farouk Jemli,farouk.jemli899@yahoo.fr,apprenant,+21657009105,Tunisie,Tozeur,1996-02-16,"Blockchain, Management, Cybersécurité, Qualité, Communication"
16916,Ridha Meddeb,ridha.meddeb338@live.com,apprenant,+21653068908,Tunisie,Sousse,1995-05-27,"DevOps, Innovation, Développement web"
16917,Fares Maaloul,fares.maaloul527@gmail.com,apprenant,+21697220711,Tunisie,Siliana,1987-09-06,"IoT, ITIL, E-commerce, Coaching, Mentoring"
16918,Makram Ben Ahmed,makram.ben.ahmed374@outlook.com,apprenant,+21694120519,Tunisie,Gabès,1988-07-03,"Qualité, Cybersécurité, Business intelligence, Stratégie d'entreprise, Agile, Développement web"
16919,Farah Ghanmi,farah.ghanmi739@live.com,apprenant,+21623131105,Tunisie,Sousse,1998-01-25,"Finance, Audit, Ressources humaines, Gestion de projet, DevOps"
16920,Thouraya Miled,thouraya.miled458@outlook.com,apprenant,+21698264175,Tunisie,Nabeul,1986-02-20,"Stratégie d'entreprise, Cloud computing, Mentoring, Management, Communication, Intelligence artificielle"
16921,Salah Karray,salah.karray886@outlook.com,apprenant,+21658139701,Tunisie,Tozeur,1999-09-05,"Communication, Digital transformation, E-commerce"
16922,Ghada Kchir,ghada.kchir343@laposte.net,apprenant,+21653152862,Tunisie,Tunis,1992-10-15,"Management, Gestion de projet, Ressources humaines, Machine learning, Leadership, Certification"
16923,Khadija Miled,khadija.miled47@outlook.com,apprenant,+21625514794,Tunisie,Monastir,1999-03-06,"IoT, Qualité, Agile, Développement web, Audit, Communication"
16924,Ghazi Marzouki,ghazi.marzouki404@live.com,apprenant,+21624221941,Tunisie,Bizerte,2004-12-19,"Mentoring, DevOps, Audit, Communication"
16925,Takwa Derbali,takwa.derbali6@topnet.tn,apprenant,+21655864152,Tunisie,Ben Arous,1990-02-13,"ITIL, Cybersécurité"
16926,Hedi Chaabane,hedi.chaabane166@topnet.tn,apprenant,+21626739467,Tunisie,Monastir,2006-03-21,"Management, Digital transformation, Développement web"
16927,Chiraz Chihaoui,chiraz.chihaoui151@orange.tn,apprenant,+21654112499,Tunisie,Ariana,2003-12-18,"Machine learning, ITIL, IoT, Finance, Audit"
16928,Fadia Ferchichi,fadia.ferchichi86@yahoo.fr,apprenant,+21626317941,Tunisie,Le Kef,2003-06-06,"Finance, Communication, Développement web, Agile"
16929,Chiraz Rekik,chiraz.rekik373@live.com,apprenant,+21623810041,Tunisie,Sfax,2004-03-19,"Management, Machine learning"
16930,Moncef Louati,moncef.louati596@yahoo.fr,apprenant,+21651352074,Tunisie,Monastir,2006-05-31,"Veille technologique, Gestion de projet, Marketing digital"
16931,Wafa Mabrouk,wafa.mabrouk752@hotmail.com,apprenant,+21653166523,Tunisie,Béja,1997-11-01,"E-commerce, Informatique, Formation professionnelle"
16932,Nesrine Hachicha,nesrine.hachicha460@yahoo.fr,apprenant,+21651535546,Tunisie,Zaghouan,2005-04-19,"Leadership, Audit, Ressources humaines, ITIL, Agile, Certification"
16933,Nesrine Karray,nesrine.karray242@yahoo.fr,apprenant,+21690123198,Tunisie,Sousse,1987-08-13,"Business intelligence, Technologie, Lean management, Cloud computing"
16934,Samia Omrani,samia.omrani297@live.com,apprenant,+21628583738,Tunisie,Béja,1995-10-16,"Certification, ITIL, Informatique, Analyse de données"
16935,Ghada Bouzid,ghada.bouzid869@live.com,apprenant,+21621609675,Tunisie,Ariana,2007-12-27,"Management, Stratégie d'entreprise, Machine learning, Business intelligence"
16936,Lobna Hamza,lobna.hamza667@topnet.tn,apprenant,+21654762318,Tunisie,Kairouan,1994-01-25,"ITIL, Intelligence artificielle, Communication, Innovation, DevOps"
16937,Fatma Miled,fatma.miled820@outlook.com,apprenant,+21659699070,Tunisie,Monastir,1989-09-21,"Blockchain, Développement web, Analyse de données, E-commerce, Stratégie d'entreprise"
16938,Sabrine Derbali,sabrine.derbali938@outlook.com,apprenant,+21653345287,Tunisie,Tunis,1986-06-08,"Certification, Qualité, Blockchain, Cloud computing, Lean management, Gestion de projet"
16939,Bochra Karoui,bochra.karoui833@outlook.com,apprenant,+21653090905,Tunisie,Kasserine,1989-05-03,"Finance, Audit, Qualité"
16940,Wassim Nasri,wassim.nasri4@live.com,apprenant,+21691132354,Tunisie,Mahdia,1993-05-23,"ITIL, Gestion de projet, DevOps"
16941,Intissar Kammoun,intissar.kammoun600@laposte.net,apprenant,+21656775015,Tunisie,Siliana,2005-02-26,"Qualité, Communication, Leadership, Mentoring, Agile"
16942,Olfa Horchani,olfa.horchani387@laposte.net,apprenant,+21696504255,Tunisie,Kairouan,2006-03-20,"Communication, Finance, Entrepreneuriat, Analyse de données, Intelligence artificielle, Développement web"
16943,Samir Chebbi,samir.chebbi303@laposte.net,apprenant,+21628648549,Tunisie,Mahdia,2007-12-18,"Coaching, Mentoring, DevOps, Management, Conseil, Machine learning"
16944,Lobna Gabsi,lobna.gabsi341@hotmail.com,apprenant,+21623369894,Tunisie,Sfax,1985-05-26,"IoT, Développement web, Leadership"
16945,Karim Rekik,karim.rekik180@orange.tn,apprenant,+21694808393,Tunisie,Mahdia,2001-12-20,"Intelligence artificielle, Blockchain, Audit, Informatique, Ressources humaines, Certification"
16946,Fares Chebbi,fares.chebbi181@topnet.tn,apprenant,+21627482745,Tunisie,Mahdia,1988-12-02,"Gestion de projet, Innovation, Finance, Veille technologique"
16947,Wael Mestiri,wael.mestiri375@topnet.tn,apprenant,+21692449649,Tunisie,Ben Arous,2004-05-18,"Management, Entrepreneuriat, Formation professionnelle, Informatique, Business intelligence"
16948,Zohra Daoud,zohra.daoud404@hotmail.com,apprenant,+21656952471,Tunisie,Tataouine,1990-08-18,"Finance, Communication, Digital transformation, Analyse de données, Mentoring"
16949,Cyrine Fourati,cyrine.fourati167@laposte.net,apprenant,+21624387641,Tunisie,Sfax,1989-11-13,"Ressources humaines, Analyse de données, Machine learning"
16950,Kenza Dali,kenza.dali880@outlook.com,apprenant,+21651299786,Tunisie,Ben Arous,1992-02-10,"Lean management, Qualité, Digital transformation, Machine learning"
16951,Emad Hleli,emad.hleli170@topnet.tn,apprenant,+21625528965,Tunisie,Tataouine,2007-06-19,"Formation professionnelle, Leadership, Intelligence artificielle, Gestion de projet"
16952,Makram Sellami,makram.sellami488@topnet.tn,apprenant,+21699136596,Tunisie,Jendouba,1997-11-03,"Machine learning, E-commerce, Analyse de données, IoT, Gestion de projet"
16953,Tarek Bouhamed,tarek.bouhamed686@live.com,apprenant,+21656271652,Tunisie,Sfax,2002-10-11,"Gestion de projet, Qualité, E-commerce"
16954,Hedi Jebali,hedi.jebali337@laposte.net,apprenant,+21653160660,Tunisie,Ariana,1989-05-12,"Communication, Ressources humaines, Intelligence artificielle, E-commerce, Qualité"
16955,Latifa Fkih,latifa.fkih890@hotmail.com,apprenant,+21621769559,Tunisie,Médenine,1999-11-22,"Coaching, Innovation, Business intelligence, Audit, IoT, Stratégie d'entreprise"
16956,Noureddine Gasmi,noureddine.gasmi203@gmail.com,apprenant,+21620559865,Tunisie,Kasserine,2002-08-12,"Ressources humaines, Leadership, Machine learning"
16957,Adel Khedher,adel.khedher488@orange.tn,apprenant,+21697063980,Tunisie,Tataouine,2004-02-11,"DevOps, Ressources humaines, Lean management, Gestion de projet, IoT"
16958,Hana Ben Salah,hana.ben.salah273@gmail.com,apprenant,+21653631358,Tunisie,Tozeur,2001-05-22,"Intelligence artificielle, Développement web, DevOps, Mentoring, Communication, Ressources humaines"
16959,Olfa Chihaoui,olfa.chihaoui129@live.com,apprenant,+21651865424,Tunisie,Siliana,1995-12-26,"Entrepreneuriat, DevOps, E-commerce, Qualité, Finance"
16960,Besma Ben Ahmed,besma.ben.ahmed712@laposte.net,apprenant,+21658192750,Tunisie,Sidi Bouzid,1991-06-19,"Veille technologique, Gestion de projet"
16961,Fares Horchani,fares.horchani249@outlook.com,apprenant,+21623447452,Tunisie,Sousse,2006-07-16,"Veille technologique, Coaching, Digital transformation"
16962,Fadia Nasri,fadia.nasri440@topnet.tn,apprenant,+21650154140,Tunisie,Gafsa,1996-07-23,"Agile, Technologie, Intelligence artificielle"
16963,Omar Sellami,omar.sellami304@hotmail.com,apprenant,+21654709047,Tunisie,Nabeul,1989-10-05,"Machine learning, DevOps, Cybersécurité, Management"
16964,Najoua Kammoun,najoua.kammoun590@outlook.com,apprenant,+21698500126,Tunisie,Mahdia,1987-01-18,"Communication, Innovation"
16965,Mehdi Meddeb,mehdi.meddeb329@topnet.tn,apprenant,+21690733816,Tunisie,Sidi Bouzid,1991-10-12,"Agile, Blockchain, Mentoring, Qualité"
16966,Youssef Neffati,youssef.neffati679@hotmail.com,apprenant,+21659725673,Tunisie,Sfax,2000-05-07,"Conseil, Leadership, Informatique, Certification, Analyse de données"
16967,Rania Jouini,rania.jouini278@yahoo.fr,apprenant,+21697549859,Tunisie,Tataouine,1990-06-23,"Business intelligence, Technologie, Informatique, Qualité, Leadership, Machine learning"
16968,Zied Bouaziz,zied.bouaziz28@topnet.tn,apprenant,+21651537878,Tunisie,Zaghouan,1991-05-23,"DevOps, Développement web, Audit"
16969,Zeineb Layouni,zeineb.layouni785@live.com,apprenant,+21659281024,Tunisie,Gafsa,1995-09-07,"Business intelligence, DevOps, Certification, Machine learning, Conseil, Cybersécurité"
16970,Bochra Nabli,bochra.nabli219@live.com,apprenant,+21697106663,Tunisie,Mahdia,2000-02-20,"Audit, Technologie, Agile"
16971,Zied Ben Salah,zied.ben.salah147@hotmail.com,apprenant,+21692142659,Tunisie,Tozeur,1993-03-25,"Coaching, ITIL"
16972,Amira Fourati,amira.fourati79@live.com,apprenant,+21659284109,Tunisie,Médenine,1992-01-09,"Agile, Informatique"
16973,Amira Khlif,amira.khlif56@yahoo.fr,apprenant,+21657772989,Tunisie,Sidi Bouzid,1992-05-18,"IoT, Communication, Entrepreneuriat, Stratégie d'entreprise, Intelligence artificielle, DevOps"
16974,Rim Hamza,rim.hamza905@yahoo.fr,apprenant,+21695538631,Tunisie,Kasserine,2006-06-17,"Communication, Gestion de projet, Cybersécurité, ITIL, Coaching, Conseil"
16975,Rim Dhouib,rim.dhouib351@gmail.com,apprenant,+21659854707,Tunisie,Sousse,1985-12-21,"Cloud computing, Marketing digital"
16976,Makram Khlif,makram.khlif709@live.com,apprenant,+21691693763,Tunisie,Kairouan,2003-09-17,"ITIL, Innovation, Coaching, Digital transformation, Blockchain, Informatique"
16977,Myriam Kchir,myriam.kchir967@outlook.com,apprenant,+21620042432,Tunisie,Kairouan,1987-08-04,"Formation professionnelle, Lean management, Blockchain, ITIL, Gestion de projet, Entrepreneuriat"
16978,Ahmed Jebali,ahmed.jebali556@live.com,apprenant,+21623689082,Tunisie,Siliana,1994-10-24,"Développement web, Informatique, Veille technologique, Ressources humaines"
16979,Adel Bouaziz,adel.bouaziz894@yahoo.fr,apprenant,+21655151333,Tunisie,Bizerte,2006-12-01,"Gestion de projet, Marketing digital, Mentoring"
16980,Amine Feriani,amine.feriani892@hotmail.com,apprenant,+21626237519,Tunisie,Tunis,1991-04-05,"Certification, Management, Conseil"
16981,Thouraya Fatnassi,thouraya.fatnassi292@topnet.tn,apprenant,+21655374496,Tunisie,Bizerte,1988-04-06,"Finance, Communication, Certification, IoT, Développement web, ITIL"
16982,Samir Hadj,samir.hadj94@live.com,apprenant,+21622337606,Tunisie,Bizerte,1988-03-25,"Digital transformation, Formation professionnelle, Cloud computing, Communication, Marketing digital, Développement web"
16983,Chiraz Daoud,chiraz.daoud66@topnet.tn,apprenant,+21653283058,Tunisie,Monastir,1988-12-02,"Lean management, ITIL, Audit, Coaching, Innovation, Business intelligence"
16984,Wael Hajji,wael.hajji889@laposte.net,apprenant,+21699079935,Tunisie,Médenine,1997-01-04,"Intelligence artificielle, Management, Entrepreneuriat, Gestion de projet, Analyse de données, E-commerce"
16985,Nader Chaieb,nader.chaieb54@live.com,apprenant,+21656924911,Tunisie,Mahdia,1993-09-10,"Communication, Audit, Analyse de données, ITIL"
16986,Sofiane Jelassi,sofiane.jelassi417@live.com,apprenant,+21624426998,Tunisie,Nabeul,1997-05-06,"Digital transformation, Qualité, Développement web, Lean management, Cloud computing"
16987,Maroua Ktari,maroua.ktari24@hotmail.com,apprenant,+21651052238,Tunisie,Gafsa,2000-08-10,"Gestion de projet, Certification"
16988,Makram Karray,makram.karray850@orange.tn,apprenant,+21653384342,Tunisie,Ben Arous,1995-02-18,"DevOps, Intelligence artificielle, Marketing digital"
16989,Zohra Fourati,zohra.fourati541@yahoo.fr,apprenant,+21628134563,Tunisie,Gafsa,1987-05-21,"Ressources humaines, Leadership, Innovation, Cloud computing"
16990,Khadija Dali,khadija.dali534@live.com,apprenant,+21656137717,Tunisie,Gabès,1987-03-13,"Cybersécurité, Communication, Cloud computing, Innovation, Informatique, Marketing digital"
16991,Zouheir Bouhamed,zouheir.bouhamed168@live.com,apprenant,+21628843549,Tunisie,Jendouba,2007-12-04,"Leadership, Certification, Finance, Coaching"
16992,Zohra Chihaoui,zohra.chihaoui762@gmail.com,apprenant,+21695275293,Tunisie,Sidi Bouzid,1991-11-02,"DevOps, Finance, Marketing digital, Formation professionnelle, Mentoring, Agile"
16993,Besma Kammoun,besma.kammoun879@laposte.net,apprenant,+21695534538,Tunisie,Nabeul,1999-06-23,"Audit, IoT, Cybersécurité, Ressources humaines, Stratégie d'entreprise"
16994,Zied Sellami,zied.sellami524@live.com,apprenant,+21624727190,Tunisie,Ben Arous,1986-08-27,"Coaching, Finance, Communication, Cybersécurité, Entrepreneuriat, Mentoring"
16995,Dalila Laabidi,dalila.laabidi65@outlook.com,apprenant,+21690077532,Tunisie,Tataouine,1988-10-31,"Innovation, Conseil, Business intelligence, Cybersécurité, Technologie, Agile"
16996,Ghazi Jelassi,ghazi.jelassi349@orange.tn,apprenant,+21626238055,Tunisie,Sfax,2003-03-17,"Formation professionnelle, Leadership, Technologie, Innovation, E-commerce, Marketing digital"
16997,Nabil Horchani,nabil.horchani311@gmail.com,apprenant,+21620864113,Tunisie,Le Kef,2006-03-21,"Formation professionnelle, Gestion de projet, Ressources humaines, Technologie, Audit, E-commerce"
16998,Zohra Ben Ahmed,zohra.ben.ahmed321@topnet.tn,apprenant,+21659552755,Tunisie,Tozeur,2000-04-06,"Mentoring, ITIL, Agile, Stratégie d'entreprise"
16999,Chiraz Chaieb,chiraz.chaieb220@hotmail.com,apprenant,+21621538251,Tunisie,Le Kef,1999-04-19,"Analyse de données, Audit"
17000,Hiba Hmida,hiba.hmida373@live.com,apprenant,+21629720170,Tunisie,Kairouan,2002-10-17,"Veille technologique, Mentoring"
17001,Ghada Jemli,ghada.jemli705@topnet.tn,apprenant,+21629633421,Tunisie,Monastir,2002-05-02,"Gestion de projet, IoT, Marketing digital, Conseil, Certification"
17002,Fethi Mansouri,fethi.mansouri155@laposte.net,apprenant,+21694674413,Tunisie,Sousse,2005-03-08,"Communication, Innovation, Cloud computing"
17003,Chedly Jelassi,chedly.jelassi655@hotmail.com,apprenant,+21696904137,Tunisie,Kébili,2003-04-04,"Blockchain, ITIL, Ressources humaines, DevOps, Business intelligence"
17004,Noureddine Labidi,noureddine.labidi369@laposte.net,apprenant,+21698301989,Tunisie,Sidi Bouzid,1998-01-13,"Business intelligence, Intelligence artificielle, Qualité, IoT, DevOps"
17005,Walid Mansouri,walid.mansouri503@gmail.com,apprenant,+21698975101,Tunisie,Bizerte,2001-06-23,"Qualité, Développement web, Management"
17006,Emna Landolsi,emna.landolsi888@hotmail.com,apprenant,+21694651750,Tunisie,Manouba,2002-11-03,"Qualité, Ressources humaines, Développement web, Informatique"
17007,Sofiane Jebali,sofiane.jebali887@outlook.com,apprenant,+21621382661,Tunisie,Mahdia,1986-07-13,"Blockchain, Agile, ITIL, Entrepreneuriat, Certification, Finance"
17008,Samir Louati,samir.louati375@topnet.tn,apprenant,+21623305255,Tunisie,Gafsa,1992-05-02,"Veille technologique, Innovation, Cybersécurité"
17009,Lassad Fourati,lassad.fourati812@outlook.com,apprenant,+21650540807,Tunisie,Gabès,1999-07-23,"DevOps, Cloud computing"
17010,Salma Bouaziz,salma.bouaziz12@topnet.tn,apprenant,+21629252594,Tunisie,Médenine,2003-04-17,"Stratégie d'entreprise, Business intelligence, Marketing digital"
17011,Samia Jebali,samia.jebali388@gmail.com,apprenant,+21694393413,Tunisie,Ben Arous,1985-05-05,"Machine learning, Communication, Certification"
17012,Wided Mrad,wided.mrad760@laposte.net,apprenant,+21650609627,Tunisie,Sfax,1994-03-03,"Cybersécurité, Coaching, Machine learning, Finance, Leadership"
