ID,Nom,Email,Rôle,Téléphone,Pays,Ville,Date de naissance,Centres d'intérêt
17013,Nabil Gharbi,nabil.gharbi466@live.com,apprenant,+21658813103,Tunisie,Médenine,1990-06-14,"Marketing digital, Certification, Gestion de projet, IoT, Stratégie d'entreprise"
17014,Karima Meddeb,karima.meddeb126@gmail.com,apprenant,+21620577400,Tunisie,Ariana,1995-02-23,"ITIL, Blockchain, Stratégie d'entreprise, IoT, Coaching, Business intelligence"
17015,Farouk Hamza,farouk.hamza120@live.com,apprenant,+21628576775,Tunisie,Béja,1989-02-15,"Cybersécurité, Lean management"
17016,Ghazi Feriani,ghazi.feriani829@outlook.com,apprenant,+21620679595,Tunisie,Béja,1999-12-24,"Communication, Agile, Audit, Machine learning, Conseil, Développement web"
17017,Sofiane Fourati,sofiane.fourati39@gmail.com,apprenant,+21697255434,Tunisie,Tozeur,1994-11-19,"Finance, ITIL, Agile, Gestion de projet, Communication, Machine learning"
17018,Nader Ben Youssef,nader.ben.youssef729@gmail.com,apprenant,+21624157899,Tunisie,Kairouan,2006-10-25,"ITIL, Ressources humaines, E-commerce, Leadership, Intelligence artificielle"
17019,Hatem Ben Youssef,hatem.ben.youssef225@topnet.tn,apprenant,+21628222208,Tunisie,Kasserine,2002-02-09,"E-commerce, Communication, Digital transformation, Veille technologique, Mentoring, Marketing digital"
17020,Mohamed Mansouri,mohamed.mansouri600@orange.tn,apprenant,+21627071821,Tunisie,Tozeur,2004-02-07,"Ressources humaines, Stratégie d'entreprise, Certification, Entrepreneuriat, Coaching, Leadership"
17021,Wafa Chaieb,wafa.chaieb427@live.com,apprenant,+21692912191,Tunisie,Médenine,1997-09-21,"Stratégie d'entreprise, Formation professionnelle"
17022,Kenza Bouzid,kenza.bouzid346@yahoo.fr,apprenant,+21653609792,Tunisie,Kairouan,1998-06-13,"Cloud computing, Digital transformation"
17023,Fethi Derbali,fethi.derbali391@outlook.com,apprenant,+21697885973,Tunisie,Sidi Bouzid,1993-02-16,"Gestion de projet, Innovation, Informatique, ITIL"
17024,Dali Trabelsi,dali.trabelsi760@gmail.com,apprenant,+21650846496,Tunisie,Siliana,1994-01-01,"Conseil, Finance, Veille technologique, Technologie"
17025,Salma Kchir,salma.kchir624@yahoo.fr,apprenant,+21695866749,Tunisie,Tunis,1995-07-20,"Machine learning, Analyse de données, Management, Veille technologique"
17026,Khadija Omrani,khadija.omrani826@topnet.tn,apprenant,+21624670452,Tunisie,Kasserine,1988-08-15,"Mentoring, Leadership, Management, E-commerce, Analyse de données, Machine learning"
17027,Wided Fourati,wided.fourati986@topnet.tn,apprenant,+21653560005,Tunisie,Monastir,1994-01-24,"Lean management, Intelligence artificielle, Cybersécurité"
17028,Sabrine Mabrouk,sabrine.mabrouk461@laposte.net,apprenant,+21626161829,Tunisie,Bizerte,2004-06-05,"Cloud computing, Formation professionnelle, Management, Informatique"
17029,Ali Fkih,ali.fkih383@live.com,apprenant,+21698372620,Tunisie,Gabès,2002-09-03,"Informatique, Conseil, Certification, IoT, E-commerce"
17030,Wassim Hajji,wassim.hajji145@yahoo.fr,apprenant,+21620232817,Tunisie,Ariana,1996-06-06,"Management, DevOps, Cybersécurité, Certification, Stratégie d'entreprise, Marketing digital"
17031,Hana Ghanmi,hana.ghanmi793@live.com,apprenant,+21693362453,Tunisie,Nabeul,1990-07-04,"Intelligence artificielle, Lean management, Cloud computing, Coaching, Digital transformation, Qualité"
17032,Moez Gasmi,moez.gasmi572@hotmail.com,apprenant,+21620334679,Tunisie,Zaghouan,1995-03-08,"Conseil, Analyse de données, E-commerce, ITIL, Mentoring"
17033,Takwa Bouhamed,takwa.bouhamed863@topnet.tn,apprenant,+21695271121,Tunisie,Médenine,2001-12-17,"Veille technologique, Cloud computing"
17034,Lobna Trabelsi,lobna.trabelsi174@hotmail.com,apprenant,+21652451730,Tunisie,Ariana,1996-02-23,"Cybersécurité, Veille technologique, Technologie, DevOps, Analyse de données, Machine learning"
17035,Marwan Dridi,marwan.dridi969@hotmail.com,apprenant,+21655732662,Tunisie,Médenine,2000-06-24,"Qualité, ITIL, Gestion de projet, Analyse de données, Agile"
17036,Nabil Fourati,nabil.fourati465@live.com,apprenant,+21690703417,Tunisie,Kairouan,1987-03-10,"Formation professionnelle, Leadership"
17037,Sonia Kammoun,sonia.kammoun51@gmail.com,apprenant,+21698106386,Tunisie,Tozeur,1994-02-08,"Entrepreneuriat, Développement web"
17038,Maroua Karoui,maroua.karoui153@outlook.com,apprenant,+21650731365,Tunisie,Kairouan,1992-08-16,"Business intelligence, Formation professionnelle, Management, Veille technologique, DevOps"
17039,Marwan Maaloul,marwan.maaloul756@topnet.tn,apprenant,+21624800170,Tunisie,Tozeur,2004-12-20,"Cybersécurité, Communication, Gestion de projet, Entrepreneuriat, Conseil"
17040,Marwan Chebbi,marwan.chebbi276@live.com,apprenant,+21697178029,Tunisie,Mahdia,1989-01-05,"Qualité, Cloud computing, Agile, Stratégie d'entreprise"
17041,Lassad Chaabane,lassad.chaabane289@yahoo.fr,apprenant,+21650330496,Tunisie,Tozeur,1992-01-24,"Digital transformation, Coaching, Entrepreneuriat"
17042,Ahlem Marzouki,ahlem.marzouki651@live.com,apprenant,+21655642244,Tunisie,Bizerte,1994-07-12,"IoT, DevOps"
17043,Mehdi Layouni,mehdi.layouni152@outlook.com,apprenant,+21698221103,Tunisie,Jendouba,2003-11-02,"Informatique, Intelligence artificielle, Qualité, Business intelligence, Mentoring"
17044,Youssef Hmida,youssef.hmida532@orange.tn,apprenant,+21623453453,Tunisie,Tozeur,1999-05-11,"Lean management, Qualité, Machine learning, Cybersécurité, Management"
17045,Jamel Fatnassi,jamel.fatnassi497@topnet.tn,apprenant,+21626348899,Tunisie,Jendouba,2005-01-21,"Entrepreneuriat, Intelligence artificielle, Cybersécurité"
17046,Amira Ghanmi,amira.ghanmi324@hotmail.com,apprenant,+21622238380,Tunisie,Sousse,2003-03-17,"Veille technologique, Stratégie d'entreprise"
17047,Imed Bouzid,imed.bouzid629@yahoo.fr,apprenant,+21620779136,Tunisie,Ben Arous,1997-02-27,"Blockchain, Business intelligence"
17048,Wafa Ezzine,wafa.ezzine318@topnet.tn,apprenant,+21650947728,Tunisie,Ben Arous,1986-04-02,"Agile, Ressources humaines, Mentoring, Innovation, Leadership"
17049,Samir Guesmi,samir.guesmi981@outlook.com,apprenant,+21653992833,Tunisie,Siliana,1999-08-18,"Agile, Coaching"
17050,Aymen Omrani,aymen.omrani14@hotmail.com,apprenant,+21653942315,Tunisie,Sidi Bouzid,2001-05-12,"IoT, E-commerce, Agile, Qualité, Coaching"
17051,Takwa Hamdi,takwa.hamdi820@yahoo.fr,apprenant,+21626783635,Tunisie,Bizerte,1996-04-30,"Machine learning, Stratégie d'entreprise"
17052,Hedi Chedly,hedi.chedly690@topnet.tn,apprenant,+21652434624,Tunisie,Nabeul,1995-10-11,"Cybersécurité, Mentoring, Certification, Gestion de projet, Entrepreneuriat, Business intelligence"
17053,Slim Horchani,slim.horchani808@hotmail.com,apprenant,+21650724241,Tunisie,Manouba,2002-07-01,"IoT, Stratégie d'entreprise, Marketing digital, Gestion de projet"
17054,Myriam Mahjoub,myriam.mahjoub674@orange.tn,apprenant,+21628709956,Tunisie,Ben Arous,2005-07-27,"Ressources humaines, Gestion de projet, Audit, Technologie, Marketing digital"
17055,Amel Kammoun,amel.kammoun316@topnet.tn,apprenant,+21654653377,Tunisie,Tunis,1998-02-12,"Coaching, Mentoring, Développement web, Certification, Stratégie d'entreprise"
17056,Samir Kammoun,samir.kammoun893@hotmail.com,apprenant,+21658003357,Tunisie,Jendouba,2007-12-27,"Stratégie d'entreprise, Blockchain, Formation professionnelle, Qualité, Cybersécurité"
17057,Latifa Fkih,latifa.fkih988@gmail.com,apprenant,+21624476179,Tunisie,Béja,1998-04-15,"Marketing digital, Machine learning, Qualité"
17058,Farah Fourati,farah.fourati919@topnet.tn,apprenant,+21692176898,Tunisie,Gabès,1989-05-20,"Technologie, Lean management"
17059,Makram Ben Salah,makram.ben.salah670@yahoo.fr,apprenant,+21657023904,Tunisie,Bizerte,1996-06-30,"Leadership, Business intelligence, Blockchain, Agile, Lean management"
17060,Marwan Hajji,marwan.hajji39@yahoo.fr,apprenant,+21696331546,Tunisie,Tataouine,1991-12-27,"Qualité, Mentoring, Entrepreneuriat, Cybersécurité"
17061,Hedi Gabsi,hedi.gabsi15@gmail.com,apprenant,+21699845324,Tunisie,Tozeur,1985-03-26,"Développement web, Cloud computing"
17062,Mariam Chebbi,mariam.chebbi535@gmail.com,apprenant,+21650385687,Tunisie,Nabeul,1994-06-04,"Ressources humaines, Cloud computing"
17063,Sonia Dridi,sonia.dridi147@topnet.tn,apprenant,+21691114005,Tunisie,Zaghouan,2003-12-09,"Business intelligence, IoT, Digital transformation, Coaching, Informatique"
17064,Zohra Gasmi,zohra.gasmi437@yahoo.fr,apprenant,+21694964627,Tunisie,Kébili,2002-12-04,"Entrepreneuriat, Digital transformation, Agile, Cybersécurité, Mentoring, Innovation"
17065,Ali Ezzine,ali.ezzine901@hotmail.com,apprenant,+21654739686,Tunisie,Bizerte,1996-04-12,"Entrepreneuriat, Ressources humaines, Leadership, Veille technologique, Cloud computing"
17066,Slim Chihaoui,slim.chihaoui701@live.com,apprenant,+21622046466,Tunisie,Gafsa,1988-11-12,"Leadership, ITIL, Machine learning"
17067,Nader Louati,nader.louati30@orange.tn,apprenant,+21621328338,Tunisie,Siliana,2001-01-04,"Intelligence artificielle, Audit, Coaching, Analyse de données, Veille technologique"
17068,Emad Gasmi,emad.gasmi453@laposte.net,apprenant,+21652383269,Tunisie,Bizerte,1998-06-22,"Leadership, Mentoring, Gestion de projet, Analyse de données"
17069,Nabil Mabrouk,nabil.mabrouk544@live.com,apprenant,+21657133167,Tunisie,Gabès,2007-10-21,"Informatique, Analyse de données, Formation professionnelle"
17070,Ikram Jouini,ikram.jouini697@orange.tn,apprenant,+21698828991,Tunisie,Jendouba,1987-12-05,"Marketing digital, DevOps, Digital transformation, Mentoring, Cloud computing"
17071,Omar Jazi,omar.jazi996@live.com,apprenant,+21628992808,Tunisie,Kairouan,1993-01-02,"Blockchain, Technologie, Stratégie d'entreprise, Mentoring"
17072,Chiraz Gharbi,chiraz.gharbi256@hotmail.com,apprenant,+21657192590,Tunisie,Kébili,1985-12-07,"Management, Communication, IoT"
17073,Kenza Mestiri,kenza.mestiri78@orange.tn,apprenant,+21697405552,Tunisie,Jendouba,1986-06-06,"Qualité, Communication, IoT, Leadership, Gestion de projet"
17074,Hedi Guizani,hedi.guizani126@hotmail.com,apprenant,+21650253215,Tunisie,Médenine,1987-01-20,"Développement web, Machine learning, Entrepreneuriat, Formation professionnelle, Qualité"
17075,Wael Jazi,wael.jazi27@hotmail.com,apprenant,+21628276126,Tunisie,Tunis,1992-04-20,"Innovation, Qualité, Gestion de projet, Digital transformation, Agile, ITIL"
17076,Karim Dali,karim.dali748@topnet.tn,apprenant,+21657927369,Tunisie,Manouba,1999-07-20,"Coaching, Conseil"
17077,Sofiane Chihaoui,sofiane.chihaoui968@gmail.com,apprenant,+21658946452,Tunisie,Tataouine,1987-12-08,"Marketing digital, Finance, Ressources humaines, Cybersécurité, Veille technologique"
17078,Slim Hajji,slim.hajji414@outlook.com,apprenant,+21652520224,Tunisie,Béja,1988-10-16,"Développement web, Stratégie d'entreprise, Lean management"
17079,Najoua Dali,najoua.dali708@gmail.com,apprenant,+21654757972,Tunisie,Kébili,1997-12-17,"Formation professionnelle, Agile"
17080,Farouk Fkih,farouk.fkih624@orange.tn,apprenant,+21658138611,Tunisie,Nabeul,2002-06-14,"Management, Développement web, Marketing digital"
17081,Rim Mrad,rim.mrad897@hotmail.com,apprenant,+21653171076,Tunisie,Monastir,2005-12-07,"Audit, Cybersécurité"
17082,Jihene Nasri,jihene.nasri261@live.com,apprenant,+21627551414,Tunisie,Kasserine,1989-03-13,"Agile, Stratégie d'entreprise, Intelligence artificielle, IoT, Développement web"
17083,Ridha Jazi,ridha.jazi369@orange.tn,apprenant,+21656346660,Tunisie,Sousse,2006-08-19,"Technologie, Stratégie d'entreprise"
17084,Hatem Chihaoui,hatem.chihaoui536@laposte.net,apprenant,+21697159627,Tunisie,Bizerte,2000-03-21,"Qualité, Conseil, Machine learning"
17085,Khadija Mestiri,khadija.mestiri516@gmail.com,apprenant,+21656699567,Tunisie,Mahdia,1997-12-08,"Blockchain, Innovation, Finance"
17086,Zeineb Ferjani,zeineb.ferjani259@gmail.com,apprenant,+21622931236,Tunisie,Nabeul,2000-06-20,"ITIL, Mentoring, Marketing digital, Machine learning, Agile, Lean management"
17087,Hichem Maaloul,hichem.maaloul570@outlook.com,apprenant,+21625213279,Tunisie,Sfax,1997-05-12,"ITIL, Agile, Blockchain, Veille technologique"
17088,Taoufik Khedher,taoufik.khedher7@laposte.net,apprenant,+21654785277,Tunisie,Jendouba,1993-06-06,"Lean management, Veille technologique, Business intelligence, Communication, ITIL, Blockchain"
17089,Yasmine Dali,yasmine.dali705@laposte.net,apprenant,+21655823380,Tunisie,Kasserine,1990-12-13,"Leadership, Formation professionnelle"
17090,Rim Marzouki,rim.marzouki41@laposte.net,apprenant,+21629488212,Tunisie,Bizerte,1993-09-09,"Mentoring, Coaching, Communication, Analyse de données, Business intelligence, Qualité"
17091,Ahmed Benhassan,ahmed.benhassan678@orange.tn,apprenant,+21621328813,Tunisie,Zaghouan,1997-07-15,"IoT, Finance, Agile, Coaching"
17092,Lamia Meddeb,lamia.meddeb238@orange.tn,apprenant,+21657345723,Tunisie,Kasserine,1995-01-27,"Agile, Business intelligence, Coaching, Certification, Digital transformation, Qualité"
17093,Ali Ktari,ali.ktari867@outlook.com,apprenant,+21695441705,Tunisie,Sousse,1986-02-10,"Management, Finance, Technologie, Conseil"
17094,Noureddine Ben Ali,noureddine.ben.ali361@hotmail.com,apprenant,+21693641096,Tunisie,Gabès,1998-04-21,"Veille technologique, Finance, Blockchain, Informatique, Mentoring"
17095,Maroua Laabidi,maroua.laabidi839@yahoo.fr,apprenant,+21699179396,Tunisie,Kasserine,2006-08-20,"Blockchain, Business intelligence, Coaching, Certification, Entrepreneuriat, Management"
17096,Khadija Dhouib,khadija.dhouib559@orange.tn,apprenant,+21690713174,Tunisie,Kasserine,2001-12-16,"Analyse de données, ITIL, E-commerce, IoT, Lean management"
17097,Samia Chaabane,samia.chaabane489@outlook.com,apprenant,+21625551616,Tunisie,Mahdia,1989-06-10,"Blockchain, Certification, DevOps, Innovation, Leadership"
17098,Kenza Guesmi,kenza.guesmi376@gmail.com,apprenant,+21654373159,Tunisie,Ariana,2005-07-17,"Certification, Veille technologique, Entrepreneuriat, Conseil, Agile"
17099,Amel Mahjoub,amel.mahjoub640@live.com,apprenant,+21658874307,Tunisie,Nabeul,2004-03-04,"Gestion de projet, Digital transformation, Conseil, Analyse de données, Qualité"
17100,Zohra Derbali,zohra.derbali52@orange.tn,apprenant,+21652945448,Tunisie,Médenine,1987-03-08,"Agile, E-commerce, Intelligence artificielle"
17101,Amine Chedly,amine.chedly249@gmail.com,apprenant,+21620358626,Tunisie,Ariana,1986-08-19,"Certification, Technologie, Communication, Blockchain, Leadership, Digital transformation"
17102,Cyrine Ben Salah,cyrine.ben.salah505@laposte.net,apprenant,+21695787536,Tunisie,Bizerte,1994-10-19,"Technologie, Audit, Blockchain"
17103,Emad Omrani,emad.omrani922@hotmail.com,apprenant,+21620009051,Tunisie,Ben Arous,1999-05-23,"Agile, Innovation, Technologie"
17104,Chedly Khlif,chedly.khlif646@live.com,apprenant,+21620379720,Tunisie,Zaghouan,1998-06-07,"E-commerce, Gestion de projet"
17105,Thouraya Gharbi,thouraya.gharbi528@live.com,apprenant,+21621101098,Tunisie,Bizerte,1985-06-06,"Entrepreneuriat, Cybersécurité, Management, Leadership, Intelligence artificielle"
17106,Dali Ouali,dali.ouali4@gmail.com,apprenant,+21692381992,Tunisie,Sousse,1985-10-22,"Entrepreneuriat, Intelligence artificielle, Blockchain, Cloud computing, Stratégie d'entreprise, Innovation"
17107,Yassine Chihaoui,yassine.chihaoui691@outlook.com,apprenant,+21657077437,Tunisie,Tozeur,1996-04-16,"IoT, Marketing digital, Certification, Analyse de données, Digital transformation"
17108,Bochra Ben Ali,bochra.ben.ali184@live.com,apprenant,+21654673338,Tunisie,Tunis,1999-03-26,"Coaching, Stratégie d'entreprise, Veille technologique, Lean management"
17109,Ahmed Guesmi,ahmed.guesmi437@gmail.com,apprenant,+21653904705,Tunisie,Tozeur,1987-07-18,"DevOps, Développement web, Certification, Informatique"
17110,Mehdi Meddeb,mehdi.meddeb934@gmail.com,apprenant,+21659065528,Tunisie,Jendouba,2006-06-12,"Veille technologique, Mentoring, DevOps"
17111,Dorsaf Ouali,dorsaf.ouali204@laposte.net,apprenant,+21650740299,Tunisie,Sfax,1985-01-24,"Marketing digital, Audit, Blockchain, Développement web, Digital transformation"
17112,Nesrine Fatnassi,nesrine.fatnassi290@hotmail.com,apprenant,+21654528637,Tunisie,Nabeul,1985-09-06,"Audit, Analyse de données, Mentoring"
17113,Wided Ben Salah,wided.ben.salah47@live.com,apprenant,+21690519950,Tunisie,Kébili,1994-03-18,"Management, Innovation, DevOps, Finance, Coaching, Analyse de données"
17114,Walid Ben Salah,walid.ben.salah284@orange.tn,apprenant,+21624699306,Tunisie,Kasserine,2004-01-10,"Blockchain, Informatique, DevOps, Intelligence artificielle"
17115,Taoufik Rekik,taoufik.rekik914@orange.tn,apprenant,+21691882566,Tunisie,Gabès,1987-08-12,"Business intelligence, Certification, Entrepreneuriat, Cloud computing, Formation professionnelle, Veille technologique"
17116,Hajer Dali,hajer.dali731@gmail.com,apprenant,+21622768220,Tunisie,Béja,2000-01-23,"Cybersécurité, Communication, IoT, Agile, ITIL, Entrepreneuriat"
17117,Taoufik Bouaziz,taoufik.bouaziz48@orange.tn,apprenant,+21692821499,Tunisie,Médenine,1998-01-18,"Audit, Formation professionnelle, Mentoring, Informatique, Finance, Innovation"
17118,Yasmine Kammoun,yasmine.kammoun812@topnet.tn,apprenant,+21698472415,Tunisie,Tataouine,2005-09-26,"Innovation, Management, Digital transformation"
17119,Fatma Omrani,fatma.omrani886@orange.tn,apprenant,+21693635378,Tunisie,Gabès,1989-01-01,"Cloud computing, Stratégie d'entreprise, Informatique, Business intelligence"
17120,Najoua Mejri,najoua.mejri287@gmail.com,apprenant,+21654324653,Tunisie,Manouba,2000-02-27,"ITIL, Intelligence artificielle, Finance, Développement web"
17121,Yassine Omrani,yassine.omrani706@live.com,apprenant,+21693591482,Tunisie,Kébili,1995-12-04,"IoT, Ressources humaines, Blockchain"
17122,Rania Bouslama,rania.bouslama864@gmail.com,apprenant,+21695791419,Tunisie,Gabès,2003-10-04,"Stratégie d'entreprise, Cloud computing, Développement web, Technologie, Coaching"
17123,Dalila Louati,dalila.louati492@orange.tn,apprenant,+21691838267,Tunisie,Kairouan,1995-12-05,"Qualité, Analyse de données"
17334,Emad Mabrouk,emad.mabrouk43@hotmail.com,apprenant,+21694503462,Tunisie,Zaghouan,1985-03-21,"Cybersécurité, IoT, Innovation, Communication, DevOps"
17124,Najoua Karoui,najoua.karoui436@gmail.com,apprenant,+21658267152,Tunisie,Kasserine,2006-07-09,"Certification, Coaching, Lean management, Ressources humaines, Agile, Développement web"
17125,Chiraz Gasmi,chiraz.gasmi377@hotmail.com,apprenant,+21621290885,Tunisie,Kasserine,1997-02-26,"Management, E-commerce, Communication"
17126,Nour Mahjoub,nour.mahjoub944@hotmail.com,apprenant,+21653750760,Tunisie,Jendouba,1995-02-11,"Technologie, Lean management"
17127,Youssef Bouaziz,youssef.bouaziz665@yahoo.fr,apprenant,+21659750542,Tunisie,Manouba,1993-08-16,"Gestion de projet, Marketing digital, Innovation, Technologie"
17128,Karim Kammoun,karim.kammoun233@outlook.com,apprenant,+21624047405,Tunisie,Jendouba,2000-06-03,"Mentoring, Cybersécurité, Stratégie d'entreprise"
17129,Lassad Nasri,lassad.nasri350@gmail.com,apprenant,+21626508540,Tunisie,Tunis,1993-11-25,"Informatique, Audit, Finance, Qualité, Veille technologique"
17130,Intissar Hamdi,intissar.hamdi828@live.com,apprenant,+21691178989,Tunisie,Ariana,1990-01-05,"ITIL, Certification, Qualité, Intelligence artificielle, Blockchain"
17131,Ghada Guizani,ghada.guizani1@live.com,apprenant,+21650923856,Tunisie,Tozeur,2003-03-04,"Certification, Management, Agile, Intelligence artificielle"
17132,Sami Karray,sami.karray554@laposte.net,apprenant,+21656435450,Tunisie,Sousse,1989-11-02,"DevOps, Agile, Leadership"
17133,Karim Hamza,karim.hamza288@yahoo.fr,apprenant,+21698150662,Tunisie,Manouba,2001-12-12,"ITIL, Communication, Agile, Analyse de données, Management"
17134,Farouk Dridi,farouk.dridi157@live.com,apprenant,+21655124151,Tunisie,Tozeur,1992-01-10,"Digital transformation, Entrepreneuriat, DevOps, Cybersécurité"
17135,Walid Kchir,walid.kchir336@orange.tn,apprenant,+21651147434,Tunisie,Kasserine,2000-06-01,"Informatique, DevOps, Veille technologique"
17136,Lamia Khlif,lamia.khlif720@gmail.com,apprenant,+21696075961,Tunisie,Sousse,2002-10-27,"Audit, IoT, Conseil, Veille technologique, Blockchain, Analyse de données"
17137,Fatma Jelassi,fatma.jelassi579@yahoo.fr,apprenant,+21690536304,Tunisie,Ariana,1998-03-01,"Communication, Certification"
17138,Thouraya Ktari,thouraya.ktari921@gmail.com,apprenant,+21695418829,Tunisie,Monastir,1988-05-25,"Leadership, DevOps, Veille technologique, Marketing digital, Entrepreneuriat"
17139,Mohamed Kammoun,mohamed.kammoun129@outlook.com,apprenant,+21691478758,Tunisie,Sousse,1986-10-01,"Digital transformation, E-commerce"
17140,Makram Ghorbel,makram.ghorbel738@outlook.com,apprenant,+21654870615,Tunisie,Ben Arous,2006-02-02,"Mentoring, Stratégie d'entreprise, Développement web"
17141,Hatem Bouslama,hatem.bouslama505@laposte.net,apprenant,+21629360929,Tunisie,Ben Arous,1998-12-10,"IoT, Veille technologique, Gestion de projet, Finance"
17142,Tarek Ferjani,tarek.ferjani771@gmail.com,apprenant,+21699860478,Tunisie,Ben Arous,2000-01-26,"Machine learning, Informatique, Stratégie d'entreprise, Blockchain, Développement web, Formation professionnelle"
17143,Wided Maaloul,wided.maaloul101@laposte.net,apprenant,+21651032303,Tunisie,Béja,1993-09-17,"Audit, Communication, Business intelligence"
17144,Rami Layouni,rami.layouni380@topnet.tn,apprenant,+21625402537,Tunisie,Tataouine,1998-04-10,"Entrepreneuriat, Qualité, Mentoring, Business intelligence, Coaching"
17145,Chedly Ezzine,chedly.ezzine93@outlook.com,apprenant,+21650342384,Tunisie,Monastir,1986-12-23,"Cloud computing, Qualité, Mentoring, Audit, E-commerce"
17146,Nour Hajji,nour.hajji688@yahoo.fr,apprenant,+21624920185,Tunisie,Sfax,1989-09-24,"Finance, Digital transformation"
17147,Samia Jebali,samia.jebali31@topnet.tn,apprenant,+21626804472,Tunisie,Mahdia,2007-03-20,"Innovation, Développement web, Communication, Informatique, Cybersécurité"
17148,Moez Derbali,moez.derbali878@topnet.tn,apprenant,+21622358025,Tunisie,Mahdia,1989-07-06,"Blockchain, E-commerce, Coaching, DevOps, Digital transformation"
17149,Sami Chaabane,sami.chaabane640@live.com,apprenant,+21697941647,Tunisie,Gabès,1989-08-12,"Formation professionnelle, Agile, Conseil"
17150,Ahmed Maaloul,ahmed.maaloul243@laposte.net,apprenant,+21695563578,Tunisie,Manouba,1992-01-01,"Audit, Veille technologique, Entrepreneuriat, Blockchain, Cloud computing, Lean management"
17151,Maroua Mestiri,maroua.mestiri864@orange.tn,apprenant,+21658175516,Tunisie,Béja,2004-05-22,"ITIL, Leadership, Informatique, Marketing digital, Audit"
17152,Wafa Nasri,wafa.nasri877@outlook.com,apprenant,+21651399393,Tunisie,Sidi Bouzid,1995-10-27,"Coaching, Finance, Certification, Intelligence artificielle, Leadership, Mentoring"
17153,Nesrine Ben Youssef,nesrine.ben.youssef333@yahoo.fr,apprenant,+21652799608,Tunisie,Mahdia,1993-12-31,"Digital transformation, Audit, ITIL, Stratégie d'entreprise, Communication, Innovation"
17154,Rania Fourati,rania.fourati992@orange.tn,apprenant,+21625481828,Tunisie,Gabès,1989-12-21,"Gestion de projet, Machine learning"
17155,Aymen Mabrouk,aymen.mabrouk169@topnet.tn,apprenant,+21691639482,Tunisie,Mahdia,2006-08-02,"Lean management, Audit, Développement web"
17156,Takwa Mansouri,takwa.mansouri906@gmail.com,apprenant,+21620468234,Tunisie,Jendouba,1991-11-18,"Stratégie d'entreprise, Lean management, Entrepreneuriat, Intelligence artificielle, Conseil"
17157,Zied Jemli,zied.jemli535@topnet.tn,apprenant,+21654262183,Tunisie,Ben Arous,1989-06-23,"Audit, Digital transformation"
17158,Youssef Ghali,youssef.ghali519@laposte.net,apprenant,+21697369540,Tunisie,Zaghouan,2001-01-24,"DevOps, Gestion de projet, Innovation, Entrepreneuriat, Marketing digital, Informatique"
17159,Thouraya Chedly,thouraya.chedly997@laposte.net,apprenant,+21624665595,Tunisie,Ariana,1993-08-26,"Machine learning, Certification, Technologie, Entrepreneuriat, Leadership"
17160,Maher Mabrouk,maher.mabrouk445@yahoo.fr,apprenant,+21696239387,Tunisie,Kébili,1997-10-13,"Marketing digital, Finance"
17161,Lassad Fourati,lassad.fourati74@outlook.com,apprenant,+21697029595,Tunisie,Ben Arous,1991-02-27,"Certification, Audit, Machine learning, Ressources humaines, Leadership, Analyse de données"
17162,Marwan Ktari,marwan.ktari289@topnet.tn,apprenant,+21625882879,Tunisie,Manouba,1988-04-13,"Certification, DevOps, Communication, Business intelligence, Informatique, Veille technologique"
17163,Kenza Ben Salah,kenza.ben.salah928@hotmail.com,apprenant,+21620684664,Tunisie,Sidi Bouzid,1993-11-14,"Audit, Mentoring, Finance, Développement web, DevOps"
17164,Fatma Louati,fatma.louati876@outlook.com,apprenant,+21698502047,Tunisie,Zaghouan,2004-02-01,"Stratégie d'entreprise, Audit, Innovation, Certification, Technologie, Qualité"
17165,Sofiane Karoui,sofiane.karoui855@hotmail.com,apprenant,+21654802673,Tunisie,Kairouan,1998-12-21,"Leadership, Certification, Machine learning, IoT, Ressources humaines, Qualité"
17166,Rami Chebbi,rami.chebbi425@gmail.com,apprenant,+21694489424,Tunisie,Siliana,2007-12-13,"IoT, Informatique, Innovation, E-commerce"
17167,Jihene Chihaoui,jihene.chihaoui467@gmail.com,apprenant,+21651742939,Tunisie,Tataouine,1985-09-14,"DevOps, Stratégie d'entreprise, Cloud computing, Cybersécurité, E-commerce, Technologie"
17168,Maher Hachicha,maher.hachicha960@hotmail.com,apprenant,+21623223381,Tunisie,Béja,1997-09-08,"DevOps, Développement web, Management, Audit"
17169,Sofiane Dridi,sofiane.dridi915@orange.tn,apprenant,+21621040385,Tunisie,Tunis,1994-03-09,"ITIL, Communication"
17170,Yassine Ben Ahmed,yassine.ben.ahmed213@orange.tn,apprenant,+21655203804,Tunisie,Zaghouan,1993-03-08,"Digital transformation, Business intelligence, E-commerce, Blockchain, Agile"
17171,Cyrine Layouni,cyrine.layouni867@live.com,apprenant,+21650435693,Tunisie,Sfax,2000-06-08,"Stratégie d'entreprise, DevOps, Lean management"
