ID,Nom,Email,Rôle,Téléphone,Pays,Ville,Date de naissance,Centres d'intérêt
19312,Besma Mejri,besma.mejri294@hotmail.com,apprenant,+21623636089,Tunisie,Gafsa,1988-11-02,"Intelligence artificielle, Leadership, IoT, Conseil, ITIL"
19313,Slim Jazi,slim.jazi598@outlook.com,apprenant,+21652279475,Tunisie,Ariana,2005-09-23,"Digital transformation, DevOps, ITIL, Audit"
19314,Ahmed Laabidi,ahmed.laabidi586@gmail.com,apprenant,+21699389650,Tunisie,Zaghouan,1990-11-22,"Analyse de données, Management, IoT, Finance, Lean management, Leadership"
19315,Makram Jebali,makram.jebali471@live.com,apprenant,+21622376187,Tunisie,Manouba,2007-04-03,"Entrepreneuriat, Lean management, Stratégie d'entreprise"
19316,Moez Jazi,moez.jazi819@gmail.com,apprenant,+21655567038,Tunisie,Manouba,1993-08-03,"Machine learning, Veille technologique"
19317,Najoua Meddeb,najoua.meddeb27@laposte.net,apprenant,+21659207536,Tunisie,Mahdia,1986-01-21,"Cybersécurité, Management, Développement web, Mentoring, Lean management"
19318,Adel Hajji,adel.hajji242@gmail.com,apprenant,+21650857955,Tunisie,Sidi Bouzid,2002-04-25,"Qualité, Intelligence artificielle, Agile"
19319,Bassem Mansouri,bassem.mansouri936@gmail.com,apprenant,+21653970809,Tunisie,Sfax,1995-03-07,"Intelligence artificielle, Blockchain, Digital transformation, Finance"
19320,Najoua Karray,najoua.karray688@outlook.com,apprenant,+21696378290,Tunisie,Médenine,1986-06-08,"Blockchain, Finance, Digital transformation, Audit, Cloud computing"
19321,Olfa Essid,olfa.essid644@gmail.com,apprenant,+21621690623,Tunisie,Jendouba,2002-09-18,"Stratégie d'entreprise, Ressources humaines, Certification, Finance, Agile"
19322,Rania Mrad,rania.mrad908@orange.tn,apprenant,+21623721185,Tunisie,Ariana,2006-04-23,"Informatique, Certification, Intelligence artificielle, Lean management, Cloud computing, DevOps"
19323,Thouraya Khlif,thouraya.khlif498@outlook.com,apprenant,+21653275696,Tunisie,Nabeul,1998-02-10,"Stratégie d'entreprise, Finance, Veille technologique"
19324,Lamia Rekik,lamia.rekik562@yahoo.fr,apprenant,+21621588365,Tunisie,Tozeur,2003-10-16,"Qualité, Digital transformation, Coaching"
19325,Mohamed Guesmi,mohamed.guesmi76@gmail.com,apprenant,+21625545044,Tunisie,Gabès,1990-05-02,"Agile, Entrepreneuriat, Marketing digital, Ressources humaines, Finance, Cybersécurité"
19326,Najoua Jemli,najoua.jemli662@topnet.tn,apprenant,+21628180010,Tunisie,Sousse,1993-12-17,"Développement web, Business intelligence"
19327,Farouk Marzouki,farouk.marzouki563@hotmail.com,apprenant,+21692651660,Tunisie,Kasserine,1995-04-01,"Stratégie d'entreprise, Gestion de projet, E-commerce, Ressources humaines, Leadership"
19328,Ghazi Limam,ghazi.limam9@orange.tn,apprenant,+21657791536,Tunisie,Bizerte,1994-08-07,"Lean management, Intelligence artificielle, Digital transformation, Entrepreneuriat, Qualité, Communication"
19329,Samir Ben Salah,samir.ben.salah49@orange.tn,apprenant,+21654679262,Tunisie,Ariana,2006-02-16,"DevOps, Développement web, Business intelligence, Machine learning, Stratégie d'entreprise, Cloud computing"
19330,Wafa Hassen,wafa.hassen705@gmail.com,apprenant,+21621613458,Tunisie,Kébili,1996-10-26,"Audit, Finance, Innovation"
19331,Fethi Ghanmi,fethi.ghanmi56@orange.tn,apprenant,+21658951394,Tunisie,Sousse,1989-12-10,"Blockchain, Qualité, Certification"
19332,Sonia Miled,sonia.miled751@live.com,apprenant,+21698242041,Tunisie,Kairouan,1987-04-11,"Ressources humaines, Gestion de projet, Intelligence artificielle, Agile, Développement web"
19333,Amine Dali,amine.dali683@yahoo.fr,apprenant,+21692702422,Tunisie,Ben Arous,1992-02-25,"Entrepreneuriat, Formation professionnelle"
19334,Nabil Laabidi,nabil.laabidi504@yahoo.fr,apprenant,+21699779393,Tunisie,Monastir,1999-05-24,"Cloud computing, Communication, Coaching, Analyse de données"
19335,Wassim Ghanmi,wassim.ghanmi3@outlook.com,apprenant,+21695398426,Tunisie,Tozeur,1995-07-18,"Digital transformation, Communication, Leadership"
19336,Kenza Fkih,kenza.fkih710@outlook.com,apprenant,+21626733027,Tunisie,Ben Arous,2004-02-26,"Intelligence artificielle, Certification"
19337,Ghazi Bouhamed,ghazi.bouhamed355@live.com,apprenant,+21657074111,Tunisie,Nabeul,2000-06-17,"Informatique, Intelligence artificielle, Développement web, Qualité, E-commerce, Ressources humaines"
19338,Youssef Jazi,youssef.jazi411@topnet.tn,apprenant,+21650398818,Tunisie,Médenine,1986-03-14,"Digital transformation, Finance, Informatique"
19339,Rami Trabelsi,rami.trabelsi704@live.com,apprenant,+21620992868,Tunisie,Ben Arous,2006-12-24,"DevOps, Coaching"
19340,Wided Rekik,wided.rekik719@outlook.com,apprenant,+21620922028,Tunisie,Monastir,2001-12-21,"Management, Mentoring, Leadership, E-commerce, Conseil"
19341,Latifa Ouali,latifa.ouali879@hotmail.com,apprenant,+21621174214,Tunisie,Kasserine,2001-10-03,"Lean management, Cybersécurité, DevOps, Innovation"
19342,Emad Ouali,emad.ouali411@topnet.tn,apprenant,+21629160446,Tunisie,Sfax,1992-09-05,"Machine learning, Certification"
19343,Khaled Fkih,khaled.fkih982@hotmail.com,apprenant,+21651378054,Tunisie,Monastir,1998-04-22,"Innovation, Mentoring, Lean management"
19344,Amira Hadj,amira.hadj289@yahoo.fr,apprenant,+21625664962,Tunisie,Kasserine,1996-01-25,"DevOps, Mentoring, Management, Finance, Veille technologique"
19345,Ahlem Ghanmi,ahlem.ghanmi126@hotmail.com,apprenant,+21699134048,Tunisie,Monastir,1996-07-01,"Cloud computing, Stratégie d'entreprise, Machine learning, Formation professionnelle, Digital transformation"
19346,Moncef Derbali,moncef.derbali849@yahoo.fr,apprenant,+21651455471,Tunisie,Jendouba,2000-12-21,"ITIL, Business intelligence, Certification"
19347,Fatma Ben Ahmed,fatma.ben.ahmed444@live.com,apprenant,+21620034010,Tunisie,Nabeul,2005-04-22,"Finance, Blockchain, Gestion de projet, Lean management, Informatique"
19348,Yasmine Mabrouk,yasmine.mabrouk452@orange.tn,apprenant,+21624096350,Tunisie,Siliana,2001-11-20,"Entrepreneuriat, Formation professionnelle, Gestion de projet, Certification, Stratégie d'entreprise"
19349,Lassad Hamdi,lassad.hamdi873@topnet.tn,apprenant,+21652951963,Tunisie,Manouba,2006-06-07,"Finance, Management, Intelligence artificielle, Communication, Digital transformation, Développement web"
19350,Rania Chihaoui,rania.chihaoui457@orange.tn,apprenant,+21696880008,Tunisie,Manouba,1990-08-31,"Ressources humaines, Marketing digital, Intelligence artificielle"
19351,Yasmine Ferchichi,yasmine.ferchichi350@laposte.net,apprenant,+21620691925,Tunisie,Jendouba,1993-05-18,"Technologie, Intelligence artificielle, Blockchain, Conseil, Développement web"
19352,Fatma Fatnassi,fatma.fatnassi127@live.com,apprenant,+21696882875,Tunisie,Sousse,1990-04-26,"Informatique, Veille technologique, Business intelligence, Marketing digital"
19353,Khadija Benhassan,khadija.benhassan414@live.com,apprenant,+21625684393,Tunisie,Sfax,1993-09-12,"Innovation, IoT, Entrepreneuriat"
19354,Tarek Landolsi,tarek.landolsi386@orange.tn,apprenant,+21629691408,Tunisie,Sidi Bouzid,1989-06-18,"Stratégie d'entreprise, Technologie, Marketing digital, Analyse de données, IoT"
19355,Yasmine Neffati,yasmine.neffati150@live.com,apprenant,+21691536927,Tunisie,Tozeur,2000-01-23,"Ressources humaines, Digital transformation"
19356,Ghazi Guesmi,ghazi.guesmi892@live.com,apprenant,+21626307247,Tunisie,Tunis,1999-02-12,"Finance, Veille technologique"
19357,Jihene Jouini,jihene.jouini452@yahoo.fr,apprenant,+21627252988,Tunisie,Ben Arous,2007-03-02,"ITIL, Communication, Leadership, E-commerce, Management, Marketing digital"
19358,Rami Jazi,rami.jazi32@topnet.tn,apprenant,+21659661122,Tunisie,Gabès,2003-01-04,"Blockchain, Innovation, Machine learning, Finance, Conseil"
19359,Kenza Ben Salah,kenza.ben.salah206@live.com,apprenant,+21650337883,Tunisie,Tunis,2005-06-22,"Coaching, Lean management, Machine learning, Gestion de projet"
19360,Omar Hassen,omar.hassen499@hotmail.com,apprenant,+21651761812,Tunisie,Nabeul,1997-12-05,"Ressources humaines, Business intelligence, Intelligence artificielle"
19361,Yasmine Kchir,yasmine.kchir984@laposte.net,apprenant,+21652905904,Tunisie,Sfax,1997-11-02,"Analyse de données, Coaching, Lean management, Stratégie d'entreprise, Veille technologique"
19362,Nabil Feriani,nabil.feriani36@live.com,apprenant,+21697150595,Tunisie,Nabeul,1992-07-25,"Cybersécurité, DevOps, Audit, Technologie, Développement web, Digital transformation"
19363,Hichem Gasmi,hichem.gasmi11@orange.tn,apprenant,+21693664314,Tunisie,Kébili,1997-11-03,"Machine learning, Intelligence artificielle"
19364,Wassim Benhassan,wassim.benhassan302@hotmail.com,apprenant,+21625656792,Tunisie,Sousse,2005-08-08,"Machine learning, Management, Innovation, Cloud computing, Qualité"
19365,Samir Guizani,samir.guizani932@live.com,apprenant,+21690161793,Tunisie,Tataouine,1997-02-04,"Informatique, Digital transformation"
19366,Hiba Miled,hiba.miled191@hotmail.com,apprenant,+21697765391,Tunisie,Sidi Bouzid,1990-04-17,"Gestion de projet, Blockchain, Intelligence artificielle, Audit, IoT, ITIL"
19367,Moez Ezzine,moez.ezzine919@topnet.tn,apprenant,+21656124875,Tunisie,Bizerte,1986-06-06,"Développement web, Management, Finance, Marketing digital, Blockchain, Certification"
19368,Sami Labidi,sami.labidi710@outlook.com,apprenant,+21651194288,Tunisie,Tunis,1993-06-21,"Coaching, Mentoring, ITIL, Innovation, Business intelligence, Machine learning"
19369,Intissar Sellami,intissar.sellami211@laposte.net,apprenant,+21650494620,Tunisie,Nabeul,1990-12-13,"Leadership, Coaching, DevOps"
19370,Lassad Horchani,lassad.horchani938@outlook.com,apprenant,+21658376535,Tunisie,Le Kef,1992-10-14,"ITIL, Entrepreneuriat"
19371,Taoufik Hmida,taoufik.hmida156@orange.tn,apprenant,+21622663471,Tunisie,Gafsa,1986-06-15,"Management, Mentoring, Leadership, DevOps, ITIL"
19372,Tarek Ferjani,tarek.ferjani100@live.com,apprenant,+21698910300,Tunisie,Kasserine,1997-09-23,"Qualité, Intelligence artificielle, Stratégie d'entreprise, IoT, Veille technologique, Business intelligence"
19373,Adel Labidi,adel.labidi676@live.com,apprenant,+21626638153,Tunisie,Siliana,2002-09-01,"Cybersécurité, Veille technologique, Finance, Audit, Technologie, Mentoring"
19374,Ghada Rekik,ghada.rekik623@orange.tn,apprenant,+21693715792,Tunisie,Jendouba,2003-07-23,"Conseil, Business intelligence, Analyse de données, Agile, Certification"
19375,Rania Mahjoub,rania.mahjoub244@laposte.net,apprenant,+21697955241,Tunisie,Gabès,1995-06-20,"Innovation, Finance, Conseil, ITIL, Stratégie d'entreprise, Formation professionnelle"
19376,Wafa Chaabane,wafa.chaabane666@hotmail.com,apprenant,+21628951194,Tunisie,Ben Arous,1999-05-18,"Qualité, Entrepreneuriat, Finance, DevOps"
19377,Khadija Hadj,khadija.hadj11@outlook.com,apprenant,+21653318284,Tunisie,Kairouan,2004-11-17,"Digital transformation, ITIL, Machine learning, Business intelligence"
19378,Ahmed Mansouri,ahmed.mansouri488@gmail.com,apprenant,+21623585804,Tunisie,Médenine,2005-05-14,"Communication, Développement web, Informatique"
19379,Karima Fkih,karima.fkih37@outlook.com,apprenant,+21624623994,Tunisie,Médenine,1987-04-16,"Coaching, Audit, Conseil, Lean management"
19380,Bassem Trabelsi,bassem.trabelsi27@orange.tn,apprenant,+21655841801,Tunisie,Kébili,1991-03-03,"Cloud computing, Informatique, Intelligence artificielle, IoT"
19381,Yosra Karoui,yosra.karoui688@gmail.com,apprenant,+21626108408,Tunisie,Gafsa,2001-06-07,"Technologie, Mentoring, Veille technologique, IoT"
19382,Ghazi Ben Youssef,ghazi.ben.youssef529@laposte.net,apprenant,+21698358079,Tunisie,Siliana,1992-03-04,"Agile, Gestion de projet, Communication, Analyse de données, Mentoring"
19383,Walid Daoud,walid.daoud909@hotmail.com,apprenant,+21658451478,Tunisie,Tozeur,1987-04-12,"Développement web, Formation professionnelle, Intelligence artificielle, Agile, Cybersécurité"
19384,Yassine Marzouki,yassine.marzouki473@live.com,apprenant,+21696445896,Tunisie,Sousse,2004-12-20,"Machine learning, Lean management, Cloud computing, Conseil, Agile"
19385,Ahlem Hmida,ahlem.hmida361@live.com,apprenant,+21626556606,Tunisie,Ben Arous,1989-03-06,"Coaching, Certification, Innovation, Mentoring, Technologie"
19386,Chedly Khlif,chedly.khlif906@topnet.tn,apprenant,+21628277108,Tunisie,Tataouine,2006-02-05,"Développement web, Mentoring, E-commerce"
19387,Samir Ghali,samir.ghali857@orange.tn,apprenant,+21654166240,Tunisie,Gafsa,1998-04-10,"Mentoring, Cybersécurité, Qualité, Analyse de données"
19388,Ali Omrani,ali.omrani526@gmail.com,apprenant,+21626271873,Tunisie,Monastir,1999-04-07,"Informatique, Agile, Conseil, Veille technologique, Finance, Blockchain"
19389,Maroua Dhouib,maroua.dhouib152@laposte.net,apprenant,+21651520301,Tunisie,Nabeul,1986-06-14,"Finance, Cloud computing, E-commerce, Formation professionnelle"
19390,Sami Karray,sami.karray202@hotmail.com,apprenant,+21693758161,Tunisie,Le Kef,1995-06-04,"Ressources humaines, Entrepreneuriat"
19391,Najoua Mahjoub,najoua.mahjoub311@yahoo.fr,apprenant,+21654475530,Tunisie,Tataouine,1994-06-03,"DevOps, Entrepreneuriat, Ressources humaines, Veille technologique, Développement web"
19392,Dali Gharbi,dali.gharbi208@topnet.tn,apprenant,+21654150136,Tunisie,Monastir,1999-10-17,"Marketing digital, Digital transformation"
19393,Yosra Sellami,yosra.sellami439@orange.tn,apprenant,+21627034032,Tunisie,Zaghouan,2005-06-11,"Machine learning, Blockchain, Communication, Analyse de données, ITIL, Ressources humaines"
19394,Bilel Hmida,bilel.hmida702@gmail.com,apprenant,+21650244896,Tunisie,Mahdia,1988-09-15,"Veille technologique, Intelligence artificielle, Entrepreneuriat, Certification, Développement web"
19395,Moncef Sellami,moncef.sellami167@orange.tn,apprenant,+21658022061,Tunisie,Béja,1988-02-12,"Machine learning, Finance, Intelligence artificielle, Digital transformation"
19396,Ghazi Hajji,ghazi.hajji591@live.com,apprenant,+21653904560,Tunisie,Médenine,2001-09-09,"Cybersécurité, Business intelligence"
19397,Omar Ferjani,omar.ferjani385@gmail.com,apprenant,+21690783850,Tunisie,Médenine,1991-03-02,"Communication, DevOps, Technologie, Qualité"
19398,Sami Ezzine,sami.ezzine38@laposte.net,apprenant,+21655618414,Tunisie,Tozeur,1994-09-14,"Lean management, Innovation, Cloud computing, Leadership"
19399,Yassine Chaieb,yassine.chaieb591@gmail.com,apprenant,+21651302415,Tunisie,Kairouan,1993-05-09,"Entrepreneuriat, Mentoring, Informatique"
19400,Ghazi Karoui,ghazi.karoui767@topnet.tn,apprenant,+21654795520,Tunisie,Tunis,1991-05-14,"IoT, Innovation, Conseil, Communication, Marketing digital"
19401,Kenza Horchani,kenza.horchani148@yahoo.fr,apprenant,+21693841473,Tunisie,Bizerte,1997-12-24,"Coaching, Intelligence artificielle, Stratégie d'entreprise, Lean management, Développement web"
19402,Ali Maaloul,ali.maaloul59@topnet.tn,apprenant,+21657694160,Tunisie,Mahdia,1990-03-03,"Lean management, Informatique, Marketing digital, Entrepreneuriat, Intelligence artificielle, Machine learning"
19403,Thouraya Bouhamed,thouraya.bouhamed321@laposte.net,apprenant,+21624765369,Tunisie,Gabès,1989-06-01,"Digital transformation, Conseil, Gestion de projet"
19404,Khaled Horchani,khaled.horchani883@live.com,apprenant,+21690651558,Tunisie,Kasserine,1989-04-15,"Business intelligence, Innovation, Cybersécurité, Cloud computing, Formation professionnelle"
19405,Fethi Landolsi,fethi.landolsi582@live.com,apprenant,+21658462001,Tunisie,Le Kef,1988-09-09,"Cloud computing, Innovation, Technologie, Lean management"
19406,Salma Gabsi,salma.gabsi855@yahoo.fr,apprenant,+21691702611,Tunisie,Tozeur,1997-10-14,"Cybersécurité, Audit, Technologie, Gestion de projet, Stratégie d'entreprise, Certification"
19407,Mariam Ben Ali,mariam.ben.ali925@live.com,apprenant,+21694923254,Tunisie,Tunis,1986-08-09,"Qualité, Marketing digital, Agile, Ressources humaines, Analyse de données, Mentoring"
19408,Besma Jelassi,besma.jelassi857@hotmail.com,apprenant,+21657485230,Tunisie,Nabeul,1991-11-16,"Formation professionnelle, Finance"
19409,Zouheir Chedly,zouheir.chedly399@gmail.com,apprenant,+21629358678,Tunisie,Manouba,1996-10-09,"Conseil, Finance, Ressources humaines, Coaching, Technologie"
19410,Ridha Mejri,ridha.mejri115@topnet.tn,apprenant,+21629040342,Tunisie,Gafsa,1989-08-10,"Lean management, Qualité, Finance, Audit"
19411,Sami Essid,sami.essid992@live.com,apprenant,+21627020818,Tunisie,Kébili,1985-12-19,"Qualité, Innovation, Agile, Blockchain, Management"
19412,Ghada Horchani,ghada.horchani975@topnet.tn,apprenant,+21698386173,Tunisie,Médenine,1991-01-03,"IoT, Intelligence artificielle, Leadership, Agile, Finance"
19413,Wassim Hleli,wassim.hleli916@laposte.net,apprenant,+21656925810,Tunisie,Kasserine,1999-08-31,"Gestion de projet, Digital transformation, Agile, Marketing digital"
19414,Wided Horchani,wided.horchani286@hotmail.com,apprenant,+21692025320,Tunisie,Le Kef,1988-09-27,"Analyse de données, Agile, Cloud computing, DevOps, Audit"
19415,Samir Jelassi,samir.jelassi761@gmail.com,apprenant,+21623508349,Tunisie,Siliana,1995-06-13,"Management, ITIL"
19416,Ghada Mabrouk,ghada.mabrouk822@gmail.com,apprenant,+21695222446,Tunisie,Tataouine,2004-08-23,"Formation professionnelle, Agile, Machine learning, Business intelligence"
19417,Wided Mrad,wided.mrad104@outlook.com,apprenant,+21697179484,Tunisie,Bizerte,1995-04-27,"Mentoring, DevOps, Lean management, Développement web"
19418,Yasmine Horchani,yasmine.horchani886@outlook.com,apprenant,+21622131820,Tunisie,Tunis,1992-09-30,"E-commerce, Intelligence artificielle, Coaching, Blockchain"
19419,Lobna Mrad,lobna.mrad133@orange.tn,apprenant,+21624925303,Tunisie,Médenine,1988-12-25,"Stratégie d'entreprise, Audit, Blockchain, E-commerce"
19420,Khadija Chebbi,khadija.chebbi639@topnet.tn,apprenant,+21691991560,Tunisie,Tozeur,1986-01-13,"Management, Qualité, Gestion de projet, Machine learning"
19421,Rania Mabrouk,rania.mabrouk283@orange.tn,apprenant,+21696949577,Tunisie,Siliana,1993-01-11,"Leadership, Analyse de données, Certification, Blockchain, Agile"
19422,Besma Essid,besma.essid593@gmail.com,apprenant,+21629007321,Tunisie,Siliana,1992-08-13,"Coaching, DevOps, Lean management"
19423,Tarek Kchir,tarek.kchir28@yahoo.fr,apprenant,+21699371559,Tunisie,Jendouba,2005-03-25,"Coaching, Cybersécurité, Lean management, Technologie"
19424,Walid Hmida,walid.hmida274@topnet.tn,apprenant,+21696608647,Tunisie,Jendouba,1990-09-20,"Marketing digital, Cloud computing, Communication, Finance, Audit"
19425,Hatem Fourati,hatem.fourati509@orange.tn,apprenant,+21628617114,Tunisie,Sfax,2004-06-25,"Blockchain, Finance, Innovation"
19426,Emad Laabidi,emad.laabidi503@hotmail.com,apprenant,+21650437923,Tunisie,Kairouan,1987-12-27,"Qualité, Stratégie d'entreprise, Management"
19427,Rim Bouslama,rim.bouslama837@hotmail.com,apprenant,+21698994171,Tunisie,Kairouan,1995-01-23,"Cloud computing, IoT, Formation professionnelle, Machine learning"
19428,Hajer Ben Ali,hajer.ben.ali618@live.com,apprenant,+21627729328,Tunisie,Monastir,1989-12-17,"Analyse de données, Gestion de projet, Veille technologique, Lean management, DevOps, Finance"
19429,Jihene Benhassan,jihene.benhassan682@live.com,apprenant,+21625650372,Tunisie,Nabeul,2002-11-25,"Ressources humaines, Certification, Technologie"
19430,Omar Bouhamed,omar.bouhamed67@gmail.com,apprenant,+21691034174,Tunisie,Tunis,1989-02-21,"Cloud computing, Certification, DevOps, E-commerce, Finance, Formation professionnelle"
19431,Kenza Bouaziz,kenza.bouaziz958@outlook.com,apprenant,+21696297382,Tunisie,Manouba,2007-10-08,"Cybersécurité, Gestion de projet, Machine learning"
19432,Lamia Derbali,lamia.derbali24@outlook.com,apprenant,+21625670300,Tunisie,Sousse,2004-03-27,"Cloud computing, Entrepreneuriat, Analyse de données, Innovation, Veille technologique, Ressources humaines"
19433,Chedly Khlif,chedly.khlif825@live.com,apprenant,+21694939514,Tunisie,Tozeur,2002-06-18,"Innovation, Conseil, Communication"
19434,Sami Mabrouk,sami.mabrouk272@outlook.com,apprenant,+21653761478,Tunisie,Ben Arous,1986-09-12,"Stratégie d'entreprise, Marketing digital, Digital transformation"
19435,Omar Labidi,omar.labidi930@orange.tn,apprenant,+21652195431,Tunisie,Manouba,1988-02-04,"Management, Cybersécurité, Analyse de données, Innovation, Machine learning, Business intelligence"
19436,Ines Derbali,ines.derbali619@topnet.tn,apprenant,+21621485403,Tunisie,Médenine,2003-04-09,"Ressources humaines, Développement web, Intelligence artificielle, Gestion de projet"
19437,Najoua Ben Ahmed,najoua.ben.ahmed573@outlook.com,apprenant,+21699709190,Tunisie,Manouba,2006-10-12,"Business intelligence, Communication"
19438,Bassem Omrani,bassem.omrani226@orange.tn,apprenant,+21694932466,Tunisie,Ariana,1987-09-04,"Gestion de projet, E-commerce, Conseil, Veille technologique"
19439,Rim Feriani,rim.feriani50@hotmail.com,apprenant,+21628344194,Tunisie,Manouba,1992-10-07,"Audit, Analyse de données, Entrepreneuriat, Conseil"
19440,Makram Jelassi,makram.jelassi912@topnet.tn,apprenant,+21628969280,Tunisie,Tunis,2006-04-10,"Stratégie d'entreprise, Lean management, Management, Analyse de données, Certification, Marketing digital"
19441,Fatma Ferchichi,fatma.ferchichi805@outlook.com,apprenant,+21626962612,Tunisie,Sfax,2002-08-13,"Machine learning, Conseil"
19442,Thouraya Mansouri,thouraya.mansouri202@topnet.tn,apprenant,+21623029301,Tunisie,Manouba,1998-09-09,"Communication, Mentoring, Intelligence artificielle"
19443,Yosra Bouslama,yosra.bouslama883@topnet.tn,apprenant,+21694661622,Tunisie,Ben Arous,1999-03-13,"Management, Lean management, ITIL, E-commerce, Entrepreneuriat, Cloud computing"
19444,Ridha Daoud,ridha.daoud81@laposte.net,apprenant,+21655633334,Tunisie,Kébili,1994-01-20,"Cloud computing, Leadership, Mentoring, Formation professionnelle, Innovation"
19445,Nour Jemli,nour.jemli229@yahoo.fr,apprenant,+21659643077,Tunisie,Nabeul,2000-03-11,"Gestion de projet, Blockchain"
19446,Chedly Karoui,chedly.karoui628@laposte.net,apprenant,+21620059383,Tunisie,Sidi Bouzid,1999-09-20,"Certification, Digital transformation, Mentoring, Lean management"
19447,Dorra Fatnassi,dorra.fatnassi997@topnet.tn,apprenant,+21698394381,Tunisie,Monastir,1992-02-15,"Développement web, Agile, Conseil, Veille technologique"
19448,Youssef Neffati,youssef.neffati556@laposte.net,apprenant,+21697305233,Tunisie,Kasserine,1996-11-25,"Analyse de données, IoT, ITIL, Cybersécurité, Coaching, Formation professionnelle"
19449,Dorra Chaabane,dorra.chaabane402@orange.tn,apprenant,+21691023578,Tunisie,Bizerte,1996-04-18,"Conseil, Technologie, Développement web"
19450,Zohra Ouali,zohra.ouali135@live.com,apprenant,+21654368397,Tunisie,Kairouan,1998-08-31,"Certification, Analyse de données"
19451,Ines Mejri,ines.mejri959@outlook.com,apprenant,+21696600635,Tunisie,Sousse,2005-03-08,"Leadership, E-commerce, Blockchain, Ressources humaines"
19452,Zohra Omrani,zohra.omrani975@hotmail.com,apprenant,+21629900869,Tunisie,Kasserine,1993-11-26,"Veille technologique, Analyse de données, Management, Leadership"
19453,Chedly Benhassan,chedly.benhassan775@topnet.tn,apprenant,+21653525826,Tunisie,Mahdia,2005-09-05,"Qualité, Cybersécurité"
19454,Kais Gabsi,kais.gabsi624@topnet.tn,apprenant,+21624474549,Tunisie,Médenine,2006-02-12,"Digital transformation, Stratégie d'entreprise, Formation professionnelle"
19455,Myriam Jebali,myriam.jebali558@hotmail.com,apprenant,+21652285001,Tunisie,Sfax,1985-09-05,"Digital transformation, Communication, Machine learning"
19456,Slim Hassen,slim.hassen544@yahoo.fr,apprenant,+21693240963,Tunisie,Siliana,1992-05-10,"Audit, Certification, Ressources humaines, Gestion de projet, Cloud computing"
19457,Jihene Jazi,jihene.jazi555@outlook.com,apprenant,+21650567076,Tunisie,Manouba,1999-09-19,"Management, E-commerce, Blockchain, Marketing digital"
19458,Mohamed Ben Ali,mohamed.ben.ali367@orange.tn,apprenant,+21695177023,Tunisie,Kairouan,1998-05-05,"ITIL, Finance"
19459,Ikram Khlif,ikram.khlif910@gmail.com,apprenant,+21624057667,Tunisie,Tozeur,1993-11-06,"Leadership, Cloud computing, Entrepreneuriat"
19460,Fadia Fkih,fadia.fkih962@yahoo.fr,apprenant,+21656885308,Tunisie,Ben Arous,2005-11-16,"Formation professionnelle, Analyse de données, Cybersécurité, Gestion de projet, Veille technologique"
19461,Hatem Ben Youssef,hatem.ben.youssef739@gmail.com,apprenant,+21658317790,Tunisie,Kasserine,2001-05-09,"Veille technologique, IoT, Qualité"
19462,Hedi Landolsi,hedi.landolsi821@gmail.com,apprenant,+21695941854,Tunisie,Bizerte,2001-10-12,"Mentoring, Formation professionnelle, IoT, Lean management, Cybersécurité, Communication"
19463,Ghazi Ferchichi,ghazi.ferchichi638@yahoo.fr,apprenant,+21627244442,Tunisie,Sousse,1999-04-09,"IoT, Leadership, Marketing digital, Gestion de projet, Conseil"
19464,Besma Nabli,besma.nabli948@gmail.com,apprenant,+21693717288,Tunisie,Nabeul,1985-08-14,"Conseil, Cybersécurité, Management"
19465,Thouraya Dhouib,thouraya.dhouib171@outlook.com,apprenant,+21693989381,Tunisie,Tozeur,1998-01-04,"DevOps, Finance, Audit, Business intelligence, Ressources humaines"
19466,Thouraya Bouslama,thouraya.bouslama2@topnet.tn,apprenant,+21621849504,Tunisie,Gafsa,2004-11-07,"Communication, Mentoring, Audit, Marketing digital, Qualité"
19467,Takwa Jebali,takwa.jebali679@live.com,apprenant,+21655516142,Tunisie,Kairouan,2000-06-15,"Business intelligence, Innovation, Intelligence artificielle, Machine learning"
19468,Dalila Fkih,dalila.fkih929@gmail.com,apprenant,+21696970573,Tunisie,Le Kef,1989-12-04,"ITIL, Ressources humaines, Certification, Leadership, E-commerce, Analyse de données"
19469,Farouk Jazi,farouk.jazi302@topnet.tn,apprenant,+21621441419,Tunisie,Gafsa,2001-12-15,"Cybersécurité, Finance, Développement web, Machine learning, Coaching"
19470,Chiraz Chaabane,chiraz.chaabane898@gmail.com,apprenant,+21658644164,Tunisie,Médenine,2006-10-12,"Cloud computing, Mentoring, Finance"
19471,Moncef Mansouri,moncef.mansouri798@laposte.net,apprenant,+21654113585,Tunisie,Ariana,2004-09-23,"Marketing digital, IoT, Analyse de données, Lean management, Cybersécurité, ITIL"
