ID,Nom,Email,Rôle,Téléphone,Pays,Ville,Date de naissance,Centres d'intérêt
19149,Samir Kchir,samir.kchir942@gmail.com,apprenant,+21658378318,Tunisie,Ben Arous,1988-11-30,"Conseil, Digital transformation, DevOps, Management, Veille technologique, Marketing digital"
19150,Fares Gasmi,fares.gasmi645@gmail.com,apprenant,+21697874257,Tunisie,Siliana,2001-10-17,"Qualité, Développement web"
19151,Jamel Bouzid,jamel.bouzid114@gmail.com,apprenant,+21692926239,Tunisie,Tunis,1999-03-24,"Certification, Innovation, IoT, DevOps"
19152,Emna Fkih,emna.fkih526@outlook.com,apprenant,+21625051036,Tunisie,Sfax,1989-10-21,"E-commerce, Finance, Agile"
19153,Lassad Guesmi,lassad.guesmi311@orange.tn,apprenant,+21628698011,Tunisie,Kairouan,2000-09-09,"Agile, Blockchain, Développement web, Cloud computing, Innovation, Lean management"
19154,Maroua Hamza,maroua.hamza601@outlook.com,apprenant,+21693109849,Tunisie,Sidi Bouzid,2007-05-20,"E-commerce, Certification, DevOps, Entrepreneuriat, Qualité, Technologie"
19155,Youssef Jazi,youssef.jazi920@topnet.tn,apprenant,+21692240992,Tunisie,Ariana,1995-12-15,"Innovation, Qualité, Formation professionnelle, Lean management, Entrepreneuriat"
19156,Fares Dhouib,fares.dhouib664@hotmail.com,apprenant,+21690538207,Tunisie,Siliana,1985-03-31,"DevOps, Business intelligence, Leadership"
19157,Lassad Ezzine,lassad.ezzine44@live.com,apprenant,+21699492453,Tunisie,Gafsa,1995-05-11,"Certification, Coaching, Agile, DevOps, Conseil, Blockchain"
19158,Besma Limam,besma.limam30@gmail.com,apprenant,+21694696013,Tunisie,Béja,1985-12-24,"Gestion de projet, Intelligence artificielle, IoT, Certification, ITIL, Digital transformation"
19159,Sabrine Gharbi,sabrine.gharbi328@hotmail.com,apprenant,+21655341580,Tunisie,Tataouine,2002-10-25,"Veille technologique, Entrepreneuriat"
19160,Nesrine Bouhamed,nesrine.bouhamed236@hotmail.com,apprenant,+21621829383,Tunisie,Manouba,1996-07-21,"Informatique, Machine learning, Veille technologique, Cybersécurité, Développement web, Leadership"
19161,Myriam Marzouki,myriam.marzouki628@topnet.tn,apprenant,+21621846704,Tunisie,Kasserine,2002-07-09,"Formation professionnelle, Machine learning"
19162,Lobna Hassen,lobna.hassen310@orange.tn,apprenant,+21658291575,Tunisie,Béja,1992-07-18,"Veille technologique, Entrepreneuriat, Conseil, IoT, Cloud computing"
19163,Moez Ben Ahmed,moez.ben.ahmed355@yahoo.fr,apprenant,+21652996014,Tunisie,Siliana,2000-07-11,"Ressources humaines, Business intelligence, Lean management, Blockchain, Leadership, Informatique"
19164,Nabil Chaabane,nabil.chaabane102@orange.tn,apprenant,+21654366999,Tunisie,Tozeur,1989-03-25,"Certification, Business intelligence"
19165,Ridha Mansouri,ridha.mansouri697@yahoo.fr,apprenant,+21697696572,Tunisie,Nabeul,2000-02-10,"Marketing digital, E-commerce, Innovation, Communication, Machine learning, Intelligence artificielle"
19166,Zouheir Gharbi,zouheir.gharbi199@topnet.tn,apprenant,+21699294781,Tunisie,Kairouan,1992-10-23,"Marketing digital, IoT"
19167,Dorra Bouzid,dorra.bouzid242@live.com,apprenant,+21650270033,Tunisie,Tunis,2005-10-31,"IoT, Management, Entrepreneuriat, Développement web"
19168,Bilel Rekik,bilel.rekik858@gmail.com,apprenant,+21694149913,Tunisie,Ariana,1991-04-13,"Conseil, Digital transformation, Informatique"
19169,Dorsaf Neffati,dorsaf.neffati348@orange.tn,apprenant,+21625026081,Tunisie,Sousse,1985-08-14,"Veille technologique, E-commerce, Technologie, IoT, Cloud computing"
19170,Zied Trabelsi,zied.trabelsi162@hotmail.com,apprenant,+21692980088,Tunisie,Mahdia,1999-08-10,"Management, Ressources humaines, Audit, Communication, Intelligence artificielle, Formation professionnelle"
19171,Youssef Limam,youssef.limam676@gmail.com,apprenant,+21629862848,Tunisie,Ben Arous,1990-05-03,"Digital transformation, Veille technologique"
19172,Bassem Dridi,bassem.dridi974@live.com,apprenant,+21623292056,Tunisie,Kébili,2001-06-19,"Entrepreneuriat, Technologie"
19173,Nesrine Mabrouk,nesrine.mabrouk983@gmail.com,apprenant,+21625839118,Tunisie,Monastir,1996-02-05,"Agile, Formation professionnelle, Cloud computing, Gestion de projet, ITIL"
19174,Chiraz Guizani,chiraz.guizani318@topnet.tn,apprenant,+21692034474,Tunisie,Tataouine,1991-07-14,"Formation professionnelle, Ressources humaines, Blockchain, Audit"
19175,Lassad Gharbi,lassad.gharbi731@gmail.com,apprenant,+21657306507,Tunisie,Manouba,2006-05-08,"Leadership, Ressources humaines, Communication, Certification, Formation professionnelle, Stratégie d'entreprise"
19176,Yosra Mrad,yosra.mrad30@gmail.com,apprenant,+21622070136,Tunisie,Sfax,1991-08-17,"Business intelligence, Marketing digital, Analyse de données, Communication, Cloud computing"
19177,Yassine Limam,yassine.limam421@live.com,apprenant,+21694318806,Tunisie,Gabès,1998-07-23,"Blockchain, Intelligence artificielle, Communication"
19178,Lamia Ktari,lamia.ktari874@live.com,apprenant,+21699286872,Tunisie,Jendouba,1985-06-11,"Digital transformation, Développement web, Ressources humaines, Gestion de projet, E-commerce, ITIL"
19179,Ridha Layouni,ridha.layouni204@hotmail.com,apprenant,+21650078202,Tunisie,Tunis,1997-06-24,"Intelligence artificielle, Marketing digital"
19180,Sofiane Hachicha,sofiane.hachicha10@laposte.net,apprenant,+21626440864,Tunisie,Sousse,1992-08-06,"ITIL, Gestion de projet, Machine learning, Management, Analyse de données"
19181,Cyrine Essid,cyrine.essid908@laposte.net,apprenant,+21698398555,Tunisie,Tunis,1999-11-14,"Coaching, Lean management, Certification, Finance, Qualité, Formation professionnelle"
19182,Manel Ghanmi,manel.ghanmi901@outlook.com,apprenant,+21622486904,Tunisie,Kasserine,1991-01-11,"Marketing digital, Gestion de projet, Formation professionnelle, Développement web, IoT, Audit"
19183,Fethi Mrad,fethi.mrad788@topnet.tn,apprenant,+21657699567,Tunisie,Kasserine,1996-02-08,"Machine learning, Finance, Stratégie d'entreprise, ITIL, Coaching, Leadership"
19184,Ahmed Khlif,ahmed.khlif669@laposte.net,apprenant,+21658040735,Tunisie,Sidi Bouzid,1996-12-31,"Agile, E-commerce, Entrepreneuriat"
19185,Aymen Hassen,aymen.hassen604@hotmail.com,apprenant,+21690631815,Tunisie,Nabeul,1997-07-11,"Ressources humaines, Cybersécurité"
19186,Samir Fourati,samir.fourati632@orange.tn,apprenant,+21695362322,Tunisie,Kasserine,1996-08-01,"Business intelligence, Analyse de données, Technologie, Informatique, Mentoring, Agile"
19187,Sofiane Rekik,sofiane.rekik361@live.com,apprenant,+21659045653,Tunisie,Monastir,2005-05-10,"Audit, Management"
19188,Dorra Ben Salah,dorra.ben.salah903@live.com,apprenant,+21690296705,Tunisie,Ben Arous,1989-09-26,"E-commerce, Cloud computing, ITIL, Conseil"
19189,Emad Chedly,emad.chedly137@live.com,apprenant,+21655364530,Tunisie,Monastir,1986-01-06,"Blockchain, Management"
19190,Olfa Trabelsi,olfa.trabelsi697@orange.tn,apprenant,+21698410427,Tunisie,Gabès,2004-03-26,"Formation professionnelle, Blockchain, Lean management, Innovation, Marketing digital, Veille technologique"
19191,Hichem Chaieb,hichem.chaieb955@gmail.com,apprenant,+21621400359,Tunisie,Sfax,1988-11-03,"Entrepreneuriat, Cybersécurité, Lean management, Veille technologique, Conseil"
19192,Sami Mejri,sami.mejri271@gmail.com,apprenant,+21657585200,Tunisie,Siliana,2006-03-02,"Digital transformation, Lean management, ITIL"
19193,Dali Hmida,dali.hmida221@gmail.com,apprenant,+21623109692,Tunisie,Siliana,2001-09-24,"Finance, Cloud computing, Machine learning, ITIL, Développement web, Mentoring"
19194,Moncef Hamdi,moncef.hamdi714@hotmail.com,apprenant,+21691162130,Tunisie,Kairouan,2005-02-27,"Business intelligence, Audit, Cybersécurité"
19195,Hichem Fkih,hichem.fkih18@hotmail.com,apprenant,+21622434082,Tunisie,Siliana,1994-07-14,"Certification, Management, Formation professionnelle, Mentoring, Leadership"
19196,Wassim Khedher,wassim.khedher452@gmail.com,apprenant,+21692885086,Tunisie,Siliana,2005-06-08,"Leadership, Finance, Entrepreneuriat, E-commerce, Management, Stratégie d'entreprise"
19197,Zohra Mestiri,zohra.mestiri475@outlook.com,apprenant,+21650439231,Tunisie,Sidi Bouzid,2006-09-25,"Machine learning, Cybersécurité, Blockchain"
19198,Salma Karoui,salma.karoui39@laposte.net,apprenant,+21622903776,Tunisie,Mahdia,2005-06-25,"Gestion de projet, Cloud computing, Analyse de données"
19199,Lamia Mabrouk,lamia.mabrouk193@live.com,apprenant,+21652328981,Tunisie,Le Kef,2003-01-26,"Blockchain, Technologie, Digital transformation, Communication, E-commerce"
19200,Ikram Dridi,ikram.dridi658@topnet.tn,apprenant,+21651029581,Tunisie,Tozeur,2001-02-27,"Marketing digital, DevOps"
19201,Nesrine Marzouki,nesrine.marzouki205@live.com,apprenant,+21658176533,Tunisie,Ariana,1996-09-02,"Formation professionnelle, Audit, Management"
19202,Dali Mestiri,dali.mestiri208@outlook.com,apprenant,+21651394126,Tunisie,Gabès,1985-04-09,"ITIL, Audit, Marketing digital, Gestion de projet"
19203,Fatma Kammoun,fatma.kammoun272@yahoo.fr,apprenant,+21693312655,Tunisie,Jendouba,2002-03-23,"Qualité, Agile, Informatique"
19204,Fares Fourati,fares.fourati271@laposte.net,apprenant,+21696678613,Tunisie,Tataouine,1999-01-13,"Mentoring, IoT"
19205,Karima Guizani,karima.guizani779@outlook.com,apprenant,+21656440866,Tunisie,Kairouan,1985-12-09,"Certification, Veille technologique"
19206,Sabrine Layouni,sabrine.layouni426@laposte.net,apprenant,+21658067263,Tunisie,Gafsa,2003-04-04,"Innovation, Audit, Formation professionnelle, Informatique, Certification, Management"
19207,Noureddine Daoud,noureddine.daoud373@outlook.com,apprenant,+21621132401,Tunisie,Sfax,1997-12-21,"Entrepreneuriat, Business intelligence, Coaching, Veille technologique, Mentoring, Stratégie d'entreprise"
19208,Zied Hajji,zied.hajji289@outlook.com,apprenant,+21626345478,Tunisie,Ariana,1998-03-25,"Innovation, Cloud computing, Lean management, Communication, Blockchain, Marketing digital"
19209,Karim Sellami,karim.sellami973@live.com,apprenant,+21699982724,Tunisie,Tunis,1986-05-06,"Gestion de projet, Certification, E-commerce, IoT, Formation professionnelle, Digital transformation"
19210,Hatem Chihaoui,hatem.chihaoui379@topnet.tn,apprenant,+21697549616,Tunisie,Zaghouan,1985-04-23,"Conseil, Veille technologique, Stratégie d'entreprise, Innovation"
19211,Lassad Karray,lassad.karray623@topnet.tn,apprenant,+21655211454,Tunisie,Sousse,1994-05-09,"Cybersécurité, Mentoring, Qualité, ITIL, Veille technologique"
19212,Salma Ghali,salma.ghali970@orange.tn,apprenant,+21693147720,Tunisie,Siliana,2004-07-18,"Cybersécurité, IoT, Marketing digital, Business intelligence, Technologie"
19213,Kais Ben Salah,kais.ben.salah909@yahoo.fr,apprenant,+21697048045,Tunisie,Gabès,2000-02-27,"Intelligence artificielle, Stratégie d'entreprise, E-commerce, Mentoring"
19214,Amine Horchani,amine.horchani534@yahoo.fr,apprenant,+21651195117,Tunisie,Sousse,2007-03-04,"Finance, Ressources humaines"
19215,Makram Chedly,makram.chedly701@live.com,apprenant,+21652061050,Tunisie,Kairouan,2003-08-08,"Qualité, Agile, Conseil, Marketing digital"
19216,Jihene Jazi,jihene.jazi503@outlook.com,apprenant,+21693633690,Tunisie,Le Kef,1994-01-14,"Blockchain, Machine learning, Coaching, Qualité, IoT, Certification"
19217,Samia Laabidi,samia.laabidi262@orange.tn,apprenant,+21699368910,Tunisie,Béja,2006-04-13,"Qualité, Leadership, Ressources humaines, Audit"
19218,Youssef Benhassan,youssef.benhassan3@gmail.com,apprenant,+21623735607,Tunisie,Kairouan,1988-04-17,"Agile, Veille technologique"
19219,Samir Kammoun,samir.kammoun130@topnet.tn,apprenant,+21658586026,Tunisie,Sousse,2007-12-24,"Technologie, Entrepreneuriat, Conseil"
19220,Walid Guizani,walid.guizani561@gmail.com,apprenant,+21657705401,Tunisie,Kairouan,1997-09-06,"DevOps, IoT"
19221,Hatem Chebbi,hatem.chebbi707@laposte.net,apprenant,+21697947810,Tunisie,Ariana,2001-08-10,"Mentoring, DevOps"
19222,Ahmed Chaieb,ahmed.chaieb265@gmail.com,apprenant,+21693414908,Tunisie,Le Kef,2006-04-16,"Finance, E-commerce"
19223,Amira Ezzine,amira.ezzine150@orange.tn,apprenant,+21629765535,Tunisie,Jendouba,2007-08-27,"Formation professionnelle, Conseil, Informatique, IoT, Innovation"
19224,Yassine Sellami,yassine.sellami332@hotmail.com,apprenant,+21693131221,Tunisie,Gabès,1986-06-05,"Digital transformation, E-commerce"
19225,Aymen Rekik,aymen.rekik533@laposte.net,apprenant,+21692993345,Tunisie,Sousse,1995-06-02,"Business intelligence, Finance, Conseil, Formation professionnelle, Analyse de données, Marketing digital"
19226,Chedly Jelassi,chedly.jelassi208@gmail.com,apprenant,+21693598840,Tunisie,Sidi Bouzid,1997-06-06,"Communication, Lean management, Informatique, Innovation"
19227,Rami Horchani,rami.horchani826@laposte.net,apprenant,+21650096166,Tunisie,Sousse,2002-11-24,"Veille technologique, Communication, Développement web"
19228,Kenza Dridi,kenza.dridi226@gmail.com,apprenant,+21690325629,Tunisie,Ariana,1993-09-13,"Veille technologique, Agile"
19229,Ghazi Mansouri,ghazi.mansouri425@yahoo.fr,apprenant,+21690144805,Tunisie,Gabès,1997-12-27,"Conseil, Audit"
19230,Walid Essid,walid.essid275@topnet.tn,apprenant,+21622419001,Tunisie,Zaghouan,1985-08-11,"Intelligence artificielle, Finance, Mentoring, Lean management, Cybersécurité"
19231,Amira Landolsi,amira.landolsi89@yahoo.fr,apprenant,+21698189117,Tunisie,Kasserine,1987-08-15,"Ressources humaines, Entrepreneuriat, IoT"
19232,Amel Mansouri,amel.mansouri373@gmail.com,apprenant,+21629335072,Tunisie,Nabeul,1998-01-02,"Cloud computing, Conseil, Audit"
19233,Rim Sellami,rim.sellami80@laposte.net,apprenant,+21650137785,Tunisie,Tataouine,1999-08-12,"Formation professionnelle, ITIL, Management, Cloud computing, Qualité"
19234,Walid Fkih,walid.fkih805@orange.tn,apprenant,+21657122835,Tunisie,Tunis,1989-02-24,"Mentoring, Lean management, Marketing digital, Audit, Certification"
19235,Nabil Limam,nabil.limam303@hotmail.com,apprenant,+21653126398,Tunisie,Le Kef,2003-06-02,"Ressources humaines, Machine learning, Certification, Finance, Cybersécurité"
19236,Salah Omrani,salah.omrani208@outlook.com,apprenant,+21626892771,Tunisie,Tunis,1990-07-02,"Management, Lean management, Digital transformation"
19237,Jamel Kammoun,jamel.kammoun209@hotmail.com,apprenant,+21657423994,Tunisie,Jendouba,2000-09-18,"Agile, Finance, Qualité, Management"
19238,Taoufik Jouini,taoufik.jouini254@yahoo.fr,apprenant,+21697990432,Tunisie,Sidi Bouzid,2007-11-03,"Business intelligence, Management, Blockchain"
19239,Manel Jemli,manel.jemli265@hotmail.com,apprenant,+21654313846,Tunisie,Gabès,2003-09-30,"DevOps, Veille technologique, Coaching, IoT, Machine learning, Audit"
19240,Dorra Limam,dorra.limam738@live.com,apprenant,+21690352605,Tunisie,Tozeur,1994-05-20,"Analyse de données, IoT, Ressources humaines, Marketing digital"
19241,Chiraz Ezzine,chiraz.ezzine993@orange.tn,apprenant,+21620758068,Tunisie,Gafsa,1996-12-27,"Communication, Machine learning, Intelligence artificielle, Entrepreneuriat, Leadership"
19242,Maher Labidi,maher.labidi531@orange.tn,apprenant,+21693821336,Tunisie,Jendouba,2001-06-13,"Ressources humaines, Entrepreneuriat, Lean management, IoT"
19243,Myriam Hleli,myriam.hleli620@topnet.tn,apprenant,+21620094307,Tunisie,Médenine,2001-08-06,"ITIL, Développement web, Machine learning, Intelligence artificielle, IoT, Audit"
19244,Intissar Marzouki,intissar.marzouki156@yahoo.fr,apprenant,+21652140901,Tunisie,Sfax,1991-08-27,"Mentoring, Stratégie d'entreprise, Business intelligence"
19245,Hana Ghanmi,hana.ghanmi901@laposte.net,apprenant,+21693363977,Tunisie,Monastir,2002-05-16,"Cybersécurité, Agile, Lean management"
19246,Adel Hachicha,adel.hachicha773@orange.tn,apprenant,+21652523069,Tunisie,Béja,2001-01-08,"Machine learning, Stratégie d'entreprise"
19247,Mehdi Dridi,mehdi.dridi341@laposte.net,apprenant,+21691178294,Tunisie,Kairouan,1991-08-07,"Digital transformation, Informatique"
19248,Slim Fkih,slim.fkih61@laposte.net,apprenant,+21654198863,Tunisie,Nabeul,1999-06-30,"Informatique, Ressources humaines, Stratégie d'entreprise, DevOps, Mentoring"
19249,Maroua Bouaziz,maroua.bouaziz697@hotmail.com,apprenant,+21620189012,Tunisie,Manouba,1992-07-23,"Stratégie d'entreprise, IoT, Gestion de projet, Leadership, Développement web"
19250,Yasmine Daoud,yasmine.daoud812@outlook.com,apprenant,+21658067153,Tunisie,Zaghouan,1998-09-25,"Mentoring, Cloud computing, Communication"
19251,Youssef Bouhamed,youssef.bouhamed343@laposte.net,apprenant,+21690887113,Tunisie,Ariana,1999-12-01,"Technologie, Conseil, Communication, Gestion de projet"
19252,Emad Chaieb,emad.chaieb136@live.com,apprenant,+21690237050,Tunisie,Ariana,2003-08-19,"Conseil, DevOps, Innovation"
19253,Fatma Karoui,fatma.karoui221@hotmail.com,apprenant,+21693707926,Tunisie,Sousse,2000-11-11,"Business intelligence, Blockchain"
19254,Intissar Hmida,intissar.hmida630@hotmail.com,apprenant,+21692368047,Tunisie,Bizerte,1989-09-19,"Audit, Stratégie d'entreprise, Agile, Cloud computing, Certification"
19255,Ghazi Jazi,ghazi.jazi794@topnet.tn,apprenant,+21628227944,Tunisie,Bizerte,1993-09-23,"Intelligence artificielle, Blockchain, Conseil"
19256,Chiraz Nabli,chiraz.nabli433@outlook.com,apprenant,+21658946694,Tunisie,Monastir,1997-07-18,"Veille technologique, Finance"
19257,Wael Hachicha,wael.hachicha193@gmail.com,apprenant,+21622108130,Tunisie,Mahdia,1993-05-23,"Formation professionnelle, IoT, Coaching, ITIL"
19258,Ines Daoud,ines.daoud802@laposte.net,apprenant,+21623654722,Tunisie,Monastir,2000-01-05,"Veille technologique, Audit, Business intelligence, Informatique"
19259,Kenza Jouini,kenza.jouini376@gmail.com,apprenant,+21698497750,Tunisie,Tunis,1987-08-17,"Business intelligence, Stratégie d'entreprise, Développement web, Leadership, Finance"
19260,Nabil Ghanmi,nabil.ghanmi570@yahoo.fr,apprenant,+21650035417,Tunisie,Sfax,1988-02-20,"Business intelligence, Conseil, Intelligence artificielle, Mentoring, Cloud computing, Finance"
19261,Emna Mejri,emna.mejri68@live.com,apprenant,+21693398840,Tunisie,Sidi Bouzid,1995-02-21,"Formation professionnelle, Agile, Gestion de projet, Développement web, Mentoring"
19262,Noureddine Nasri,noureddine.nasri930@outlook.com,apprenant,+21690686721,Tunisie,Zaghouan,1998-02-23,"Digital transformation, Leadership, Qualité, IoT"
19263,Hedi Horchani,hedi.horchani629@live.com,apprenant,+21699222359,Tunisie,Gabès,2002-04-22,"Cybersécurité, Machine learning, Intelligence artificielle, Agile"
19264,Zouheir Miled,zouheir.miled820@gmail.com,apprenant,+21694840380,Tunisie,Kairouan,1994-09-16,"Business intelligence, Certification, Marketing digital, Lean management, Management"
19265,Olfa Guesmi,olfa.guesmi815@orange.tn,apprenant,+21652791325,Tunisie,Gabès,1985-02-07,"Conseil, Certification, Entrepreneuriat, Veille technologique"
19266,Ridha Jazi,ridha.jazi251@laposte.net,apprenant,+21690671332,Tunisie,Mahdia,1986-06-23,"Agile, Qualité, Entrepreneuriat, ITIL, Analyse de données, Digital transformation"
19267,Kais Jouini,kais.jouini366@gmail.com,apprenant,+21655168666,Tunisie,Tunis,1998-03-20,"Management, Intelligence artificielle, Mentoring, Gestion de projet, IoT, ITIL"
19268,Taoufik Mestiri,taoufik.mestiri823@hotmail.com,apprenant,+21659968171,Tunisie,Ben Arous,1995-08-27,"Entrepreneuriat, Qualité, Finance, Cloud computing, Leadership, Mentoring"
19269,Makram Neffati,makram.neffati311@gmail.com,apprenant,+21621726970,Tunisie,Le Kef,1990-07-23,"Digital transformation, Développement web, Conseil, Veille technologique"
19270,Marwan Ben Ahmed,marwan.ben.ahmed119@outlook.com,apprenant,+21690786972,Tunisie,Ariana,1999-02-12,"Leadership, Certification, Intelligence artificielle, Finance"
19271,Makram Daoud,makram.daoud263@yahoo.fr,apprenant,+21620232047,Tunisie,Gafsa,2004-08-01,"DevOps, Gestion de projet"
19272,Hedi Hadj,hedi.hadj270@hotmail.com,apprenant,+21653317686,Tunisie,Ariana,1996-05-08,"Gestion de projet, Qualité, Audit, IoT, Certification"
19273,Ali Dali,ali.dali772@outlook.com,apprenant,+21695163659,Tunisie,Le Kef,1985-09-03,"Lean management, Mentoring, Digital transformation"
19274,Karima Marzouki,karima.marzouki58@topnet.tn,apprenant,+21692220061,Tunisie,Ariana,1987-09-25,"Entrepreneuriat, Business intelligence, Intelligence artificielle, Coaching"
19275,Hedi Chedly,hedi.chedly378@topnet.tn,apprenant,+21696800477,Tunisie,Tozeur,2005-12-21,"Blockchain, Intelligence artificielle, Finance, Business intelligence, Audit"
19276,Hajer Mestiri,hajer.mestiri776@hotmail.com,apprenant,+21655684573,Tunisie,Médenine,1993-08-08,"ITIL, Formation professionnelle"
19277,Moez Ouali,moez.ouali917@gmail.com,apprenant,+21626181408,Tunisie,Sousse,2001-05-23,"Machine learning, Qualité, Marketing digital, Entrepreneuriat"
19278,Wassim Nasri,wassim.nasri277@live.com,apprenant,+21690324486,Tunisie,Kébili,1995-06-02,"Développement web, Marketing digital, Certification"
19279,Samia Ben Salah,samia.ben.salah88@gmail.com,apprenant,+21692711072,Tunisie,Gabès,1992-10-09,"Mentoring, Leadership, Lean management, Informatique, Qualité, E-commerce"
19280,Nesrine Karoui,nesrine.karoui133@outlook.com,apprenant,+21627954764,Tunisie,Bizerte,1985-03-17,"ITIL, Cloud computing, Veille technologique"
19281,Kenza Benhassan,kenza.benhassan951@gmail.com,apprenant,+21690351793,Tunisie,Jendouba,1996-06-12,"Stratégie d'entreprise, Leadership, ITIL, Machine learning, Finance"
19282,Bilel Limam,bilel.limam141@live.com,apprenant,+21658843941,Tunisie,Gafsa,2005-02-10,"Certification, Mentoring"
19283,Moncef Chedly,moncef.chedly731@hotmail.com,apprenant,+21655040436,Tunisie,Mahdia,1997-10-03,"Analyse de données, Business intelligence, Mentoring"
19284,Mehdi Feriani,mehdi.feriani243@hotmail.com,apprenant,+21626344167,Tunisie,Médenine,1996-01-05,"Certification, Cybersécurité, Lean management, Machine learning, E-commerce"
19285,Yosra Gharbi,yosra.gharbi123@outlook.com,apprenant,+21650596636,Tunisie,Monastir,1989-07-15,"Veille technologique, Marketing digital, Développement web, Audit, Intelligence artificielle"
19286,Mariam Mrad,mariam.mrad556@hotmail.com,apprenant,+21699466756,Tunisie,Médenine,2004-02-04,"Formation professionnelle, Veille technologique, Agile, Technologie, Marketing digital, DevOps"
19287,Zohra Sellami,zohra.sellami84@live.com,apprenant,+21658980582,Tunisie,Kébili,1991-06-27,"Certification, Cybersécurité, Marketing digital, IoT, Formation professionnelle, Conseil"
19288,Tarek Mrad,tarek.mrad375@live.com,apprenant,+21629561121,Tunisie,Le Kef,1996-09-01,"Stratégie d'entreprise, Finance, Innovation, Management"
19289,Nesrine Gabsi,nesrine.gabsi976@laposte.net,apprenant,+21698264743,Tunisie,Médenine,2007-10-06,"Intelligence artificielle, Stratégie d'entreprise, Communication"
19290,Yasmine Ben Ahmed,yasmine.ben.ahmed729@live.com,apprenant,+21621606828,Tunisie,Ariana,1985-04-02,"Conseil, Intelligence artificielle, Cloud computing, Agile, Informatique"
19291,Bochra Marzouki,bochra.marzouki335@yahoo.fr,apprenant,+21658467740,Tunisie,Gabès,1986-07-20,"IoT, Innovation"
19292,Myriam Landolsi,myriam.landolsi557@outlook.com,apprenant,+21657506671,Tunisie,Jendouba,2000-11-21,"ITIL, Veille technologique, Entrepreneuriat, Leadership, Mentoring"
19293,Kenza Ghali,kenza.ghali84@topnet.tn,apprenant,+21697232313,Tunisie,Mahdia,1989-07-11,"Machine learning, Stratégie d'entreprise, Mentoring, Business intelligence, Cybersécurité, Innovation"
19294,Dali Kchir,dali.kchir219@yahoo.fr,apprenant,+21697742632,Tunisie,Béja,1999-11-21,"Cloud computing, Blockchain, Mentoring, Développement web, Qualité, Communication"
19295,Ridha Guesmi,ridha.guesmi159@topnet.tn,apprenant,+21694007133,Tunisie,Kairouan,1990-11-30,"Intelligence artificielle, Certification, Audit, Qualité, Mentoring"
19296,Tarek Miled,tarek.miled322@gmail.com,apprenant,+21620196040,Tunisie,Jendouba,1994-09-21,"Management, Analyse de données, Agile, Veille technologique"
19297,Yosra Mabrouk,yosra.mabrouk141@yahoo.fr,apprenant,+21652118205,Tunisie,Zaghouan,2004-12-09,"Gestion de projet, Ressources humaines, Intelligence artificielle, Machine learning, Coaching, Conseil"
19298,Hedi Hamza,hedi.hamza299@outlook.com,apprenant,+21699488134,Tunisie,Zaghouan,1988-11-09,"Gestion de projet, Cloud computing, Technologie, Blockchain"
19299,Chiraz Daoud,chiraz.daoud563@orange.tn,apprenant,+21623778219,Tunisie,Le Kef,1988-06-16,"Mentoring, Cloud computing, Stratégie d'entreprise"
19300,Yasmine Mansouri,yasmine.mansouri147@yahoo.fr,apprenant,+21628301104,Tunisie,Siliana,2000-01-11,"Qualité, Communication"
19301,Khadija Hajji,khadija.hajji219@gmail.com,apprenant,+21692028577,Tunisie,Le Kef,2004-07-05,"Management, ITIL"
19302,Rim Jelassi,rim.jelassi339@live.com,apprenant,+21623198349,Tunisie,Sfax,2004-12-25,"DevOps, Coaching, Communication, Business intelligence, Machine learning"
19303,Karima Jouini,karima.jouini746@hotmail.com,apprenant,+21657277362,Tunisie,Gabès,2003-01-07,"DevOps, Marketing digital, Innovation"
19304,Fares Guizani,fares.guizani430@hotmail.com,apprenant,+21620984092,Tunisie,Kébili,2003-03-22,"Cloud computing, Agile, Cybersécurité, Stratégie d'entreprise, Leadership"
19305,Emad Bouhamed,emad.bouhamed587@live.com,apprenant,+21626112914,Tunisie,Manouba,1997-09-11,"Lean management, Développement web, Qualité"
19306,Moncef Layouni,moncef.layouni255@gmail.com,apprenant,+21629903028,Tunisie,Gafsa,2005-03-17,"E-commerce, Blockchain, Certification"
19307,Hatem Laabidi,hatem.laabidi270@orange.tn,apprenant,+21656259898,Tunisie,Monastir,1992-02-14,"Qualité, Lean management, Développement web, Communication, Mentoring, Certification"
19308,Moez Bouzid,moez.bouzid246@outlook.com,apprenant,+21696792457,Tunisie,Ben Arous,1986-06-08,"Informatique, Cloud computing"
19309,Rami Khedher,rami.khedher885@yahoo.fr,apprenant,+21695101069,Tunisie,Sidi Bouzid,1986-07-31,"Lean management, Finance, Innovation, Cybersécurité"
19310,Maher Daoud,maher.daoud266@hotmail.com,apprenant,+21695493368,Tunisie,Monastir,1987-04-20,"Management, Coaching, DevOps, Audit"
19311,Lassad Landolsi,lassad.landolsi767@topnet.tn,apprenant,+21654985877,Tunisie,Manouba,1996-08-20,"Lean management, Ressources humaines, Cloud computing, Stratégie d'entreprise"
