ID,Nom,Email,Rôle,Téléphone,Pays,Ville,Date de naissance,Centres d'intérêt
20314,Hichem Karray,hichem.karray108@orange.tn,apprenant,+21654629620,Tunisie,Zaghouan,1988-02-01,"Blockchain, Machine learning, Qualité, Formation professionnelle, Business intelligence, Agile"
20315,Zied Hajji,zied.hajji759@gmail.com,apprenant,+21690359517,Tunisie,Gabès,1999-01-19,"Management, Stratégie d'entreprise, Business intelligence, Veille technologique, Audit, Informatique"
20316,Thouraya Horchani,thouraya.horchani987@hotmail.com,apprenant,+21625638050,Tunisie,Béja,2005-02-24,"Ressources humaines, Développement web"
20317,Lobna Dali,lobna.dali925@topnet.tn,apprenant,+21621425156,Tunisie,Ariana,1997-05-08,"Formation professionnelle, Communication, Qualité, Conseil"
20318,Yassine Ghanmi,yassine.ghanmi946@yahoo.fr,apprenant,+21657419263,Tunisie,Kébili,1986-12-18,"Technologie, Innovation, Mentoring, Informatique, Cybersécurité, Machine learning"
20319,Manel Bouaziz,manel.bouaziz408@orange.tn,apprenant,+21658382010,Tunisie,Tataouine,1989-09-13,"Machine learning, Lean management"
20320,Aymen Kchir,aymen.kchir287@orange.tn,apprenant,+21622485488,Tunisie,Gafsa,1985-06-11,"Veille technologique, Qualité, Stratégie d'entreprise, ITIL"
20321,Taoufik Hleli,taoufik.hleli893@hotmail.com,apprenant,+21694084689,Tunisie,Le Kef,2003-05-12,"Digital transformation, Coaching, Ressources humaines, DevOps, Management"
20322,Salma Hachicha,salma.hachicha810@orange.tn,apprenant,+21651589028,Tunisie,Manouba,1997-12-22,"Management, Qualité"
20323,Khaled Karray,khaled.karray936@outlook.com,apprenant,+21694186426,Tunisie,Zaghouan,1991-10-03,"Développement web, Leadership, Formation professionnelle"
20324,Lamia Bouaziz,lamia.bouaziz973@gmail.com,apprenant,+21690219475,Tunisie,Kairouan,1989-04-10,"Analyse de données, Stratégie d'entreprise, Cloud computing"
20325,Maroua Jazi,maroua.jazi723@hotmail.com,apprenant,+21659470053,Tunisie,Sfax,1988-03-16,"Cybersécurité, Machine learning, Leadership, Intelligence artificielle"
20326,Ikram Gasmi,ikram.gasmi88@orange.tn,apprenant,+21653245748,Tunisie,Ariana,1988-11-24,"IoT, Certification, Ressources humaines, Qualité, Business intelligence, Entrepreneuriat"
20327,Rim Guesmi,rim.guesmi167@gmail.com,apprenant,+21653143431,Tunisie,Monastir,1997-03-07,"DevOps, Stratégie d'entreprise"
20328,Hatem Layouni,hatem.layouni767@gmail.com,apprenant,+21650347662,Tunisie,Kasserine,1997-12-04,"Analyse de données, Cloud computing, Certification, Management, Entrepreneuriat"
20329,Lassad Derbali,lassad.derbali278@live.com,apprenant,+21653528985,Tunisie,Zaghouan,1987-02-16,"Entrepreneuriat, DevOps, IoT, Ressources humaines, Certification"
20330,Tarek Nasri,tarek.nasri388@live.com,apprenant,+21629258251,Tunisie,Sousse,1986-08-07,"Conseil, Business intelligence, DevOps, Lean management"
20331,Wassim Bouzid,wassim.bouzid3@hotmail.com,apprenant,+21624937274,Tunisie,Bizerte,1993-09-08,"Veille technologique, Intelligence artificielle, Machine learning, E-commerce"
20332,Chedly Meddeb,chedly.meddeb282@orange.tn,apprenant,+21691921700,Tunisie,Mahdia,2006-06-05,"Innovation, Qualité, Management, IoT"
20333,Noureddine Layouni,noureddine.layouni61@yahoo.fr,apprenant,+21697302660,Tunisie,Siliana,1994-12-15,"Certification, Leadership, Machine learning, Digital transformation"
20334,Najoua Feriani,najoua.feriani831@yahoo.fr,apprenant,+21655573153,Tunisie,Gafsa,1985-05-08,"Stratégie d'entreprise, Analyse de données, Cloud computing, DevOps, Développement web, Marketing digital"
20335,Dalila Mrad,dalila.mrad287@outlook.com,apprenant,+21651025340,Tunisie,Monastir,1997-10-13,"Entrepreneuriat, Intelligence artificielle, Cybersécurité"
20336,Hatem Mabrouk,hatem.mabrouk514@topnet.tn,apprenant,+21652844310,Tunisie,Manouba,1997-12-14,"Entrepreneuriat, Intelligence artificielle, ITIL, Agile, Coaching, Veille technologique"
20337,Latifa Neffati,latifa.neffati806@outlook.com,apprenant,+21699490501,Tunisie,Gabès,1998-05-13,"Communication, Business intelligence"
20338,Myriam Gasmi,myriam.gasmi905@gmail.com,apprenant,+21691801222,Tunisie,Sidi Bouzid,1996-03-02,"Entrepreneuriat, DevOps, Agile, Formation professionnelle, Finance, Mentoring"
20339,Amel Landolsi,amel.landolsi294@hotmail.com,apprenant,+21655833097,Tunisie,Kairouan,1988-04-25,"DevOps, Analyse de données, Conseil, Entrepreneuriat, Technologie, ITIL"
20340,Dali Jelassi,dali.jelassi940@gmail.com,apprenant,+21694136340,Tunisie,Jendouba,1986-04-23,"Développement web, Digital transformation, E-commerce, Intelligence artificielle, Technologie, Formation professionnelle"
20341,Aymen Dali,aymen.dali361@hotmail.com,apprenant,+21698291165,Tunisie,Ben Arous,2004-04-07,"IoT, Stratégie d'entreprise, ITIL, Blockchain, Digital transformation, DevOps"
20342,Makram Hajji,makram.hajji726@gmail.com,apprenant,+21652015180,Tunisie,Béja,2000-04-17,"Intelligence artificielle, Cloud computing"
20343,Zied Karoui,zied.karoui581@orange.tn,apprenant,+21657443513,Tunisie,Zaghouan,1991-01-25,"Intelligence artificielle, Innovation, Blockchain"
20344,Khadija Louati,khadija.louati995@topnet.tn,apprenant,+21624964735,Tunisie,Tozeur,2001-10-23,"Technologie, Intelligence artificielle, Développement web, Digital transformation"
20345,Fethi Mestiri,fethi.mestiri997@hotmail.com,apprenant,+21622426181,Tunisie,Kasserine,1994-03-10,"Cybersécurité, Finance, IoT, Business intelligence"
20346,Emad Gharbi,emad.gharbi435@yahoo.fr,apprenant,+21625804104,Tunisie,Kairouan,1994-12-11,"DevOps, Entrepreneuriat, Management, Cloud computing, Conseil, Machine learning"
20347,Jihene Gasmi,jihene.gasmi607@topnet.tn,apprenant,+21698307019,Tunisie,Tataouine,2006-12-11,"Innovation, Cloud computing, Stratégie d'entreprise, Qualité, Veille technologique, ITIL"
20348,Khaled Nasri,khaled.nasri341@laposte.net,apprenant,+21651991175,Tunisie,Kasserine,2005-01-02,"Technologie, Analyse de données"
20349,Sofiane Hamza,sofiane.hamza686@outlook.com,apprenant,+21659998102,Tunisie,Monastir,1985-05-01,"Marketing digital, Communication, DevOps, Qualité"
20350,Sabrine Dali,sabrine.dali302@hotmail.com,apprenant,+21658362909,Tunisie,Bizerte,1987-06-13,"IoT, Gestion de projet, Ressources humaines, Finance"
20351,Chedly Layouni,chedly.layouni342@hotmail.com,apprenant,+21622136506,Tunisie,Siliana,2005-04-27,"Audit, Agile, Informatique, Finance, Blockchain"
20352,Amira Mabrouk,amira.mabrouk460@topnet.tn,apprenant,+21699515329,Tunisie,Nabeul,1993-10-03,"Développement web, Gestion de projet, Finance"
20353,Ghada Hassen,ghada.hassen921@hotmail.com,apprenant,+21694368979,Tunisie,Gabès,2000-05-19,"Lean management, Informatique, Communication"
20354,Jihene Mabrouk,jihene.mabrouk13@topnet.tn,apprenant,+21656934316,Tunisie,Sousse,1998-03-03,"Informatique, Innovation, Technologie, Finance"
20355,Kenza Hadj,kenza.hadj958@yahoo.fr,apprenant,+21695637518,Tunisie,Tunis,1997-08-23,"Analyse de données, Lean management, Qualité, DevOps, Agile, Intelligence artificielle"
20356,Bassem Bouslama,bassem.bouslama99@laposte.net,apprenant,+21652223021,Tunisie,Mahdia,1991-08-13,"Management, Certification, Informatique"
20357,Bilel Jouini,bilel.jouini774@outlook.com,apprenant,+21651518502,Tunisie,Gafsa,2000-01-31,"IoT, Finance, Entrepreneuriat, Management"
20358,Emad Ghanmi,emad.ghanmi295@hotmail.com,apprenant,+21693680795,Tunisie,Bizerte,1999-01-09,"Qualité, Communication, ITIL, Finance, Certification, DevOps"
20359,Chedly Hleli,chedly.hleli199@laposte.net,apprenant,+21655459115,Tunisie,Manouba,1999-01-04,"Informatique, Gestion de projet, Stratégie d'entreprise, Communication"
20360,Thouraya Mejri,thouraya.mejri311@hotmail.com,apprenant,+21696594118,Tunisie,Mahdia,1997-09-08,"Intelligence artificielle, Innovation, Audit, Leadership"
20361,Makram Sellami,makram.sellami955@topnet.tn,apprenant,+21627320999,Tunisie,Sousse,2002-07-24,"Leadership, Informatique, Cloud computing, Certification"
20362,Salma Nabli,salma.nabli383@orange.tn,apprenant,+21653526722,Tunisie,Tunis,2007-03-11,"Management, DevOps"
20363,Hana Miled,hana.miled19@topnet.tn,apprenant,+21627426210,Tunisie,Médenine,2002-10-23,"ITIL, Certification, Développement web, IoT, Gestion de projet"
20364,Nour Meddeb,nour.meddeb913@laposte.net,apprenant,+21690689659,Tunisie,Nabeul,1988-02-21,"Agile, Leadership, Digital transformation"
20365,Wassim Hmida,wassim.hmida239@topnet.tn,apprenant,+21627162727,Tunisie,Tunis,1993-01-06,"E-commerce, Business intelligence, Leadership, Management, Cybersécurité, Conseil"
20366,Takwa Bouaziz,takwa.bouaziz699@live.com,apprenant,+21653046604,Tunisie,Manouba,1991-10-12,"Certification, Finance, Mentoring, Cybersécurité, Management, Agile"
20367,Kais Sellami,kais.sellami118@topnet.tn,apprenant,+21620013039,Tunisie,Ben Arous,1997-08-26,"Lean management, E-commerce, Certification"
20368,Jamel Hadj,jamel.hadj997@hotmail.com,apprenant,+21698689994,Tunisie,Tunis,2004-07-24,"IoT, Formation professionnelle, Certification"
20369,Kais Chihaoui,kais.chihaoui630@hotmail.com,apprenant,+21620979347,Tunisie,Bizerte,1988-10-14,"Qualité, Cloud computing, Certification"
20370,Wafa Horchani,wafa.horchani342@gmail.com,apprenant,+21620329610,Tunisie,Kébili,1990-04-14,"Management, IoT"
20371,Jihene Hmida,jihene.hmida486@live.com,apprenant,+21620372679,Tunisie,Jendouba,2004-06-27,"Mentoring, Certification, Ressources humaines, Lean management, IoT"
20372,Omar Ferchichi,omar.ferchichi357@outlook.com,apprenant,+21697771582,Tunisie,Ariana,1994-07-07,"Analyse de données, Technologie"
20373,Kenza Mrad,kenza.mrad742@yahoo.fr,apprenant,+21699304228,Tunisie,Ariana,1992-08-19,"Gestion de projet, Management, Analyse de données, E-commerce, Développement web, Stratégie d'entreprise"
20374,Moncef Fkih,moncef.fkih850@laposte.net,apprenant,+21698242731,Tunisie,Mahdia,1992-09-20,"Agile, Technologie, Analyse de données, Qualité, Finance, Management"
20375,Ahmed Laabidi,ahmed.laabidi16@outlook.com,apprenant,+21657765231,Tunisie,Médenine,2001-05-23,"Gestion de projet, ITIL"
20376,Mariam Khedher,mariam.khedher824@topnet.tn,apprenant,+21696075633,Tunisie,Kasserine,2007-12-01,"Cloud computing, ITIL, Formation professionnelle, Leadership, Veille technologique"
20377,Sonia Louati,sonia.louati671@live.com,apprenant,+21624101151,Tunisie,Le Kef,1993-07-14,"Intelligence artificielle, Cybersécurité, Technologie, Communication"
20378,Wided Rekik,wided.rekik630@orange.tn,apprenant,+21628058162,Tunisie,Ariana,1988-05-04,"Technologie, Blockchain, Business intelligence, DevOps, Coaching, Innovation"
20379,Sonia Kchir,sonia.kchir112@topnet.tn,apprenant,+21622336921,Tunisie,Bizerte,2002-06-06,"Certification, Intelligence artificielle"
20380,Slim Hajji,slim.hajji882@outlook.com,apprenant,+21694946150,Tunisie,Le Kef,1989-11-08,"Gestion de projet, Intelligence artificielle, Innovation, Digital transformation, Business intelligence, Certification"
20381,Omar Mahjoub,omar.mahjoub58@topnet.tn,apprenant,+21621425782,Tunisie,Tunis,2001-11-03,"Gestion de projet, Développement web, DevOps, Informatique, Machine learning, Digital transformation"
20382,Dali Jebali,dali.jebali689@topnet.tn,apprenant,+21629849555,Tunisie,Manouba,1998-04-18,"Technologie, IoT"
20383,Hedi Gasmi,hedi.gasmi628@gmail.com,apprenant,+21657316275,Tunisie,Kairouan,1993-12-15,"Machine learning, Gestion de projet, Conseil, Formation professionnelle, Business intelligence, DevOps"
20384,Wided Hmida,wided.hmida741@live.com,apprenant,+21693087958,Tunisie,Monastir,1997-12-16,"DevOps, Mentoring, Stratégie d'entreprise, Marketing digital, Coaching, Cloud computing"
20385,Farouk Horchani,farouk.horchani527@outlook.com,apprenant,+21623051070,Tunisie,Kasserine,1995-02-19,"Ressources humaines, Agile, Leadership, Développement web"
20386,Mohamed Limam,mohamed.limam629@yahoo.fr,apprenant,+21653614366,Tunisie,Kasserine,1989-07-18,"Analyse de données, Blockchain, Informatique, Audit, IoT"
20387,Manel Ouali,manel.ouali127@yahoo.fr,apprenant,+21623035371,Tunisie,Gafsa,2000-03-24,"Agile, Management"
20388,Cyrine Fourati,cyrine.fourati148@topnet.tn,apprenant,+21699397989,Tunisie,Bizerte,1997-10-01,"ITIL, Blockchain"
20389,Ali Hmida,ali.hmida172@laposte.net,apprenant,+21620857205,Tunisie,Kasserine,1988-11-22,"Agile, Formation professionnelle"
20390,Rami Limam,rami.limam254@gmail.com,apprenant,+21625496263,Tunisie,Manouba,1987-10-11,"Cybersécurité, Qualité"
20391,Tarek Ghorbel,tarek.ghorbel516@live.com,apprenant,+21658400754,Tunisie,Ben Arous,1987-10-06,"Qualité, E-commerce, Développement web, Management, Machine learning, Intelligence artificielle"
20392,Youssef Bouhamed,youssef.bouhamed976@live.com,apprenant,+21697463712,Tunisie,Zaghouan,2004-04-05,"Innovation, Développement web, Intelligence artificielle, Blockchain, Agile, Entrepreneuriat"
20393,Maher Khlif,maher.khlif113@outlook.com,apprenant,+21654434393,Tunisie,Tataouine,1999-03-25,"Informatique, Certification, Innovation, ITIL, Cybersécurité, Entrepreneuriat"
20394,Aymen Gabsi,aymen.gabsi161@live.com,apprenant,+21694373974,Tunisie,Tozeur,2006-11-11,"Formation professionnelle, Qualité, Coaching, Innovation, Analyse de données"
20395,Tarek Horchani,tarek.horchani711@laposte.net,apprenant,+21650964569,Tunisie,Gafsa,1992-12-01,"Lean management, E-commerce, Agile, Machine learning"
20396,Yassine Trabelsi,yassine.trabelsi471@live.com,apprenant,+21691280512,Tunisie,Nabeul,2001-03-12,"Technologie, Analyse de données, Entrepreneuriat, Blockchain, IoT"
20397,Aymen Rekik,aymen.rekik368@gmail.com,apprenant,+21697906725,Tunisie,Mahdia,1996-04-08,"Veille technologique, Ressources humaines, Blockchain, Développement web, Management, Finance"
20398,Intissar Horchani,intissar.horchani376@gmail.com,apprenant,+21658885677,Tunisie,Tunis,1991-06-04,"Communication, Lean management, Gestion de projet, DevOps, Analyse de données"
20399,Hatem Laabidi,hatem.laabidi954@laposte.net,apprenant,+21696024324,Tunisie,Sfax,2003-11-01,"Blockchain, Informatique"
20400,Ghada Dhouib,ghada.dhouib816@outlook.com,apprenant,+21626663244,Tunisie,Kasserine,1997-03-11,"Agile, Technologie"
20401,Sabrine Hachicha,sabrine.hachicha719@live.com,apprenant,+21656262981,Tunisie,Monastir,1990-06-11,"Gestion de projet, Intelligence artificielle, Coaching, Informatique"
20402,Dalila Derbali,dalila.derbali249@live.com,apprenant,+21659834665,Tunisie,Ben Arous,1998-10-06,"Intelligence artificielle, Blockchain"
20403,Nesrine Chebbi,nesrine.chebbi751@hotmail.com,apprenant,+21692555576,Tunisie,Monastir,2002-02-18,"DevOps, Développement web, Innovation, Ressources humaines, Veille technologique, Marketing digital"
20404,Kenza Gharbi,kenza.gharbi405@gmail.com,apprenant,+21690121412,Tunisie,Tunis,2002-02-04,"Veille technologique, Intelligence artificielle, Cloud computing, Qualité, Gestion de projet"
20405,Intissar Mahjoub,intissar.mahjoub977@gmail.com,apprenant,+21626235682,Tunisie,Nabeul,1999-05-23,"IoT, Machine learning, Stratégie d'entreprise"
20406,Imed Landolsi,imed.landolsi763@outlook.com,apprenant,+21655018210,Tunisie,Ben Arous,1988-04-16,"Cybersécurité, Formation professionnelle, Blockchain, ITIL"
20407,Hiba Ben Salah,hiba.ben.salah713@orange.tn,apprenant,+21653192219,Tunisie,Nabeul,1995-08-10,"Blockchain, Communication, Management"
20408,Noureddine Chedly,noureddine.chedly284@gmail.com,apprenant,+21651144425,Tunisie,Siliana,1993-09-03,"E-commerce, Stratégie d'entreprise"
20409,Youssef Sellami,youssef.sellami154@hotmail.com,apprenant,+21628478818,Tunisie,Tataouine,1991-01-16,"Communication, Finance, Certification"
20410,Wassim Miled,wassim.miled744@topnet.tn,apprenant,+21628069070,Tunisie,Manouba,2003-03-17,"Coaching, Formation professionnelle, ITIL, Audit"
20411,Farouk Jouini,farouk.jouini116@yahoo.fr,apprenant,+21651821221,Tunisie,Nabeul,1987-10-25,"Cloud computing, Analyse de données"
20412,Chedly Rekik,chedly.rekik915@outlook.com,apprenant,+21622229572,Tunisie,Médenine,1993-04-03,"Lean management, ITIL, Machine learning, DevOps, Conseil, Management"
20413,Yasmine Mejri,yasmine.mejri350@outlook.com,apprenant,+21659202916,Tunisie,Manouba,2006-03-14,"Cybersécurité, Agile, Cloud computing"
20414,Nesrine Jemli,nesrine.jemli842@orange.tn,apprenant,+21698056509,Tunisie,Manouba,1991-06-20,"Business intelligence, Développement web"
20415,Yosra Hleli,yosra.hleli253@topnet.tn,apprenant,+21690837907,Tunisie,Sfax,2005-05-06,"Blockchain, Entrepreneuriat"
20416,Kenza Ferchichi,kenza.ferchichi635@orange.tn,apprenant,+21620361552,Tunisie,Mahdia,1990-11-09,"Veille technologique, Cybersécurité"
20417,Ridha Trabelsi,ridha.trabelsi958@laposte.net,apprenant,+21627545649,Tunisie,Gabès,2005-08-20,"Digital transformation, Lean management"
20418,Moez Karoui,moez.karoui770@gmail.com,apprenant,+21692868660,Tunisie,Monastir,1989-05-20,"Machine learning, Formation professionnelle, Coaching"
20419,Zohra Hmida,zohra.hmida992@outlook.com,apprenant,+21625720322,Tunisie,Béja,2003-03-18,"Coaching, Audit"
20420,Mehdi Jazi,mehdi.jazi756@outlook.com,apprenant,+21657995419,Tunisie,Jendouba,1985-11-20,"Communication, Formation professionnelle, DevOps, Informatique, Développement web, Finance"
20421,Bochra Khlif,bochra.khlif942@topnet.tn,apprenant,+21622718862,Tunisie,Kébili,2005-11-11,"Entrepreneuriat, E-commerce, Certification, Veille technologique"
20422,Besma Horchani,besma.horchani647@laposte.net,apprenant,+21628996733,Tunisie,Kairouan,2006-10-24,"Coaching, Leadership, Qualité, Veille technologique, Informatique, Développement web"
20423,Takwa Khlif,takwa.khlif31@orange.tn,apprenant,+21690245636,Tunisie,Nabeul,2004-11-27,"Stratégie d'entreprise, Développement web, Formation professionnelle, Certification, Intelligence artificielle"
20424,Farah Ferjani,farah.ferjani267@yahoo.fr,apprenant,+21699673629,Tunisie,Tataouine,1987-09-03,"Mentoring, Informatique, Marketing digital, Cloud computing, Qualité, Blockchain"
20425,Moez Karoui,moez.karoui590@laposte.net,apprenant,+21654437569,Tunisie,Sidi Bouzid,1996-04-25,"Lean management, Certification, Innovation"
20426,Kais Chaieb,kais.chaieb151@laposte.net,apprenant,+21695684875,Tunisie,Mahdia,2007-03-22,"Marketing digital, Certification, Lean management, Business intelligence, E-commerce"
20427,Marwan Hamdi,marwan.hamdi105@laposte.net,apprenant,+21654313467,Tunisie,Tataouine,1991-11-17,"Lean management, IoT, Analyse de données, Intelligence artificielle, ITIL"
20428,Hajer Ben Ali,hajer.ben.ali556@topnet.tn,apprenant,+21699341690,Tunisie,Kairouan,1997-01-20,"Qualité, Digital transformation, Ressources humaines"
20429,Tarek Bouhamed,tarek.bouhamed861@yahoo.fr,apprenant,+21620249350,Tunisie,Tozeur,1986-03-17,"Technologie, Développement web"
20430,Hichem Marzouki,hichem.marzouki750@hotmail.com,apprenant,+21692485791,Tunisie,Nabeul,1988-03-22,"Audit, Technologie"
20431,Maher Ghanmi,maher.ghanmi730@hotmail.com,apprenant,+21695584936,Tunisie,Sousse,1996-02-16,"Intelligence artificielle, Marketing digital, Leadership"
20432,Marwan Maaloul,marwan.maaloul624@outlook.com,apprenant,+21620103977,Tunisie,Gabès,1999-03-13,"Machine learning, Gestion de projet, Mentoring, Business intelligence, DevOps"
20433,Noureddine Maaloul,noureddine.maaloul8@outlook.com,apprenant,+21629348290,Tunisie,Ben Arous,1990-09-08,"Coaching, Digital transformation, Finance"
20434,Adel Mahjoub,adel.mahjoub667@hotmail.com,apprenant,+21658227960,Tunisie,Bizerte,1994-11-30,"Conseil, Cybersécurité, Intelligence artificielle, Certification, Mentoring, Cloud computing"
20435,Najoua Chebbi,najoua.chebbi793@laposte.net,apprenant,+21697582192,Tunisie,Tataouine,1989-09-26,"Lean management, E-commerce"
20436,Dorsaf Maaloul,dorsaf.maaloul258@laposte.net,apprenant,+21655662677,Tunisie,Kairouan,2000-10-06,"Machine learning, Cybersécurité, Formation professionnelle, Innovation, Technologie, Cloud computing"
20437,Marwan Mabrouk,marwan.mabrouk165@gmail.com,apprenant,+21692440703,Tunisie,Sousse,1991-10-01,"Gestion de projet, Veille technologique, Cloud computing, Coaching, Analyse de données"
20438,Farah Ben Ahmed,farah.ben.ahmed495@laposte.net,apprenant,+21652036054,Tunisie,Gafsa,2006-06-01,"Leadership, Finance, Gestion de projet, Intelligence artificielle, Cybersécurité"
20439,Farouk Maaloul,farouk.maaloul625@live.com,apprenant,+21620355108,Tunisie,Nabeul,1991-12-14,"ITIL, Audit"
20440,Kenza Mejri,kenza.mejri912@gmail.com,apprenant,+21653601352,Tunisie,Siliana,1999-07-18,"Ressources humaines, Management, Stratégie d'entreprise, Mentoring, Machine learning"
20441,Mariam Hamdi,mariam.hamdi213@outlook.com,apprenant,+21695733112,Tunisie,Mahdia,1995-10-14,"Finance, Certification, Machine learning, Technologie, Qualité"
20442,Zied Jouini,zied.jouini833@live.com,apprenant,+21623678163,Tunisie,Mahdia,1993-09-18,"Gestion de projet, Marketing digital, Coaching, Finance, Stratégie d'entreprise, Agile"
20443,Moncef Jelassi,moncef.jelassi172@topnet.tn,apprenant,+21659709324,Tunisie,Nabeul,2004-08-15,"Finance, Blockchain"
20444,Taoufik Karray,taoufik.karray280@live.com,apprenant,+21694429343,Tunisie,Sousse,1997-12-20,"DevOps, Finance, Business intelligence, E-commerce, Agile, Coaching"
20445,Maher Jebali,maher.jebali857@orange.tn,apprenant,+21658633585,Tunisie,Gabès,1995-02-12,"Conseil, Qualité, Intelligence artificielle"
20446,Mehdi Guizani,mehdi.guizani974@laposte.net,apprenant,+21691975930,Tunisie,Ariana,1989-12-05,"Management, Veille technologique, Cloud computing, Gestion de projet"
20447,Sami Ben Salah,sami.ben.salah859@outlook.com,apprenant,+21696916846,Tunisie,Sidi Bouzid,1987-08-26,"Qualité, Conseil, Technologie, Communication, Coaching, IoT"
20448,Samia Hamdi,samia.hamdi741@gmail.com,apprenant,+21696051842,Tunisie,Mahdia,2003-07-20,"Machine learning, IoT, ITIL, Mentoring, Technologie, Cybersécurité"
20449,Fares Hmida,fares.hmida887@gmail.com,apprenant,+21657185415,Tunisie,Ben Arous,1987-11-24,"Analyse de données, DevOps"
20450,Besma Jebali,besma.jebali524@gmail.com,apprenant,+21622306735,Tunisie,Monastir,1986-08-15,"Marketing digital, Ressources humaines, Conseil"
20451,Farah Ktari,farah.ktari517@topnet.tn,apprenant,+21655026335,Tunisie,Tataouine,1993-10-18,"Veille technologique, E-commerce, Marketing digital"
20452,Noureddine Layouni,noureddine.layouni505@laposte.net,apprenant,+21692378203,Tunisie,Tataouine,2000-03-11,"Ressources humaines, Qualité, Blockchain, Stratégie d'entreprise, Lean management"
20453,Takwa Jelassi,takwa.jelassi933@yahoo.fr,apprenant,+21657111035,Tunisie,Sousse,1989-07-04,"Informatique, Technologie, Marketing digital, Management, Stratégie d'entreprise, Lean management"
20454,Karim Louati,karim.louati807@live.com,apprenant,+21629578469,Tunisie,Bizerte,1989-02-24,"Conseil, Technologie, Stratégie d'entreprise, Innovation, Lean management, Ressources humaines"
20455,Nesrine Bouzid,nesrine.bouzid976@yahoo.fr,apprenant,+21697848965,Tunisie,Le Kef,1991-01-13,"Analyse de données, Conseil, Mentoring, Formation professionnelle, IoT"
20456,Chiraz Mejri,chiraz.mejri953@laposte.net,apprenant,+21652183718,Tunisie,Ariana,1996-04-14,"Formation professionnelle, IoT, Conseil, ITIL, Audit"
20457,Hajer Maaloul,hajer.maaloul768@outlook.com,apprenant,+21657768370,Tunisie,Gafsa,1989-05-18,"Finance, IoT, Analyse de données, Stratégie d'entreprise, Lean management"
20458,Nabil Bouhamed,nabil.bouhamed438@gmail.com,apprenant,+21691021603,Tunisie,Monastir,1992-04-07,"Cybersécurité, Agile, Intelligence artificielle, Leadership, ITIL"
20459,Youssef Horchani,youssef.horchani848@hotmail.com,apprenant,+21626997915,Tunisie,Nabeul,2006-03-14,"ITIL, Gestion de projet, Leadership"
20460,Maroua Ghorbel,maroua.ghorbel715@gmail.com,apprenant,+21622164159,Tunisie,Kasserine,1991-04-03,"Mentoring, Management, Finance, Certification"
20461,Rania Ferchichi,rania.ferchichi582@topnet.tn,apprenant,+21622152743,Tunisie,Jendouba,1997-02-28,"Business intelligence, DevOps"
20462,Rania Hleli,rania.hleli2@outlook.com,apprenant,+21651108694,Tunisie,Médenine,2000-10-17,"Business intelligence, Audit, Entrepreneuriat"
20463,Yassine Jemli,yassine.jemli864@laposte.net,apprenant,+21655703541,Tunisie,Le Kef,2007-12-19,"Qualité, ITIL, Blockchain, Ressources humaines, Informatique"
20464,Wafa Horchani,wafa.horchani985@orange.tn,apprenant,+21628521560,Tunisie,Gafsa,2007-01-21,"Analyse de données, Leadership, ITIL, Veille technologique, Agile"
20465,Dalila Dali,dalila.dali847@orange.tn,apprenant,+21697698980,Tunisie,Ben Arous,1998-11-15,"Conseil, Lean management, Intelligence artificielle"
20466,Rim Mahjoub,rim.mahjoub119@outlook.com,apprenant,+21692523967,Tunisie,Kébili,1985-02-19,"Marketing digital, IoT"
20467,Taoufik Ben Ahmed,taoufik.ben.ahmed70@yahoo.fr,apprenant,+21690962379,Tunisie,Bizerte,1987-05-23,"Cybersécurité, Entrepreneuriat"
20468,Moez Khedher,moez.khedher294@orange.tn,apprenant,+21620304903,Tunisie,Gafsa,1986-04-25,"Ressources humaines, Audit, Certification"
20469,Sonia Gabsi,sonia.gabsi408@hotmail.com,apprenant,+21693418665,Tunisie,Le Kef,1989-10-20,"Certification, Digital transformation"
20470,Ghada Khedher,ghada.khedher841@live.com,apprenant,+21650163843,Tunisie,Sousse,1988-03-04,"Analyse de données, Innovation, Cloud computing, IoT"
20471,Amel Mansouri,amel.mansouri736@live.com,apprenant,+21657360108,Tunisie,Kairouan,1999-10-31,"ITIL, Cybersécurité, Informatique, Audit, E-commerce, Cloud computing"
20472,Fatma Ben Youssef,fatma.ben.youssef332@topnet.tn,apprenant,+21657296937,Tunisie,Sfax,2006-04-22,"Audit, Lean management, Leadership, Entrepreneuriat, Innovation"
20473,Nour Hamza,nour.hamza402@outlook.com,apprenant,+21651321735,Tunisie,Ben Arous,2001-07-19,"Leadership, IoT, Lean management, Informatique, Audit, Stratégie d'entreprise"
20474,Zouheir Ben Ahmed,zouheir.ben.ahmed995@laposte.net,apprenant,+21652168358,Tunisie,Le Kef,1996-06-20,"Machine learning, Mentoring, Lean management"
20475,Ikram Chedly,ikram.chedly638@live.com,apprenant,+21650710712,Tunisie,Ben Arous,1998-10-04,"Digital transformation, Ressources humaines, Innovation, Finance, Leadership, Cybersécurité"
