ID,Nom,Email,Rôle,Téléphone,Pays,Ville,Date de naissance,Centres d'intérêt
20476,Olfa Marzouki,olfa.marzouki198@yahoo.fr,apprenant,+21693551021,Tunisie,Ariana,2004-05-31,"Digital transformation, Communication, Lean management"
20477,Yasmine Chebbi,yasmine.chebbi572@laposte.net,apprenant,+21695380695,Tunisie,Monastir,1990-06-19,"Gestion de projet, Conseil, Leadership, Marketing digital"
20478,Salma Mabrouk,salma.mabrouk713@topnet.tn,apprenant,+21690732119,Tunisie,Kasserine,1987-12-01,"Coaching, Management"
20479,Maher Hamdi,maher.hamdi492@laposte.net,apprenant,+21698233805,Tunisie,Kairouan,1993-07-15,"Cloud computing, Marketing digital, Blockchain"
20480,Hajer Landolsi,hajer.landolsi177@topnet.tn,apprenant,+21694254737,Tunisie,Manouba,1986-05-10,"Formation professionnelle, Coaching"
20481,Zied Miled,zied.miled941@laposte.net,apprenant,+21627777008,Tunisie,Zaghouan,1996-02-26,"E-commerce, ITIL, Développement web, Mentoring, Stratégie d'entreprise"
20482,Emna Feriani,emna.feriani699@orange.tn,apprenant,+21691258656,Tunisie,Mahdia,2001-10-02,"Agile, Technologie, Qualité, Certification"
20483,Takwa Louati,takwa.louati848@live.com,apprenant,+21629166187,Tunisie,Sousse,1987-12-10,"Machine learning, Entrepreneuriat, Cybersécurité, Marketing digital, Conseil, Audit"
20484,Lamia Hassen,lamia.hassen192@yahoo.fr,apprenant,+21698494779,Tunisie,Ariana,2002-07-18,"Audit, Lean management, ITIL, IoT, Conseil"
20485,Sonia Hachicha,sonia.hachicha599@hotmail.com,apprenant,+21628409538,Tunisie,Zaghouan,2001-10-27,"Management, Machine learning, Coaching, Audit"
20486,Rim Chaabane,rim.chaabane671@live.com,apprenant,+21657898166,Tunisie,Kébili,2007-01-13,"Qualité, E-commerce, Cybersécurité"
20487,Amine Benhassan,amine.benhassan711@orange.tn,apprenant,+21696834970,Tunisie,Bizerte,1987-09-04,"Coaching, Business intelligence, Digital transformation, Formation professionnelle, Stratégie d'entreprise, DevOps"
20488,Dali Ghanmi,dali.ghanmi491@live.com,apprenant,+21697021105,Tunisie,Béja,1992-03-19,"Qualité, Mentoring, Lean management, Stratégie d'entreprise, Blockchain"
20489,Chiraz Sellami,chiraz.sellami899@topnet.tn,apprenant,+21694639017,Tunisie,Siliana,2006-09-08,"Machine learning, Technologie, Entrepreneuriat, Management"
20490,Khaled Nabli,khaled.nabli353@hotmail.com,apprenant,+21654912441,Tunisie,Tunis,1989-04-16,"Communication, Management, ITIL, Mentoring"
20491,Thouraya Hmida,thouraya.hmida783@laposte.net,apprenant,+21623505605,Tunisie,Monastir,1997-02-25,"Stratégie d'entreprise, Certification, Finance, Qualité"
20492,Olfa Jouini,olfa.jouini405@live.com,apprenant,+21622680671,Tunisie,Tataouine,1989-03-07,"Marketing digital, Digital transformation, Ressources humaines, Innovation"
20493,Chedly Hleli,chedly.hleli709@hotmail.com,apprenant,+21629084125,Tunisie,Kairouan,2005-10-04,"Conseil, Intelligence artificielle, Informatique, Finance"
20494,Amine Ben Ali,amine.ben.ali728@orange.tn,apprenant,+21623342989,Tunisie,Tozeur,1995-05-02,"Coaching, Innovation"
20495,Wided Jouini,wided.jouini819@yahoo.fr,apprenant,+21694566772,Tunisie,Manouba,1994-05-31,"Finance, Coaching, Entrepreneuriat, Cybersécurité, Machine learning, Cloud computing"
20496,Ali Dali,ali.dali511@yahoo.fr,apprenant,+21626156083,Tunisie,Kébili,1997-05-02,"Conseil, Cloud computing, DevOps"
20497,Jamel Miled,jamel.miled765@outlook.com,apprenant,+21657170102,Tunisie,Mahdia,1998-08-31,"DevOps, ITIL, Stratégie d'entreprise, Innovation"
20498,Wael Nabli,wael.nabli859@topnet.tn,apprenant,+21657088841,Tunisie,Ariana,1998-11-14,"Agile, Intelligence artificielle, Qualité, Machine learning, Mentoring"
20499,Samia Chedly,samia.chedly696@laposte.net,apprenant,+21621554219,Tunisie,Médenine,1994-06-07,"Innovation, Agile, Entrepreneuriat, IoT, Ressources humaines"
20500,Samia Horchani,samia.horchani814@topnet.tn,apprenant,+21624970000,Tunisie,Bizerte,2002-05-08,"Ressources humaines, IoT, Conseil"
20501,Mohamed Neffati,mohamed.neffati928@hotmail.com,apprenant,+21698400399,Tunisie,Tunis,1998-01-22,"Analyse de données, Gestion de projet, Digital transformation, Agile, Certification, Entrepreneuriat"
20502,Zouheir Chaieb,zouheir.chaieb424@laposte.net,apprenant,+21654136377,Tunisie,Ariana,1999-04-07,"Analyse de données, Cybersécurité, Développement web, Qualité, Informatique, Cloud computing"
20503,Salah Chebbi,salah.chebbi398@orange.tn,apprenant,+21620021260,Tunisie,Le Kef,1985-02-20,"Ressources humaines, Digital transformation, IoT, Innovation, Mentoring, Technologie"
20504,Jamel Hleli,jamel.hleli468@hotmail.com,apprenant,+21655779071,Tunisie,Gabès,1994-12-11,"E-commerce, Cybersécurité, Ressources humaines, Audit"
20505,Zied Karray,zied.karray823@hotmail.com,apprenant,+21696066014,Tunisie,Kébili,1986-04-27,"ITIL, Blockchain, Mentoring, Gestion de projet, Audit, Finance"
20506,Intissar Fatnassi,intissar.fatnassi460@hotmail.com,apprenant,+21691364693,Tunisie,Béja,2002-09-03,"Leadership, Intelligence artificielle"
20507,Fethi Gasmi,fethi.gasmi432@gmail.com,apprenant,+21658930566,Tunisie,Sousse,1999-09-09,"Blockchain, Veille technologique, Conseil, Certification, Informatique"
20508,Jihene Chebbi,jihene.chebbi457@gmail.com,apprenant,+21620922671,Tunisie,Gabès,1991-03-27,"Cybersécurité, Leadership, Communication, Mentoring, Gestion de projet"
20509,Ikram Jazi,ikram.jazi249@orange.tn,apprenant,+21626331487,Tunisie,Gabès,1987-03-09,"Coaching, Management"
20510,Ahmed Hachicha,ahmed.hachicha255@yahoo.fr,apprenant,+21695786443,Tunisie,Béja,1993-09-25,"Stratégie d'entreprise, Conseil, Développement web, Finance, Entrepreneuriat"
20511,Mariam Jemli,mariam.jemli500@laposte.net,apprenant,+21620865582,Tunisie,Tozeur,1991-04-25,"Coaching, Finance"
20512,Latifa Kchir,latifa.kchir498@yahoo.fr,apprenant,+21629372229,Tunisie,Béja,2005-10-08,"Stratégie d'entreprise, Informatique, Audit, Analyse de données, Cloud computing, Business intelligence"
20513,Nader Marzouki,nader.marzouki160@outlook.com,apprenant,+21651891688,Tunisie,Kasserine,2001-12-23,"Informatique, Mentoring"
20514,Takwa Ferchichi,takwa.ferchichi376@gmail.com,apprenant,+21693322891,Tunisie,Médenine,1997-06-12,"Ressources humaines, Finance, Stratégie d'entreprise, E-commerce, Business intelligence, Mentoring"
20515,Wided Louati,wided.louati296@live.com,apprenant,+21629449459,Tunisie,Manouba,1988-11-13,"Finance, Management"
20516,Imed Marzouki,imed.marzouki997@yahoo.fr,apprenant,+21691521520,Tunisie,Monastir,2006-11-27,"Stratégie d'entreprise, Formation professionnelle, ITIL"
20517,Mohamed Dridi,mohamed.dridi489@laposte.net,apprenant,+21658641628,Tunisie,Le Kef,1990-09-09,"Leadership, Entrepreneuriat, Management"
20518,Wassim Jemli,wassim.jemli125@live.com,apprenant,+21690206166,Tunisie,Tataouine,1985-07-19,"Ressources humaines, Cybersécurité, Développement web, Coaching"
20519,Nabil Jazi,nabil.jazi757@orange.tn,apprenant,+21621323233,Tunisie,Le Kef,1986-11-20,"Intelligence artificielle, E-commerce, Certification, Développement web, Digital transformation, Formation professionnelle"
20520,Hajer Bouhamed,hajer.bouhamed329@live.com,apprenant,+21696356890,Tunisie,Ariana,1990-08-21,"Certification, Communication, Digital transformation, Informatique"
20521,Intissar Derbali,intissar.derbali819@topnet.tn,apprenant,+21659509793,Tunisie,Gafsa,1991-08-09,"DevOps, Lean management, Formation professionnelle, Digital transformation, Qualité, Communication"
20522,Salah Jazi,salah.jazi538@orange.tn,apprenant,+21621562074,Tunisie,Le Kef,1998-02-27,"Mentoring, Technologie"
20523,Hana Bouslama,hana.bouslama545@orange.tn,apprenant,+21691484057,Tunisie,Bizerte,1988-06-01,"Digital transformation, Entrepreneuriat"
20524,Dalila Daoud,dalila.daoud469@laposte.net,apprenant,+21624040626,Tunisie,Siliana,2007-03-04,"Intelligence artificielle, Digital transformation, ITIL"
20525,Cyrine Horchani,cyrine.horchani923@live.com,apprenant,+21657764523,Tunisie,Ariana,2000-06-19,"Agile, Technologie, Digital transformation, Certification"
20526,Makram Miled,makram.miled365@hotmail.com,apprenant,+21692244333,Tunisie,Ben Arous,2003-09-30,"Entrepreneuriat, Développement web"
20527,Latifa Essid,latifa.essid213@topnet.tn,apprenant,+21657434285,Tunisie,Gafsa,1990-01-31,"Cloud computing, Gestion de projet, Ressources humaines, Marketing digital, Finance"
20528,Lamia Hamdi,lamia.hamdi888@orange.tn,apprenant,+21625262223,Tunisie,Bizerte,2001-06-20,"Innovation, Informatique, Finance, Entrepreneuriat, Veille technologique, Technologie"
20529,Wael Chaieb,wael.chaieb944@orange.tn,apprenant,+21656305021,Tunisie,Manouba,2000-07-24,"Finance, Stratégie d'entreprise, Cloud computing, Cybersécurité"
20530,Salah Rekik,salah.rekik840@laposte.net,apprenant,+21695638216,Tunisie,Gafsa,2005-07-14,"Marketing digital, Conseil, Stratégie d'entreprise"
20531,Nesrine Hajji,nesrine.hajji972@topnet.tn,apprenant,+21690248797,Tunisie,Monastir,2002-10-20,"Intelligence artificielle, E-commerce"
20532,Fares Bouslama,fares.bouslama655@topnet.tn,apprenant,+21690080450,Tunisie,Kébili,2007-11-15,"Certification, Machine learning"
20533,Dali Derbali,dali.derbali337@gmail.com,apprenant,+21693859054,Tunisie,Kairouan,1991-07-07,"Technologie, Ressources humaines, Lean management, Finance, Cybersécurité, Intelligence artificielle"
20534,Rami Chaabane,rami.chaabane298@yahoo.fr,apprenant,+21693078183,Tunisie,Gabès,2000-07-09,"Développement web, E-commerce, Management, Leadership, Business intelligence"
20535,Farouk Miled,farouk.miled230@yahoo.fr,apprenant,+21691007430,Tunisie,Sfax,1985-08-07,"Développement web, Mentoring, Machine learning"
20536,Yasmine Nasri,yasmine.nasri345@topnet.tn,apprenant,+21693473221,Tunisie,Ariana,2003-03-04,"Audit, Développement web"
20537,Zied Landolsi,zied.landolsi340@gmail.com,apprenant,+21654628530,Tunisie,Tataouine,2001-09-02,"Machine learning, Stratégie d'entreprise, Analyse de données, Ressources humaines, Intelligence artificielle"
20538,Ines Jouini,ines.jouini858@laposte.net,apprenant,+21693571003,Tunisie,Jendouba,2003-03-04,"Informatique, Digital transformation, Marketing digital"
20539,Latifa Ouali,latifa.ouali860@gmail.com,apprenant,+21626696116,Tunisie,Kébili,1999-05-04,"IoT, Stratégie d'entreprise, Intelligence artificielle, ITIL, Audit"
20540,Maher Ben Salah,maher.ben.salah991@outlook.com,apprenant,+21690699114,Tunisie,Sousse,2001-11-03,"Certification, Coaching"
20541,Taoufik Fkih,taoufik.fkih780@orange.tn,apprenant,+21652030055,Tunisie,Médenine,1991-12-10,"Mentoring, Stratégie d'entreprise, Formation professionnelle, Lean management, Machine learning"
20542,Sami Nasri,sami.nasri813@orange.tn,apprenant,+21655670629,Tunisie,Gabès,1999-10-19,"Veille technologique, Innovation, Machine learning, Mentoring, Développement web"
20543,Walid Jazi,walid.jazi614@yahoo.fr,apprenant,+21659358149,Tunisie,Jendouba,2001-10-03,"Management, Formation professionnelle, DevOps, Business intelligence"
20544,Dorra Ben Ali,dorra.ben.ali149@yahoo.fr,apprenant,+21693910376,Tunisie,Béja,2003-12-11,"Leadership, Business intelligence, Formation professionnelle, Conseil, Coaching, Gestion de projet"
20545,Rim Hajji,rim.hajji994@yahoo.fr,apprenant,+21624494370,Tunisie,Bizerte,1999-02-23,"Développement web, Ressources humaines"
20546,Ridha Hachicha,ridha.hachicha160@hotmail.com,apprenant,+21655147804,Tunisie,Kairouan,1990-12-08,"Certification, Communication, Cloud computing, Entrepreneuriat"
20547,Amel Mejri,amel.mejri979@hotmail.com,apprenant,+21627615276,Tunisie,Béja,1992-02-01,"IoT, Cloud computing, Entrepreneuriat, Développement web"
20548,Imed Nasri,imed.nasri3@live.com,apprenant,+21622859595,Tunisie,Sidi Bouzid,1994-01-31,"Machine learning, Digital transformation, Stratégie d'entreprise, Conseil, IoT"
20549,Ghazi Sellami,ghazi.sellami589@orange.tn,apprenant,+21699643959,Tunisie,Tataouine,2000-03-22,"Stratégie d'entreprise, Intelligence artificielle, Audit, Innovation, Coaching"
20550,Hiba Derbali,hiba.derbali281@topnet.tn,apprenant,+21657964527,Tunisie,Ariana,1994-01-31,"Stratégie d'entreprise, Veille technologique, Développement web"
20551,Ali Hamza,ali.hamza663@live.com,apprenant,+21695750587,Tunisie,Béja,1997-12-31,"Ressources humaines, Analyse de données, Conseil, Coaching, Blockchain"
20552,Omar Hadj,omar.hadj827@yahoo.fr,apprenant,+21624757941,Tunisie,Kasserine,2006-08-21,"Entrepreneuriat, Finance, Mentoring, Marketing digital, Développement web, Cloud computing"
20553,Rim Ben Salah,rim.ben.salah793@topnet.tn,apprenant,+21655593825,Tunisie,Mahdia,2005-12-01,"Machine learning, Ressources humaines, Cloud computing, Finance, Technologie, Développement web"
20554,Fares Kchir,fares.kchir933@outlook.com,apprenant,+21628112374,Tunisie,Zaghouan,2004-12-16,"Innovation, Machine learning, Technologie, Mentoring, Finance"
20555,Samia Mrad,samia.mrad428@outlook.com,apprenant,+21691410698,Tunisie,Nabeul,2003-04-20,"Gestion de projet, Audit, DevOps, Formation professionnelle, E-commerce"
20556,Walid Ktari,walid.ktari888@yahoo.fr,apprenant,+21694373982,Tunisie,Sidi Bouzid,1991-12-17,"IoT, DevOps, Informatique, Innovation, Développement web"
20557,Wafa Karoui,wafa.karoui304@orange.tn,apprenant,+21659958102,Tunisie,Monastir,2003-01-26,"Business intelligence, Technologie, Coaching, Lean management, Audit, Certification"
20558,Karima Bouaziz,karima.bouaziz808@gmail.com,apprenant,+21627403162,Tunisie,Siliana,2005-04-09,"Finance, IoT, Business intelligence, Management"
20559,Makram Jebali,makram.jebali945@outlook.com,apprenant,+21659968354,Tunisie,Gafsa,2004-10-12,"DevOps, IoT, E-commerce, Qualité"
20560,Slim Ouali,slim.ouali582@yahoo.fr,apprenant,+21626694064,Tunisie,Kasserine,1992-03-18,"E-commerce, Marketing digital, Innovation, Analyse de données, Stratégie d'entreprise, Cybersécurité"
20561,Bassem Jemli,bassem.jemli74@live.com,apprenant,+21622189770,Tunisie,Zaghouan,2004-11-16,"Management, ITIL, E-commerce, Veille technologique"
20562,Bochra Limam,bochra.limam807@outlook.com,apprenant,+21622099601,Tunisie,Sousse,2006-06-11,"Blockchain, ITIL, Communication, Intelligence artificielle, Audit"
20563,Ines Hmida,ines.hmida222@laposte.net,apprenant,+21693866874,Tunisie,Nabeul,1996-01-06,"Blockchain, Ressources humaines, Développement web, E-commerce, Formation professionnelle, Gestion de projet"
20564,Noureddine Daoud,noureddine.daoud420@live.com,apprenant,+21651544365,Tunisie,Ben Arous,2007-09-19,"Coaching, Communication, Technologie, Conseil, Ressources humaines"
20565,Hana Dhouib,hana.dhouib9@topnet.tn,apprenant,+21626887853,Tunisie,Tataouine,1987-09-25,"Blockchain, Formation professionnelle, Technologie, ITIL"
20566,Noureddine Jouini,noureddine.jouini269@outlook.com,apprenant,+21622175548,Tunisie,Siliana,2006-04-02,"Business intelligence, Analyse de données"
20567,Ikram Bouhamed,ikram.bouhamed120@gmail.com,apprenant,+21621324097,Tunisie,Sidi Bouzid,2006-01-12,"Leadership, Cybersécurité"
20568,Bochra Ben Ali,bochra.ben.ali698@orange.tn,apprenant,+21621723276,Tunisie,Bizerte,1987-02-22,"IoT, Innovation"
20569,Khadija Omrani,khadija.omrani391@hotmail.com,apprenant,+21627810594,Tunisie,Nabeul,1996-06-13,"Qualité, Développement web, Entrepreneuriat, Management"
20570,Noureddine Ghali,noureddine.ghali109@outlook.com,apprenant,+21652847234,Tunisie,Le Kef,1991-02-14,"Entrepreneuriat, Innovation, Coaching, Développement web, Qualité, Conseil"
20571,Kenza Ghorbel,kenza.ghorbel781@topnet.tn,apprenant,+21659705700,Tunisie,Sousse,1988-03-12,"Communication, Formation professionnelle, Informatique"
20572,Najoua Daoud,najoua.daoud170@live.com,apprenant,+21695700428,Tunisie,Sfax,1987-09-04,"Informatique, Entrepreneuriat, E-commerce"
20573,Yosra Bouzid,yosra.bouzid403@live.com,apprenant,+21691118047,Tunisie,Kébili,1997-06-23,"Agile, Communication, ITIL, Veille technologique, E-commerce, Gestion de projet"
20574,Thouraya Dridi,thouraya.dridi617@live.com,apprenant,+21694305794,Tunisie,Bizerte,2007-04-07,"Finance, Machine learning, Coaching, Leadership, Technologie"
20575,Taoufik Daoud,taoufik.daoud964@laposte.net,apprenant,+21626974949,Tunisie,Mahdia,2000-12-02,"DevOps, Finance, Innovation, Marketing digital, Informatique"
20576,Fethi Gabsi,fethi.gabsi585@laposte.net,apprenant,+21691897817,Tunisie,Tataouine,2007-05-01,"Certification, Lean management"
20577,Wafa Trabelsi,wafa.trabelsi167@laposte.net,apprenant,+21693945748,Tunisie,Monastir,1987-11-06,"Management, Qualité"
20578,Maher Fatnassi,maher.fatnassi506@laposte.net,apprenant,+21629906995,Tunisie,Bizerte,1989-12-24,"Finance, Agile, Qualité, Mentoring, Coaching"
20579,Cyrine Bouhamed,cyrine.bouhamed388@laposte.net,apprenant,+21629446420,Tunisie,Médenine,1990-12-26,"DevOps, Cloud computing, Entrepreneuriat, Stratégie d'entreprise"
20580,Dorsaf Gharbi,dorsaf.gharbi989@outlook.com,apprenant,+21623852156,Tunisie,Zaghouan,1999-03-19,"Cloud computing, Gestion de projet, Développement web, Veille technologique, Informatique"
20581,Fethi Jazi,fethi.jazi831@orange.tn,apprenant,+21657361042,Tunisie,Jendouba,1986-05-09,"Communication, Agile"
20582,Sami Chedly,sami.chedly792@gmail.com,apprenant,+21691400823,Tunisie,Kébili,2005-02-25,"Agile, Digital transformation, DevOps, Cybersécurité"
20583,Mariam Khedher,mariam.khedher466@topnet.tn,apprenant,+21693701704,Tunisie,Gabès,1999-06-15,"Agile, Coaching, IoT, Intelligence artificielle"
20584,Fatma Landolsi,fatma.landolsi614@hotmail.com,apprenant,+21695490752,Tunisie,Gafsa,2007-04-02,"Conseil, Innovation, DevOps, Ressources humaines, Analyse de données, Blockchain"
20585,Khaled Jazi,khaled.jazi762@live.com,apprenant,+21696664147,Tunisie,Bizerte,2001-11-19,"Certification, Audit, Business intelligence, Gestion de projet, Marketing digital, Leadership"
20586,Rim Hmida,rim.hmida67@laposte.net,apprenant,+21697179981,Tunisie,Mahdia,1997-01-20,"Conseil, Audit, Blockchain, DevOps, Technologie, Certification"
20587,Nabil Dali,nabil.dali59@live.com,apprenant,+21625616273,Tunisie,Ben Arous,1994-08-22,"Machine learning, Gestion de projet, Cloud computing"
20588,Zohra Dridi,zohra.dridi840@laposte.net,apprenant,+21693788124,Tunisie,Médenine,2006-10-21,"Machine learning, Certification, Technologie, Communication, Blockchain"
20589,Wassim Hamza,wassim.hamza663@laposte.net,apprenant,+21657893805,Tunisie,Bizerte,1985-04-23,"Développement web, IoT"
20590,Fadia Chedly,fadia.chedly737@laposte.net,apprenant,+21629036791,Tunisie,Ben Arous,1998-03-19,"Stratégie d'entreprise, DevOps, Lean management, Coaching, Formation professionnelle, Informatique"
20591,Mariam Hamza,mariam.hamza839@outlook.com,apprenant,+21624035066,Tunisie,Mahdia,2006-04-13,"IoT, Intelligence artificielle"
20592,Wafa Dridi,wafa.dridi477@live.com,apprenant,+21654900891,Tunisie,Sfax,1990-04-26,"Cybersécurité, Formation professionnelle, Leadership, Lean management"
20593,Bilel Horchani,bilel.horchani269@live.com,apprenant,+21656769215,Tunisie,Zaghouan,1998-07-06,"Ressources humaines, Développement web, Machine learning"
20594,Yosra Gasmi,yosra.gasmi236@live.com,apprenant,+21625065343,Tunisie,Kasserine,1989-06-15,"Stratégie d'entreprise, Blockchain, Lean management, Mentoring, Machine learning"
20595,Mariam Rekik,mariam.rekik151@orange.tn,apprenant,+21696527777,Tunisie,Monastir,2000-09-26,"Cloud computing, Leadership, Certification"
20596,Rania Omrani,rania.omrani624@yahoo.fr,apprenant,+21659163404,Tunisie,Monastir,2003-07-01,"Innovation, Gestion de projet, Finance, Développement web"
20597,Thouraya Mestiri,thouraya.mestiri507@live.com,apprenant,+21658942969,Tunisie,Ariana,1987-11-06,"Technologie, Business intelligence, Entrepreneuriat"
20598,Slim Kammoun,slim.kammoun801@gmail.com,apprenant,+21657449717,Tunisie,Kébili,2006-05-16,"Cybersécurité, Finance, Gestion de projet"
20599,Wael Landolsi,wael.landolsi3@hotmail.com,apprenant,+21693640829,Tunisie,Ben Arous,1988-04-03,"Analyse de données, Veille technologique, Business intelligence, Gestion de projet, Conseil"
20600,Aymen Hadj,aymen.hadj546@gmail.com,apprenant,+21651584540,Tunisie,Tozeur,1986-01-19,"Digital transformation, Veille technologique, IoT, Coaching"
20601,Fatma Feriani,fatma.feriani685@live.com,apprenant,+21653411913,Tunisie,Tataouine,2005-06-03,"E-commerce, Coaching, Communication"
20602,Latifa Daoud,latifa.daoud689@yahoo.fr,apprenant,+21698264040,Tunisie,Monastir,1988-11-03,"Cybersécurité, IoT, Qualité, E-commerce, Formation professionnelle"
20603,Bassem Trabelsi,bassem.trabelsi769@outlook.com,apprenant,+21623214532,Tunisie,Nabeul,1990-09-02,"Stratégie d'entreprise, Leadership, Formation professionnelle, Lean management"
20604,Farouk Miled,farouk.miled328@outlook.com,apprenant,+21620160914,Tunisie,Manouba,1991-03-18,"Intelligence artificielle, Cloud computing, Innovation, Stratégie d'entreprise"
20605,Nour Hajji,nour.hajji128@live.com,apprenant,+21696904816,Tunisie,Béja,1985-05-22,"IoT, Certification, Ressources humaines, Coaching, Développement web"
20606,Slim Chedly,slim.chedly603@hotmail.com,apprenant,+21650858046,Tunisie,Ben Arous,2006-01-24,"Entrepreneuriat, Gestion de projet, Audit, Veille technologique, Formation professionnelle"
20607,Myriam Ghali,myriam.ghali859@hotmail.com,apprenant,+21692256971,Tunisie,Le Kef,1994-06-17,"Mentoring, Management"
20608,Ahmed Maaloul,ahmed.maaloul638@gmail.com,apprenant,+21624603514,Tunisie,Gabès,2005-07-03,"ITIL, Cybersécurité, Cloud computing, Gestion de projet, Lean management, Communication"
20609,Walid Jouini,walid.jouini635@outlook.com,apprenant,+21627573230,Tunisie,Jendouba,2006-08-20,"IoT, Intelligence artificielle"
20610,Karima Karoui,karima.karoui51@laposte.net,apprenant,+21696576272,Tunisie,Zaghouan,1997-08-08,"E-commerce, Veille technologique, Leadership"
20611,Nader Jazi,nader.jazi306@gmail.com,apprenant,+21620693556,Tunisie,Siliana,1992-07-06,"Audit, Innovation, DevOps, Cloud computing, Entrepreneuriat, Certification"
20612,Dorra Dhouib,dorra.dhouib158@laposte.net,apprenant,+21656314503,Tunisie,Médenine,2006-11-07,"Intelligence artificielle, Cloud computing, Lean management, Communication, IoT, Agile"
20613,Ines Mahjoub,ines.mahjoub657@gmail.com,apprenant,+21628073328,Tunisie,Kasserine,2006-09-30,"Audit, Digital transformation, Leadership, Formation professionnelle"
20614,Imed Ferchichi,imed.ferchichi540@live.com,apprenant,+21659943970,Tunisie,Monastir,2003-10-26,"Cybersécurité, E-commerce, Entrepreneuriat, ITIL, Agile, Gestion de projet"
20615,Wafa Benhassan,wafa.benhassan960@laposte.net,apprenant,+21659274229,Tunisie,Tataouine,2004-06-24,"Management, Qualité"
20616,Chiraz Landolsi,chiraz.landolsi968@live.com,apprenant,+21653124847,Tunisie,Kébili,2003-03-12,"Qualité, Cloud computing"
20617,Ahlem Laabidi,ahlem.laabidi540@outlook.com,apprenant,+21696230009,Tunisie,Gabès,1999-04-24,"Lean management, IoT, Veille technologique, Stratégie d'entreprise"
20618,Yosra Bouhamed,yosra.bouhamed829@live.com,apprenant,+21656066227,Tunisie,Sfax,1993-04-20,"Digital transformation, Stratégie d'entreprise, Veille technologique, DevOps, E-commerce, Business intelligence"
20619,Wael Laabidi,wael.laabidi807@topnet.tn,apprenant,+21653498644,Tunisie,Béja,1991-06-30,"Lean management, Innovation, IoT, Finance, Cloud computing, Ressources humaines"
20620,Amel Ouali,amel.ouali142@laposte.net,apprenant,+21629004985,Tunisie,Jendouba,2006-06-30,"Digital transformation, Cloud computing, Développement web, ITIL"
20621,Emna Dridi,emna.dridi188@orange.tn,apprenant,+21655855995,Tunisie,Sfax,1995-04-22,"Audit, Intelligence artificielle, Lean management, Management, Cloud computing"
20622,Chiraz Ben Ahmed,chiraz.ben.ahmed937@hotmail.com,apprenant,+21654614461,Tunisie,Tataouine,1989-02-13,"Finance, Développement web, Digital transformation, Management, Formation professionnelle, Cybersécurité"
20623,Amine Ezzine,amine.ezzine880@live.com,apprenant,+21657117239,Tunisie,Kairouan,2000-09-24,"Machine learning, Informatique, Lean management, E-commerce"
20624,Ali Fatnassi,ali.fatnassi485@yahoo.fr,apprenant,+21694439467,Tunisie,Médenine,1996-07-11,"Stratégie d'entreprise, Management, E-commerce, Cybersécurité"
20625,Takwa Ben Ahmed,takwa.ben.ahmed737@live.com,apprenant,+21627266153,Tunisie,Tozeur,1986-01-21,"Marketing digital, Cloud computing, Digital transformation, Audit, Machine learning"
20626,Hiba Laabidi,hiba.laabidi685@laposte.net,apprenant,+21624497356,Tunisie,Gafsa,2004-11-13,"DevOps, Veille technologique, E-commerce, Agile, Intelligence artificielle, Management"
20627,Khaled Fatnassi,khaled.fatnassi113@yahoo.fr,apprenant,+21628484079,Tunisie,Gabès,1989-07-24,"Entrepreneuriat, Lean management, Leadership, Communication, Coaching, Certification"
20628,Makram Mejri,makram.mejri317@gmail.com,apprenant,+21629839029,Tunisie,Mahdia,1997-07-19,"Certification, Ressources humaines, Blockchain, Cybersécurité"
20629,Yassine Chaabane,yassine.chaabane970@orange.tn,apprenant,+21691580934,Tunisie,Sfax,1996-01-16,"Innovation, Mentoring, E-commerce"
20630,Ahmed Chaieb,ahmed.chaieb258@gmail.com,apprenant,+21629093306,Tunisie,Tataouine,1986-09-19,"Finance, E-commerce, Leadership, Conseil"
20631,Amel Derbali,amel.derbali896@orange.tn,apprenant,+21652119920,Tunisie,Gabès,2005-11-12,"IoT, Qualité, Agile, Innovation"
20632,Khadija Fatnassi,khadija.fatnassi165@yahoo.fr,apprenant,+21625547408,Tunisie,Sidi Bouzid,2001-03-22,"Finance, Certification, Informatique, ITIL"
20633,Rim Laabidi,rim.laabidi428@outlook.com,apprenant,+21657575697,Tunisie,Sfax,1992-09-16,"Audit, Leadership, Blockchain, Coaching, Innovation"
20634,Khaled Maaloul,khaled.maaloul743@laposte.net,apprenant,+21657722797,Tunisie,Tozeur,2004-12-18,"DevOps, Coaching"
20635,Zied Laabidi,zied.laabidi230@hotmail.com,apprenant,+21654786926,Tunisie,Sousse,1986-12-24,"Intelligence artificielle, Machine learning, Finance"
20636,Slim Mansouri,slim.mansouri898@laposte.net,apprenant,+21659332612,Tunisie,Sfax,1996-12-02,"Intelligence artificielle, Lean management, Digital transformation, Entrepreneuriat, Développement web, Leadership"
